rank,uri,artist_names,track_name,source,peak_rank,previous_rank,weeks_on_chart,streams
1,"spotify:track:2HRgqmZQC0MC7GeNuDIXHN","Jung Kook, Latto","Seven (feat. Latto) (Explicit Ver.)","BIGHIT MUSIC",1,1,62,"3503317"
2,"spotify:track:7tI8dRuH2Yc6RuoTjxo4dU","Jimin","Who","BIGHIT MUSIC",1,2,9,"1940788"
3,"spotify:track:2KslE17cAJNHTsI2MI0jb2","Jung Kook","Standing Next to You","BIGHIT MUSIC",1,3,45,"1431544"
4,"spotify:track:5IZDnmnMBzLnE6APoYL26d","Vũ., Binz","bình yên","WM Vietnam",4,4,3,"1394677"
5,"spotify:track:2N0SPREDYqILVEFSsWF5N5","V","Love Me Again","BIGHIT MUSIC",2,6,58,"954001"
6,"spotify:track:2plbrEY59IikOBgBGLjaoe","Lady Gaga, Bruno Mars","Die With A Smile","Interscope",4,7,5,"938768"
7,"spotify:track:2GE2p2dFpxp7OIz2QOFBzW","ANH TRAI ""SAY HI"", HURRYKNG, HIEUTHUHAI, Negav, Pháp Kiều, Isaac","KIM PHÚT, KIM GIỜ (feat. HURRYKNG, HIEUTHUHAI, Negav, Pháp Kiều & Isaac)","Anh Trai Say Hi",5,8,4,"923227"
8,"spotify:track:4nXrVH5xwN1w6TpmP7uu8n","HIEUTHUHAI, marzuz","Exit Sign","M Music Records",8,10,49,"717662"
9,"spotify:track:5oFEvbM7lGnx8jfAkuhVyo","AMEE, RPT MCK","MỘNG YU","Yin Yang Media",3,9,7,"711135"
10,"spotify:track:4fj4Jn4nw8fGX8xdbCntJf","CoolKid, RHYDER","Sau Cơn Mưa","MaiDao Music",8,12,55,"663814"
11,"spotify:track:31VNCmwspR7nVJ6kruUuJt","Sơn Tùng M-TP","Đừng Làm Trái Tim Anh Đau","Universal Music Indochina Distributed Labels",1,11,15,"625691"
12,"spotify:track:0BX2eDMZJrGzApf4ZGXrFi","ANH TRAI ""SAY HI"", HIEUTHUHAI, ERIK, Anh Tú Atus, JSOL, Orange","NGÁO NGƠ (feat. HIEUTHUHAI, ERIK, Anh Tú Atus, JSOL & Orange)","Anh Trai Say Hi",6,13,7,"618752"
13,"spotify:track:7gSQxwCpEMjg8wb6Y3oqe7","ANH TRAI ""SAY HI"", RHYDER, Dương Domic, Pháp Kiều","HÀO QUANG (feat. RHYDER, Dương Domic & Pháp Kiều)","Anh Trai Say Hi",6,16,10,"587612"
14,"spotify:track:07d8eaOuAWdC0DANq3tdPd","ANH TRAI ""SAY HI"", HIEUTHUHAI","QUAY ĐI QUAY LẠI (feat. HIEUTHUHAI)","Anh Trai Say Hi",14,17,3,"573422"
15,"spotify:track:2oVLEoBVDvYrGmzrU7dEm5","ANH TRAI ""SAY HI"", Dương Domic","TRÀN BỘ NHỚ (feat. Dương Domic)","Anh Trai Say Hi",15,112,2,"556943"
16,"spotify:track:26zqmmkqUK6mCc87XDzPym","ANH TRAI ""SAY HI"", RHYDER, Captain, Quang Hùng MasterD, WEAN, Ali Hoàng Dương","CHÂN THÀNH (feat. RHYDER, Captain, Quang Hùng MasterD, WEAN & Ali Hoàng Dương)","Anh Trai Say Hi",14,19,5,"548290"
17,"spotify:track:3JIfmjJbanxJkwaPzYa2gN","ANH TRAI ""SAY HI"", Quân A.P, Pháp Kiều, Quang Trung, Ali Hoàng Dương, Lâm Bảo Ngọc","REGRET (feat. Quân A.P, Pháp Kiều, Quang Trung, Ali Hoàng Dương & Lâm Bảo Ngọc)","Anh Trai Say Hi",5,14,7,"543252"
18,"spotify:track:3ZbZtdEw9U0uZW4tZItIwq","RHYDER, CoolKid, BAN","Chịu Cách Mình Nói Thua","RHYDER",6,20,43,"505027"
19,"spotify:track:4WZf4gJ2MvBec6XPdUiqcq","ANH TRAI ""SAY HI"", RHYDER, Jmi Ko","ANH BIẾT RỒI (feat. Rhyder, Jmi Ko)","Anh Trai Say Hi",15,15,3,"488262"
20,"spotify:track:1K0HQ30Wc11okzlcnFA7Ub","HIEUTHUHAI","Không Thể Say","M Music Records",7,18,74,"477896"
21,"spotify:track:7Cjsw965r7mVK888ZqP6Wo","Negav","Mình Anh Thôi","MIXUS",21,58,2,"416278"
22,"spotify:track:2ZqTbIID9vFPTXaGyzbb4q","Megan Thee Stallion, RM","Neva Play (feat. RM of BTS)","Hot Girl Productions",5,5,2,"405656"
23,"spotify:track:2uZmeuNAxSm7XfVIwLkhCx","Ronboogz","nhắn nhủ","MaiDao Music",14,34,40,"390437"
24,"spotify:track:1o6cYDMHvKOfizi4d9Lqxr","W/N","id 072019","Universal Music Indochina Distributed Labels",3,25,60,"384302"
25,"spotify:track:6D94p9ASguBcYlDC0o56vx","HIEUTHUHAI","NOLOVENOLIFE","M Music Records",24,27,49,"383330"
26,"spotify:track:0s7RyyUlQfd8mnnboHe18n","MANBO, HIEUTHUHAI, HURRYKNG","Hẹn Gặp Em Dưới Ánh Trăng","Gerdnang",22,22,27,"380944"
27,"spotify:track:7tFwBnuaGXqiiONukPRaCo","Minh Huy","Miên Man","LOOPS Music",11,24,55,"376868"
28,"spotify:track:6r5o9yIc16ZvymXUKJQ1yy","W/N","2 4","W NATION",8,21,7,"374346"
29,"spotify:track:7kKu4NWeBh01I6aTIEP9bg","ANH TRAI ""SAY HI"", Quang Hùng MasterD","TRÓI EM LẠI (feat. Quang Hùng MasterD)","Anh Trai Say Hi",29,138,2,"368933"
30,"spotify:track:4qYfRfSxsmhJ1WMaywtLyI","Wren Evans, itsnk","Từng Quen","Universal Music Indochina",1,31,47,"365717"
31,"spotify:track:4CUvVaAYuXtvYURLFz7EIL","Emcee L (Da LAB), Da LAB, Muộii (Starry Night)","Chuyện Đôi Ta (feat. Muộii)","Yin Yang Media",3,23,146,"362261"
32,"spotify:track:2a5hng9yXtbjtTVVm9UviC","Vũ Cát Tường","Mơ","Universal Music Indochina Distributed Labels",21,37,108,"354081"
33,"spotify:track:1bG6Q8sR8jda7ryI365y8o","Vũ., Dear Jane","Những Lời Hứa Bỏ Quên","WM Vietnam",1,33,40,"353498"
34,"spotify:track:4gaxEUZE4z9pJAVTSFwgQI","14 Casper, Bon Nghiêm, buitruonglinh","một đời","DANDERLÉON",32,39,25,"353105"
35,"spotify:track:2xOhv7XudrBDtkID1jwsFE","Vũ Cát Tường","Từng Là","Universal Music Indochina Distributed Labels",2,28,29,"351803"
36,"spotify:track:78lw4wahFNotXb0mOEtPkM","WEAN","BADBYE","WEAN",20,29,30,"345262"
37,"spotify:track:6VXVYATpQXEIoZ97NnWCmn","Madihu, Vũ.","Vì Anh Đâu Có Biết","WM Vietnam",2,41,111,"342013"
38,"spotify:track:3a2Oftcs10wtzw6AmxuTMU","Olew","Rồi Ta Sẽ Ngắm Pháo Hoa Cùng Nhau","LOOPS Music",8,51,87,"338565"
39,"spotify:track:1zzCiwKpbS6zNC3OAdejd2","ANH TRAI ""SAY HI"", RHYDER, WEAN, Đức Phúc, Hùng Huỳnh, tlinh","I'M THINKING ABOUT YOU (feat. RHYDER, WEAN, Đức Phúc, Hùng Huỳnh & tlinh)","Anh Trai Say Hi",15,26,6,"333609"
40,"spotify:track:4jWmhzf53Q0ZvZMuGdiR9x","WEAN, tlinh","shhhhhhh..","WEAN",9,38,50,"328823"
41,"spotify:track:5ECHJ1llWBNYLVCYrllD3x","Da LAB, Phương Ly","Chạy Khỏi Thế Giới Này","LOOPS Music",11,42,116,"321556"
42,"spotify:track:3OVMe3H6iAxbLF8iD2UYrw","Sơn Tùng M-TP","Chúng Ta Của Tương Lai","Universal Music Indochina Distributed Labels",1,43,28,"321288"
43,"spotify:track:6f7M5UzYYeLFCMIBQhxk2J","Rhymastic","Lặng","Universal Music Indochina Distributed Labels",7,32,11,"320961"
44,"spotify:track:5PLjpBivzvuaIIqqkQgnRK","GREY D, tlinh","vaicaunoicokhiennguoithaydoi","M Music Records",2,47,118,"320271"
45,"spotify:track:5YiNxgEQQTuFi5dKLxxjWm","ANH TRAI ""SAY HI"", Quang Hùng MasterD, Negav, Công Dương, NICKY","CATCH ME IF YOU CAN (feat. Quang Hùng MasterD, Negav, Công Dương & Nicky)","Anh Trai Say Hi",11,44,11,"318250"
46,"spotify:track:4exlWP8cokkWVCvyP3kg7c","tlinh, 2pillz","nếu lúc đó","Universal Music Indochina Distributed Labels",1,46,81,"314677"
47,"spotify:track:5PGh9MyKry8slG5AfvD1eD","Obito, Shiki, VSTRA","Hà Nội","12 trái lê",10,40,50,"314140"
48,"spotify:track:65aTHDZWUdh6WIafu9MtNF","HIEUTHUHAI, Negav, Kewtiie","ngủ một mình (tình rất tình)","M Music Records",2,48,92,"303722"
49,"spotify:track:5BTzf3doGTigDIYUFtbkI9","Emcee L (Da LAB), Da LAB, Badbies","Sinh Ra Đã Là Thứ Đối Lập Nhau (feat. Badbies)","Yin Yang Media",5,53,195,"301511"
50,"spotify:track:5ydjxBSUIDn26MFzU3asP4","V","Rainy Days","BIGHIT MUSIC",3,87,19,"297414"
51,"spotify:track:3Alwi53Ahc2GwHgvel42b2","Lou Hoàng","Ngày Đẹp Trời Để Nói Chia Tay","WM Vietnam",4,36,14,"295718"
52,"spotify:track:5J3m0taZ0W1E9HTE0MwcSv","Low G","Simp Gái 808","Rap Nhà Làm",9,56,49,"295268"
53,"spotify:track:1pwyiEOvhXLvlpzTZcgfhe","ANH TRAI ""SAY HI"", Negav, GREY D","CHÀNG KHỜ THUỶ CUNG (feat. Negav & GREY D)","Anh Trai Say Hi",53,59,3,"291815"
54,"spotify:track:5TtNxUZBjYR4wgzOpHpS7h","ANH TRAI ""SAY HI"", HIEUTHUHAI, JSOL, Ali Hoàng Dương, Vũ Thịnh","LOVE SAND (feat. HIEUTHUHAI, JSOL, Ali Hoàng Dương & Vũ Thịnh)","Anh Trai Say Hi",23,45,11,"290993"
55,"spotify:track:4sgMbwl9lXGyHcHmtFYGMm","aespa","Supernova","SM Entertainment",15,52,15,"284142"
56,"spotify:track:7jLSThU5Kg1RWt19Leiaxm","RPT MCK, Trung Trần","Chìm Sâu","N0L4B3L",1,60,134,"282309"
57,"spotify:track:3uT8QfoX0BE8ZJa4h98LDW","Puppy, Dangrangto","Wrong Times","MaiDao Music",38,70,46,"280701"
58,"spotify:track:68vprHs3lxe8uNUpyXZcM8","ANH TRAI ""SAY HI"", HIEUTHUHAI, Dương Domic, Song Luân, JSOL, Trần Đăng Dương","SAO HẠNG A (feat. HIEUTHUHAI, Dương Domic, Song Luân, Jsol & Trần Đăng Dương)","Anh Trai Say Hi",58,-1,1,"279376"
59,"spotify:track:1J12HjUuXfJnaUdubTEzSR","HIEUTHUHAI","Nghe Như Tình Yêu","M Music Records",46,50,157,"278264"
60,"spotify:track:6P7xEmk7ZZYz0AV84uOwiW","AMEE","Cuộc gọi lúc nửa đêm","Yin Yang Media",11,35,7,"273021"
61,"spotify:track:5XfGQZA0ioQAWUjlyJRcHc","Shiki, Obito","1000 Ánh Mắt","12 trái lê",8,64,12,"272815"
62,"spotify:track:3DLtPObflLQBodZN8qGODT","JustaTee, BigDaddy","2AM","WM Vietnam",18,66,125,"270099"
63,"spotify:track:4HgTGTXHt1zie3upsI50zm","Ngô Lan Hương","Đi Giữa Trời Rực Rỡ - From ""Đi Giữa Trời Rực Rỡ""","SK Pictures",63,63,4,"269916"
64,"spotify:track:7CyPwkp0oE8Ro9Dd5CUDjW","The Weeknd, JENNIE, Lily-Rose Depp","One Of The Girls (with JENNIE, Lily Rose Depp)","XO / Republic Records",11,69,65,"266349"
65,"spotify:track:0PBTlQ84CBJF0tBnKGmQa6","V","FRI(END)S","BIGHIT MUSIC",1,30,27,"263222"
66,"spotify:track:5T6j0rfpCDBzAxC8Fpd0N7","Low G, Thắng","An Thần","Rap Nhà Làm",2,49,152,"261145"
67,"spotify:track:4cdlZnUEuT8EYisPQkf01g","MONO, 2pillz","Đi Tìm Tình Yêu","M Music Records",61,61,3,"259643"
68,"spotify:track:7kgzRBNkBRArtTPkYjWLYT","14 Casper, Bon Nghiêm","bao tiền một mớ bình yên?","DANDERLÉON",9,71,178,"255206"
69,"spotify:track:0A0oqleZkyD8FN6aW48Jzn","Khiem","Yên Bình Có Quá Đắt Không","Universal Music Indochina Distributed Labels",12,62,11,"253916"
70,"spotify:track:5iZHnufFUgATzrpGgH1K0W","T.R.I","Ánh Sao Và Bầu Trời","Yin Yang Media",1,78,150,"245821"
71,"spotify:track:1J3SmWwlYAG68LGKr86MVH","Sơn Tùng M-TP","Chúng Ta Của Hiện Tại","Universal Music Indochina Distributed Labels",1,68,196,"245685"
72,"spotify:track:0RKggS4he8LozKqMv09IrM","ANH TRAI ""SAY HI"", HURRYKNG, HIEUTHUHAI, Negav, Pháp Kiều, Isaac","WALK (feat. HURRYKNG, HIEUTHUHAI, Negav, Pháp Kiều & Isaac)","Anh Trai Say Hi",41,57,5,"242903"
73,"spotify:track:0SLzsfxED15vyUccX4bCqo","tlinh, Low G","HOP ON DA SHOW","M Music Records",73,-1,1,"241058"
74,"spotify:track:2wZAvkgiOE5tyrnqhB69KA","Sơn Tùng M-TP","Âm Thầm Bên Em","Universal Music Indochina Distributed Labels",34,79,204,"239723"
75,"spotify:track:0QzuaeCEEOV40Pn7IvKEny","Dhruv","double take","Little Worry/RCA Records",8,83,176,"238556"
76,"spotify:track:7j3XQm7RR8T2EzaYtYK4rc","W/N, Tezzy, Tien","Crush 2","RioX Records",51,74,117,"238109"
77,"spotify:track:3ukrFH17Zl6iEZ2QJ1Zwiy","RPT Orijinn, Ronboogz","Don't Côi","Rapital",3,80,91,"237367"
78,"spotify:track:5J90ah0ppUSev1uahqQiN6","Andiez, AMEE","Anh Đánh Rơi Người Yêu Này","MaiDao Music",19,72,98,"235053"
79,"spotify:track:6KgZf5gZgF1KLNxq1qZgHP","Phương Ly","Anh Là Ngoại Lệ Của Em","WM Vietnam",7,75,50,"233760"
80,"spotify:track:27Z9T0mSWHYWSj9SNOGvyt","JustaTee, Phương Ly","Thằng Điên","NGUYEN THANH TUAN",2,82,111,"231658"
81,"spotify:track:3A9A7mfVDVm3rrS9SMGhg5","Kha","Hư không","MaiDao Music",22,76,36,"229797"
82,"spotify:track:5Bti0azlFhMattVY76qFr9","Vũ.","Lạ Lùng","WM Vietnam",17,99,337,"223349"
83,"spotify:track:0vkExWiBJSrfWnlMC7x48b","UMIE","Không Yêu Xin Đừng Nói - Piano Version","LOOPS Music",37,90,81,"217604"
84,"spotify:track:0gzpqwLf1jhNjnSJEyweAX","Kuun Đức Nam, Linh Thộn","Tình cờ yêu em","MaiDao Music",12,89,56,"216660"
85,"spotify:track:5tdz7T4hTxA1ipJMBe24uX","AMEE","ex's hate me, Pt.2","Yin Yang Media",13,95,100,"216117"
86,"spotify:track:3LWVXp636uLT356Rj08Jaz","Jimin","Be Mine","BIGHIT MUSIC",7,55,9,"215928"
87,"spotify:track:4vfhartd7HDWGJbdVIycEu","Sơn Tùng M-TP","Muộn Rồi Mà Sao Còn","Universal Music Indochina Distributed Labels",1,88,178,"215579"
88,"spotify:track:1xoadYaxtOp9gHDwgmPDuz","JSOL, Hoàng Duyên","Sài Gòn Hôm Nay Mưa","Universal Music Indochina",3,73,173,"215284"
89,"spotify:track:6dOtVTDdiauQNBQEDOtlAB","Billie Eilish","BIRDS OF A FEATHER","Darkroom/Interscope Records",63,81,18,"214902"
90,"spotify:track:1GJ3suxtUVaguVQRemw6Zp","Andiez","Suýt Nữa Thì...","MaiDao Music",82,93,115,"213385"
91,"spotify:track:6uxuJ8Fr1AAfSPJUF9N1yr","Vũ.","Bước Qua Mùa Cô Đơn","WM Vietnam",1,107,197,"212914"
92,"spotify:track:6jcLKVmEKAQIXIVHJZ8vzS","MONSTAR, GREY D, NICKY, VƯƠNG BÌNH","tình yêu chậm trễ","Yin Yang Media",46,120,93,"212375"
93,"spotify:track:5h1BN75CEh8wdSwE1xrbSe","V","Slow Dancing","BIGHIT MUSIC",2,157,29,"212084"
94,"spotify:track:4OXAneZHFJyQV1RuzCzmH3","VSOUL, RPT MCK, Obito, Ronboogz, Boyzed","Buồn Hay Vui (feat. RPT MCK, Obito, Ronboogz & Boyzed)","12 trái lê",3,77,39,"210936"
95,"spotify:track:7pqx5vF7DzkVtEdsXQ9iua","ANH TRAI ""SAY HI"", Quân A.P, HURRYKNG, Hùng Huỳnh","ĐẦU ĐỘI SỪNG (feat. Quân A.P, HURRYKNG & Hùng Huỳnh)","Anh Trai Say Hi",48,86,10,"209100"
96,"spotify:track:2n00rcPaXcWfFB9irOKOmh","Ronboogz","Anh Chỉ Muốn","MaiDao Music",77,96,36,"207808"
97,"spotify:track:0ezCZF82GYZFV1W6W1os7N","W/N, 267","id thang máy (feat. 267)","W NATION",10,67,7,"206031"
98,"spotify:track:0fGJiHH6xSUJU1MAVjxq5m","Karik, GDucky","Bạn Đời","WM Vietnam",5,94,51,"205631"
99,"spotify:track:1MiJk3dXC5jzhvLFP0dUM7","Da LAB","Thức Giấc","Yin Yang Media",1,108,167,"205583"
100,"spotify:track:7zxfM3Hi0cdeCsORWtXGKs","ANH TRAI ""SAY HI"", Quang Hùng MasterD, Negav, Pháp Kiều, ERIK","TÌNH ĐẦU QUÁ CHÉN (feat. Quang Hùng MasterD, Negav, Pháp Kiều & Erik)","Anh Trai Say Hi",100,-1,1,"204977"
101,"spotify:track:5LQpQ6SDeaz6SIkR0lvsoC","GREY D, Chillies","đưa em về nhàa","M Music Records",3,103,74,"204273"
102,"spotify:track:7yfcQynap4xcNqnydaFw83","SOOBIN, tlinh","Ai Mà Biết Được (feat. tlinh)","WDND",9,84,13,"202783"
103,"spotify:track:5C1O3fpMsiisJpHiB1uuDf","52Hz, RIO","ĐỢI (Prod. RIO)","DAO Entertainment",13,101,37,"201594"
104,"spotify:track:3ET3xHCLMGd57u06A9RjJ0","Ronboogz","Nói Dối","MaiDao Music",79,124,46,"201467"
105,"spotify:track:3hqOrxH5qPlvrApcb7Ac8c","Ronboogz","Lan Man","MaiDao Music",33,135,75,"199640"
106,"spotify:track:3YctJXK6kznnWl68TnYobN","RPT MCK","Anh Đã Ổn Hơn","N0L4B3L",3,100,81,"199223"
107,"spotify:track:28bxbqNcAuNxYDZYet6eZ7","RPT MCK, tlinh","Chỉ Một Đêm Nữa Thôi","N0L4B3L",9,116,81,"197022"
108,"spotify:track:5uyNAX6MazVAjBjVeOsTvp","W/N, Duongg, Nâu","3 1 0 7 (feat. Duongg & Nâu)","HONG AN ENTERTAIMENT,.JSC",11,102,215,"195517"
109,"spotify:track:6kCU6i8iRrAAmJJ8Sj4JYC","Shartnuss, Tr.D, Phankeo","Nắng có mang em về","MaiDao Music",44,129,32,"192566"
110,"spotify:track:4oGgxjxVOI69h9uOpHOzwn","Wren Evans","Để Ý","Universal Music Indochina Distributed Labels",10,85,14,"192126"
111,"spotify:track:4qJSUFwZFouto5VZUlln75","tlinh, Trung Trần","Thích Quá Rùi Nà","Universal Music Indochina Distributed Labels",34,110,209,"191316"
112,"spotify:track:2pm7K14nHj2fLrpU8j9bit","PC","10 Ngàn Năm","12 trái lê",27,109,119,"189994"
113,"spotify:track:1UQNU5O9VttUgO16pxUnjw","Obito, Shiki, RPT MCK","Đánh Đổi","12 trái lê",7,98,50,"189494"
114,"spotify:track:45PPoUgqs3JrhkZGEzSUHT","W/N, ERIK, Nau","3107 4 (feat. Erik, Nâu)","Universal Music Indochina Distributed Labels",24,117,75,"187695"
115,"spotify:track:6xKs4CnVadRzdNZ48vhT27","Đức Phúc","Ngày Đầu Sau Chia Tay","Duc Phuc",54,113,13,"185915"
116,"spotify:track:2qSkIjg1o9h3YT9RAgYN75","Sabrina Carpenter","Espresso","Island Records",13,97,22,"185624"
117,"spotify:track:2o4dDfLK6NVI7TjBm5VoMv","Lou Hoàng, Miu Lê","Yêu Một Người Có Lẽ","Onlyc Entertainment",33,91,143,"185518"
118,"spotify:track:1EmMFSLRVkOszCa4ul9z0F","W/N, Duongg, Nau, titie","3107 3","Universal Music Indochina Distributed Labels",1,106,164,"182912"
119,"spotify:track:255vSRpVq5YYKBJiem1BVx","Andree Right Hand","Chơi Như Tụi Mỹ","$maker Music",4,114,70,"182663"
120,"spotify:track:0SMpkybKsjUeONDdUCW69e","WEAN","Thờ ơ","M Music Records",120,121,3,"181847"
121,"spotify:track:3K7RddI2L8Wiv7uIbrhfLc","The Masked Singer, Lâm Bảo Ngọc, Hứa Kim Tuyền","Rồi Em Sẽ Gặp Một Chàng Trai Khác","THE MASKED SINGER",11,119,44,"181184"
122,"spotify:track:0hiQvlWSSTr7n1kc1X2Lus","HIEUTHUHAI, Harmonie","Bật Nhạc Lên","GERDNANG",59,105,202,"180995"
123,"spotify:track:4h3K653rm69JYWpO4du2BJ","Andiez","Chờ Đợi Có Đáng Sợ","Yin Yang Media",76,142,118,"180681"
124,"spotify:track:4tqXSj46umlymdIxqY8zso","SOOBIN","giá như","WDND",13,115,23,"180237"
125,"spotify:track:1dUmmBh2nw8XzEI3au0uFs","Thịnh Suy","Chết Trong Em","InQ International",4,141,99,"179262"
126,"spotify:track:4r12MbGoZQBt6SQpFyFXq8","Phùng Khánh Linh","ƯỚC ANH TAN NÁT CON TIM","+84 Vietnam New Wave",118,118,2,"177414"
127,"spotify:track:1R1AFI3iNOYr0pGHwjFQBG","B Ray","Cao Ốc 20","Great Entertainment",109,126,23,"175757"
128,"spotify:track:5WIKVELHZYJ4vl3x3xlbZD","DMT, Dangrangto, TeuYungBoy, summerdayy, Rocky CDE","Ổ Quỷ","Smiley Panda",15,104,21,"174115"
129,"spotify:track:7paCdW3grnoEi95tjO1OkG","Thịnh Suy","Thắc Mắc?","InQ International",110,127,41,"173750"
130,"spotify:track:1sczjXEYHpbpCsaA25ZzPv","starfall","intentions","Mercury Records / Republic Records",67,92,5,"173746"
131,"spotify:track:6Hs2xIgB8nzyGFDvVA8lFa","Madihu, Low G","Có Em","NGUYEN CHI PHONG",4,136,126,"172062"
132,"spotify:track:2JuHIbFudHwDqQssgqsH3i","Vũ Phụng Tiên, DT Tập Rap, Drum7","Lệ Lưu Ly","Big Arts Entertainment",6,134,52,"171469"
133,"spotify:track:7LVrrX8pkzI9fMF88nGabt","Đen, JustaTee","Đi Về Nhà","Đen",3,123,196,"169489"
134,"spotify:track:5rSAUmbOg4giDrM29vUyHe","Sơn Tùng M-TP","Nơi Này Có Anh","Universal Music Indochina Distributed Labels",5,133,276,"168589"
135,"spotify:track:4NTanSVXBkQ2NmDEbr2vLE","Kai Đinh, GREY D, Hoàng Thùy Linh","Trái đất ôm Mặt trời","Yin Yang Media",8,131,39,"167344"
136,"spotify:track:01qFKNWq73UfEslI0GvumE","Jung Kook, Jack Harlow","3D (feat. Jack Harlow)","BIGHIT MUSIC",2,161,51,"167110"
137,"spotify:track:4N99EuIjwSSFFFMDfTeOLU","buitruonglinh, Vũ Phụng Tiên","Em Không Khóc (feat. Vũ Phụng Tiên)","Yin Yang Media",62,140,100,"166858"
138,"spotify:track:2fDFssQASymjUb2B3XYdpf","ANH TRAI ""SAY HI"", Dương Domic, Anh Tú Atus, Song Luân, Quang Trung, Anh Tú","ĐỀU LÀ CỦA EM (feat. Dương Domic, Anh Tú Atus, Song Luân, Quang Trung & Anh Tú)","Anh Trai Say Hi",86,132,4,"162973"
139,"spotify:track:1oVbTGLd8EgyeWBoqAYBD0","Trung Tu","Vừa Hận Vừa Yêu","Universal Music Indochina Distributed Labels",24,122,10,"162769"
140,"spotify:track:3b34161QoxLwsqhWSPy9i5","Da LAB","Thanh Xuân","Sony Music Entertainment",1,146,317,"162622"
141,"spotify:track:1K3CXUYKhLYN7koLW5WQjX","Thắng","Xin Lỗi","Thắng",5,168,70,"162582"
142,"spotify:track:2kauMp3YNHXULGXyJh4321","Wren Evans, itsnk","Phóng Đổ Tim Em","Universal Music Indochina",9,139,40,"162319"
143,"spotify:track:6AH74QQxzjqTsvj7lFQoqy","ANH TRAI ""SAY HI"", Đức Phúc","ĐOÁ PHÙ DUNG CUỐI CÙNG (feat. Đức Phúc)","Anh Trai Say Hi",143,-1,1,"162157"
144,"spotify:track:52cD79EubHFgrw4lW0AnGB","ANH TRAI ""SAY HI"", Dương Domic, Anh Tú Atus, Song Luân, Quang Trung, Anh Tú","BAO LỜI CON CHƯA NÓI (feat. Dương Domic, Anh Tú Atus, Song Luân, Quang Trung & Anh Tú)","Anh Trai Say Hi",59,111,5,"161605"
145,"spotify:track:1izPmgSW7FV6XFdEOiTvOY","Changg, Minh Huy","Em Không Hiểu","Universal Music Indochina Distributed Labels",27,148,168,"161289"
146,"spotify:track:5KaZWNVmNQlqM8LdENnxuL","Thanh Hưng","Lao Tâm Khổ Tứ","LOOPS Music",146,152,6,"159138"
147,"spotify:track:3XEspwit4d8gwKKgeopfCv","Sean, Lửa","Em Thích","MaiDao Music",65,190,86,"158136"
148,"spotify:track:6aeU5IH8DB1qHK5jRFTNUv","Văn Mai Hương, Negav","Hương (feat. Negav)","Yin Yang Media",7,137,31,"157892"
149,"spotify:track:7h2zqUH4bYyknNUxsYnS5V","PhucXp, Freak D","Như Anh Đã Thấy Em","MaiDao Music",33,170,91,"156839"
150,"spotify:track:6iXGivPFpsqKmrINhIbPvx","Lynk Lee","Buồn Thì Cứ Khóc Đi","Lynk Lee",10,130,247,"156799"
151,"spotify:track:2zRzmGerfTxc2epZHgaTdh","Ngọt, Đen","Cho Tôi Lang Thang","Ngọt",35,125,225,"156515"
152,"spotify:track:4AgFXIVT7hVhBZ5DEOaLu3","Thịnh Suy","tiny love","Yin Yang Media",3,145,146,"154975"
153,"spotify:track:7z7kvUQGwlC6iOl7vMuAr9","The Weeknd","Dancing In The Flames","XO / Republic Records",153,-1,1,"154141"
154,"spotify:track:25edeHHueINMguqu9emCyV","Đen, Phương Anh Đào","Lối Nhỏ","Đen",1,143,256,"153394"
155,"spotify:track:71Q8QWLpvwvfQ6zM5BdCnm","2T, Văn","Liệu Giờ","LOOPS Music",22,149,211,"152737"
156,"spotify:track:2UU11hvjN1JIn4iihEodNT","V","Blue","BIGHIT MUSIC",4,-1,11,"152204"
157,"spotify:track:3z7at2LZwJsg8UvqGw3JAv","MIN, Mr A","Có Em Chờ","MIN",142,147,15,"151482"
158,"spotify:track:3vkCueOmm7xQDoJ17W1Pm3","Mitski","My Love Mine All Mine","Dead Oceans",30,169,50,"150648"
159,"spotify:track:2PYDUM2IC01FOTDLQdFxJP","W/N, Duongg, Nau","3 1 0 7 - 2 (feat. DuongG & Nau)","GUM GROUP",27,150,186,"150556"
160,"spotify:track:18iADruKMXIloyA9vCJXFE","An Vũ, Sino","Chàng Trai Bất Tử","Yin Yang Media",56,163,33,"150514"
161,"spotify:track:2o1pb13quMReXZqE7jWsgq","Ariana Grande","intro (end of the world)","Republic Records",13,172,27,"149861"
162,"spotify:track:5JTZCDMaElB4ZBJc41YhMB","Bằng Kiều, Binz, Bùi Công Nam, Duy Khánh 周周, Thanh Duy, Thien Minh","Dẫu Có Lỗi Lầm","Universal Music Indochina Distributed Labels",41,128,7,"149849"
163,"spotify:track:65cM1nyMf9pFDZVV8xmPX9","GREY D","dự báo thời tiết hôm nay mưa","M Music Records",7,156,96,"149399"
164,"spotify:track:2ddbldKhKrYvOBbYa87cbj","Vũ., Hà Anh Tuấn","Dành Hết Xuân Thì Để Chờ Nhau","WM Vietnam",13,154,24,"147330"
165,"spotify:track:51bYFYWODfYOZU0rwvjiCc","Binz, Đen","Cho Mình Em","Spacespeakers",32,-1,71,"147053"
166,"spotify:track:6Q2oEdOhRjZ1DTv2a7j0lN","PC, Dick, tofutns","Ghé Qua","12 trái lê",64,155,209,"146861"
167,"spotify:track:4HAOgAnILvXCbSODMoRnmD","V","For Us","BIGHIT MUSIC",5,-1,11,"145211"
168,"spotify:track:6DyotcCWPqKQT8YWireU6L","Low G","Tán Gái 505","Rap Nhà Làm",65,159,70,"145089"
169,"spotify:track:786cTF2koRtvnQd4HZCrJi","ANH TRAI ""SAY HI"", Dương Domic, Quang Hùng MasterD, Lou Hoàng, Song Luân, Bảo Anh","CỨ ĐỂ ANH TA RỜI ĐI (feat. Dương Domic, Quang Hùng MasterD, Lou Hoàng, Song Luân & Bảo Anh)","Anh Trai Say Hi",66,151,7,"143160"
170,"spotify:track:1Qrg8KqiBpW07V7PNxwwwL","SZA","Kill Bill","Top Dawg Entertainment/RCA Records",6,160,85,"142347"
171,"spotify:track:2WOpp4vm16unl0N3i3BNNv","Ngơ, NÂN","Tình Đắng Như Ly Cà Phê","12 trái lê",15,198,243,"141489"
172,"spotify:track:7sZgr8RsXkDwkmiQok691a","Thịnh Suy","Mai Mình Xa","InQ International",85,166,22,"140966"
173,"spotify:track:1m4BSQjgXAfoR4dBAapAr7","Masew, B Ray, REDT, Ý Tiên","Lửng Lơ","SKY Music JSC",113,144,91,"140870"
174,"spotify:track:5BJqg07SKgmFnVLOBmLFvq","Bùi Anh Tuấn","Hẹn Một Mai - From"" 4 Năm 2 Chàng 1 Tình Yêu""","Vietnam Music Award",109,-1,18,"139840"
175,"spotify:track:3J3nv18iIrOhca1ZWNeuyW","JustaTee","Đã Lỡ Yêu Em Nhiều","NGUYEN THANH TUAN",36,164,93,"139151"
176,"spotify:track:7fNHfgOxPLcg4mQLhCnOHB","Rapital, Groovie Lã Thắng, tlinh, RPT MCK","XTC (Xích Thêm Chút) (Remix)","M Music Records",87,175,168,"139039"
177,"spotify:track:51ZQ1vr10ffzbwIjDCwqm4","Ariana Grande","we can't be friends (wait for your love)","Republic Records",17,165,28,"138943"
178,"spotify:track:2qWP5ZarXRsdmxzz3L3BtP","SUNI, Hoàng Dũng, GREY D, Orange, tlinh","có hẹn với thanh xuân","Universal Music Indochina Distributed Labels",27,167,112,"138588"
179,"spotify:track:3P3rcI48wwVEgxF5vPM6pG","Sơn Tùng M-TP","Buông Đôi Tay Nhau Ra","Universal Music Indochina Distributed Labels",73,177,62,"137597"
180,"spotify:track:2LBqCSwhJGcFQeTHMVGwy3","The Weeknd","Die For You","Universal Republic Records",49,191,81,"137514"
181,"spotify:track:54UNNgtE3zzERwTuWSQLqd","MONSTAR, GREY D, VƯƠNG BÌNH","có hẹn với thanh xuân","Yin Yang Media",5,196,163,"136652"
182,"spotify:track:2nR51wakN5K3AJENqGaNg9","Đen, MIN","Bài Này Chill Phết","Đen",1,171,277,"135902"
183,"spotify:track:7td8DTWoGC9u9db37mGHX6","Đen, PiaLinh","Nấu ăn cho em","Đen",8,195,60,"135228"
184,"spotify:track:4g34IscInBSNfzaaaEqfZN","Quang Hùng MasterD","Đừng Vì Anh Mà Khóc","Zing MP3",184,-1,1,"133856"
185,"spotify:track:5cn5oHiXJTLiuthgbgfkMh","Vũ Cát Tường","Vết Mưa","Universal Music Indochina Distributed Labels",57,179,44,"132194"
186,"spotify:track:3AejRjgBsFV4HWHjJmmEP7","GREY D, Orange, Kai Đinh","lời tạm biệt chưa nói","Universal Music Indochina Distributed Labels",22,-1,111,"130809"
187,"spotify:track:5cml547MByVlaVrKU2lJTg","Andree Right Hand, Wxrdie, Bình Gold, 2pillz","Em iu","$maker Music",18,184,69,"130559"
188,"spotify:track:1BxfuPKGuaTgP7aM0Bbdwr","Taylor Swift","Cruel Summer","Taylor Swift",5,180,73,"129508"
189,"spotify:track:3BwFxsC7QpRejdE9GXFQI4","D Blue, Killic","Chỉ Còn Ta Và Ta Giữa Trời","12 trái lê",151,-1,14,"129004"
190,"spotify:track:68EMU2RD1ECNeOeJ5qAXCV","Charlie Puth, Selena Gomez","We Don't Talk Anymore (feat. Selena Gomez)","Artist Partner",71,-1,211,"128892"
191,"spotify:track:5cF0dROlMOK5uNZtivgu50","Charlie Puth","Attention","Artist Partner",21,199,176,"128487"
192,"spotify:track:2SykQzXuFSeprST1uDjj1m","AMEE","trời giấu trời mang đi","Yin Yang Media",52,192,76,"128411"
193,"spotify:track:4gxEY3Mh5FZZDAJAKPNrCS","LE SSERAFIM","CRAZY","SOURCE MUSIC",128,162,3,"128370"
194,"spotify:track:0AJi38NumMDXqo8pRw6zdh","Ngọt","LẦN CUỐI (đi bên em xót xa người ơi)","Ngọt",5,-1,172,"128041"
195,"spotify:track:5ZFkQ67FtnmtWLVh2AkAhi","ANH TRAI ""SAY HI"", Anh Tú","ĐOÁ HỒNG CHƠI VƠI (feat. Anh Tú)","Anh Trai Say Hi",195,-1,1,"127580"
