rank,uri,artist_names,track_name,source,peak_rank,previous_rank,weeks_on_chart,streams
1,"spotify:track:2HRgqmZQC0MC7GeNuDIXHN","Jung Kook, Latto","Seven (feat. Latto) (Explicit Ver.)","BIGHIT MUSIC",1,2,71,"2665194"
2,"spotify:track:50zAEIE4B1QqhPjRMK2Xmh","Jin","Running Wild","BIGHIT MUSIC",2,-1,1,"2125667"
3,"spotify:track:01qFKNWq73UfEslI0GvumE","Jung Kook, Jack Harlow","3D (feat. Jack Harlow)","BIGHIT MUSIC",2,3,60,"1599774"
4,"spotify:track:7tI8dRuH2Yc6RuoTjxo4dU","Jimin","Who","BIGHIT MUSIC",1,1,18,"1505357"
5,"spotify:track:2KslE17cAJNHTsI2MI0jb2","Jung Kook","Standing Next to You","BIGHIT MUSIC",1,5,54,"1069143"
6,"spotify:track:41DlPJXKTCypXdf2eSqa03","Vũ., Binz","bình yên","WM Vietnam",4,4,12,"893339"
7,"spotify:track:3COYA2vgfcUhDyRlVpZy5p","tlinh, Low G","PHÓNG ZÌN ZÌN","M Music Records",4,6,9,"838074"
8,"spotify:track:3uT8QfoX0BE8ZJa4h98LDW","Puppy, Dangrangto","Wrong Times","MaiDao Music",8,8,55,"809602"
9,"spotify:track:40pWxpbXoBYGPCiofujjZ6","MONO","Chăm Hoa","M Music Records",9,13,4,"785477"
10,"spotify:track:4nXrVH5xwN1w6TpmP7uu8n","HIEUTHUHAI, marzuz","Exit Sign","M Music Records",8,9,58,"729224"
11,"spotify:track:5vNRhkKd0yEAg8suGBpjeY","ROSÉ, Bruno Mars","APT.","Atlantic Records, THEBLACKLABEL",2,7,5,"717703"
12,"spotify:track:7fCeYpR02Q8JVuD88hJZVT","Da LAB, Minh Tốc & Lam","Bầu Trời Mới","Universal Music Indochina Distributed Labels",8,12,7,"699498"
13,"spotify:track:2oVLEoBVDvYrGmzrU7dEm5","ANH TRAI ""SAY HI"", Dương Domic","TRÀN BỘ NHỚ (feat. Dương Domic)","Anh Trai Say Hi",5,11,11,"672460"
14,"spotify:track:2N0SPREDYqILVEFSsWF5N5","V","Love Me Again","BIGHIT MUSIC",2,20,67,"668935"
15,"spotify:track:4fj4Jn4nw8fGX8xdbCntJf","CoolKid, RHYDER","Sau Cơn Mưa","MaiDao Music",8,15,64,"665685"
16,"spotify:track:2plbrEY59IikOBgBGLjaoe","Lady Gaga, Bruno Mars","Die With A Smile","Interscope",4,10,14,"665261"
17,"spotify:track:4eeflgjzTF8xN8U2E0dech","Dangrangto, TeuYungBoy, DONAL","NGỰA Ô","Higher Dimension",14,14,7,"616255"
18,"spotify:track:3ZbZtdEw9U0uZW4tZItIwq","RHYDER, CoolKid, BAN","Chịu Cách Mình Nói Thua","RHYDER",6,19,52,"615340"
19,"spotify:track:0e6fZkLArSmDIHnZcIua7t","Vũ., Low G","Không Yêu Em Thì Yêu Ai?","WM Vietnam",19,23,8,"578695"
20,"spotify:track:31VNCmwspR7nVJ6kruUuJt","Sơn Tùng M-TP","Đừng Làm Trái Tim Anh Đau","Universal Music Indochina Distributed Labels",1,18,24,"575627"
21,"spotify:track:446ygEWkggc5FMbBPQSMuM","ANH TRAI ""SAY HI"", HIEUTHUHAI, Dương Domic, Song Luân, JSOL, Trần Đăng Dương","SAO HẠNG A (feat. HIEUTHUHAI, Dương Domic, Song Luân, Jsol & Trần Đăng Dương)","Anh Trai Say Hi",7,16,10,"562522"
22,"spotify:track:1K0HQ30Wc11okzlcnFA7Ub","HIEUTHUHAI","Không Thể Say","M Music Records",7,17,83,"557530"
23,"spotify:track:0s7RyyUlQfd8mnnboHe18n","MANBO, HIEUTHUHAI, HURRYKNG","Hẹn Gặp Em Dưới Ánh Trăng","Gerdnang",22,24,36,"535231"
24,"spotify:track:2GE2p2dFpxp7OIz2QOFBzW","ANH TRAI ""SAY HI"", HURRYKNG, HIEUTHUHAI, Negav, Pháp Kiều, Isaac","KIM PHÚT, KIM GIỜ (feat. HURRYKNG, HIEUTHUHAI, Negav, Pháp Kiều & Isaac)","Anh Trai Say Hi",5,21,13,"522245"
25,"spotify:track:7gSQxwCpEMjg8wb6Y3oqe7","ANH TRAI ""SAY HI"", RHYDER, Dương Domic, Pháp Kiều","HÀO QUANG (feat. RHYDER, Dương Domic & Pháp Kiều)","Anh Trai Say Hi",6,22,19,"497966"
26,"spotify:track:2SR0alFA2oWYXSoePGTj0V","Jin","I’ll Be There","BIGHIT MUSIC",5,26,4,"488028"
27,"spotify:track:226ljdOTLM2clGpm4mZvAm","Dangrangto","Love is","MaiDao Music",27,27,4,"466627"
28,"spotify:track:0BX2eDMZJrGzApf4ZGXrFi","ANH TRAI ""SAY HI"", HIEUTHUHAI, ERIK, Anh Tú Atus, JSOL, Orange","NGÁO NGƠ (feat. HIEUTHUHAI, ERIK, Anh Tú Atus, JSOL & Orange)","Anh Trai Say Hi",6,25,16,"459459"
29,"spotify:track:4CUvVaAYuXtvYURLFz7EIL","Emcee L (Da LAB), Da LAB, Muộii (Starry Night)","Chuyện Đôi Ta (feat. Muộii)","Yin Yang Media",3,32,155,"440079"
30,"spotify:track:4qYfRfSxsmhJ1WMaywtLyI","Wren Evans, itsnk","Từng Quen","Universal Music Indochina",1,29,56,"433863"
31,"spotify:track:5ECHJ1llWBNYLVCYrllD3x","Da LAB, Phương Ly","Chạy Khỏi Thế Giới Này","LOOPS Music",11,40,125,"423329"
32,"spotify:track:3Nn9QjxOEj1pleW9xTG6cq","ANH TRAI ""SAY HI"", Quang Hùng MasterD, Negav, Pháp Kiều, ERIK","TÌNH ĐẦU QUÁ CHÉN (feat. Quang Hùng MasterD, Negav, Pháp Kiều & Erik)","Anh Trai Say Hi",13,30,10,"419013"
33,"spotify:track:26zqmmkqUK6mCc87XDzPym","ANH TRAI ""SAY HI"", RHYDER, Captain, Quang Hùng MasterD, WEAN, Ali Hoàng Dương","CHÂN THÀNH (feat. RHYDER, Captain, Quang Hùng MasterD, WEAN & Ali Hoàng Dương)","Anh Trai Say Hi",14,31,14,"413097"
34,"spotify:track:6VXVYATpQXEIoZ97NnWCmn","Madihu, Vũ.","Vì Anh Đâu Có Biết","WM Vietnam",2,33,120,"409505"
35,"spotify:track:0SLzsfxED15vyUccX4bCqo","tlinh, Low G","HOP ON DA SHOW","M Music Records",5,28,10,"405778"
36,"spotify:track:4gaxEUZE4z9pJAVTSFwgQI","14 Casper, Bon Nghiêm, buitruonglinh","một đời","DANDERLÉON",28,35,34,"400751"
37,"spotify:track:1LJyhnPdYGRLerwJd8CmL1","Vũ., Dear Jane","Những Lời Hứa Bỏ Quên","WM Vietnam",1,38,49,"396355"
38,"spotify:track:4exlWP8cokkWVCvyP3kg7c","tlinh, 2pillz","nếu lúc đó","Universal Music Indochina Distributed Labels",1,41,90,"389402"
39,"spotify:track:5J3m0taZ0W1E9HTE0MwcSv","Low G","Simp Gái 808","Rap Nhà Làm",9,43,58,"381906"
40,"spotify:track:7tFwBnuaGXqiiONukPRaCo","Minh Huy","Miên Man","LOOPS Music",11,51,64,"379634"
41,"spotify:track:12rIwDpMKwx77nV5O998nB","Wxrdie, RPT JasonDilla","Băng Qua Cầu Giấy","Universal Music Indochina Distributed Labels",41,153,2,"378885"
42,"spotify:track:1o6cYDMHvKOfizi4d9Lqxr","W/N","id 072019","Universal Music Indochina Distributed Labels",3,36,69,"378719"
43,"spotify:track:6D94p9ASguBcYlDC0o56vx","HIEUTHUHAI","NOLOVENOLIFE","M Music Records",24,39,58,"373676"
44,"spotify:track:5oFEvbM7lGnx8jfAkuhVyo","AMEE, RPT MCK","MỘNG YU","Yin Yang Media",3,37,16,"365738"
45,"spotify:track:3JIfmjJbanxJkwaPzYa2gN","ANH TRAI ""SAY HI"", Quân A.P, Pháp Kiều, Quang Trung, Ali Hoàng Dương, Lâm Bảo Ngọc","REGRET (feat. Quân A.P, Pháp Kiều, Quang Trung, Ali Hoàng Dương & Lâm Bảo Ngọc)","Anh Trai Say Hi",5,48,16,"363980"
46,"spotify:track:0HAfl1uPBf5qTMiuAi6Ym7","Captain, RHYDER","Ừ Thì Chia Tay (feat. RHYDER)","Great Entertainment",34,34,4,"356041"
47,"spotify:track:4jWmhzf53Q0ZvZMuGdiR9x","WEAN, tlinh","shhhhhhh..","WEAN",9,45,59,"355894"
48,"spotify:track:5BTzf3doGTigDIYUFtbkI9","Emcee L (Da LAB), Da LAB, Badbies","Sinh Ra Đã Là Thứ Đối Lập Nhau (feat. Badbies)","Yin Yang Media",5,47,204,"354790"
49,"spotify:track:1J12HjUuXfJnaUdubTEzSR","HIEUTHUHAI","Nghe Như Tình Yêu","M Music Records",39,44,166,"346655"
50,"spotify:track:7mbWwlHgukuuW8r7Nc3FHv","Chọn gì? Chọn đi!, OgeNus, PiaLinh","Say Yes (Vietnamese Version)","MaiDao Music",30,46,11,"343113"
51,"spotify:track:2uZmeuNAxSm7XfVIwLkhCx","Ronboogz","nhắn nhủ","MaiDao Music",14,50,49,"334230"
52,"spotify:track:3a2Oftcs10wtzw6AmxuTMU","Olew","Rồi Ta Sẽ Ngắm Pháo Hoa Cùng Nhau","LOOPS Music",8,56,96,"327295"
53,"spotify:track:2xOhv7XudrBDtkID1jwsFE","Vũ Cát Tường","Từng Là","Universal Music Indochina Distributed Labels",2,52,38,"325865"
54,"spotify:track:1YmY0HUm05BUpcHibc1bhB","Jin","Another Level","BIGHIT MUSIC",54,-1,1,"324027"
55,"spotify:track:5PLjpBivzvuaIIqqkQgnRK","GREY D, tlinh","vaicaunoicokhiennguoithaydoi","M Music Records",2,70,127,"319153"
56,"spotify:track:7Cjsw965r7mVK888ZqP6Wo","Negav","Mình Anh Thôi","MIXUS",18,49,11,"311531"
57,"spotify:track:4qUmNOnS81p8wrMdBHRbS3","Jin, WENDY","Heart on the Window (with WENDY)","BIGHIT MUSIC",57,-1,1,"308041"
58,"spotify:track:5T6j0rfpCDBzAxC8Fpd0N7","Low G, Thắng","An Thần","Rap Nhà Làm",2,61,161,"307449"
59,"spotify:track:4rIBbB1vt0lEKDG2UTmfP0","Tăng Duy Tân, Drum7, 2pillz","Say Sóng","Big Arts Entertainment",59,140,2,"306854"
60,"spotify:track:5oSUmLelhXItguqPQ0Qn2b","Jin","Falling","BIGHIT MUSIC",60,-1,1,"303728"
61,"spotify:track:2a5hng9yXtbjtTVVm9UviC","Vũ Cát Tường","Mơ","Universal Music Indochina Distributed Labels",21,57,117,"301068"
62,"spotify:track:3hqOrxH5qPlvrApcb7Ac8c","Ronboogz","Lan Man","MaiDao Music",33,73,84,"293269"
63,"spotify:track:7kKu4NWeBh01I6aTIEP9bg","ANH TRAI ""SAY HI"", Quang Hùng MasterD","TRÓI EM LẠI (feat. Quang Hùng MasterD)","Anh Trai Say Hi",27,53,11,"291425"
64,"spotify:track:5PGh9MyKry8slG5AfvD1eD","Obito, Shiki, VSTRA","Hà Nội","12 trái lê",10,58,59,"290578"
65,"spotify:track:2CspwnypzT7rcWI9RfsoSb","JENNIE","Mantra","OA Entertainment/Columbia",6,42,6,"288443"
66,"spotify:track:62bwj2FZsr0ljcap1FEf8g","Ngô Lan Hương","Đi Giữa Trời Rực Rỡ - From ""Đi Giữa Trời Rực Rỡ""","SK Pictures",34,69,13,"287192"
67,"spotify:track:2wZAvkgiOE5tyrnqhB69KA","Sơn Tùng M-TP","Âm Thầm Bên Em","Universal Music Indochina Distributed Labels",34,65,213,"285390"
68,"spotify:track:5s7flUAYsDmcUWtHsMCihv","Jin","I will come to you","BIGHIT MUSIC",68,-1,1,"284550"
69,"spotify:track:3DLtPObflLQBodZN8qGODT","JustaTee, BigDaddy","2AM","WM Vietnam",18,64,134,"284237"
70,"spotify:track:6kCU6i8iRrAAmJJ8Sj4JYC","Shartnuss, Tr.D, Phankeo","Nắng có mang em về","MaiDao Music",44,55,41,"279323"
71,"spotify:track:3OVMe3H6iAxbLF8iD2UYrw","Sơn Tùng M-TP","Chúng Ta Của Tương Lai","Universal Music Indochina Distributed Labels",1,66,37,"278839"
72,"spotify:track:1MiJk3dXC5jzhvLFP0dUM7","Da LAB","Thức Giấc","Yin Yang Media",1,67,176,"273743"
73,"spotify:track:7kgzRBNkBRArtTPkYjWLYT","14 Casper, Bon Nghiêm","bao tiền một mớ bình yên?","DANDERLÉON",9,80,187,"272905"
74,"spotify:track:65aTHDZWUdh6WIafu9MtNF","HIEUTHUHAI, Negav, Kewtiie","ngủ một mình (tình rất tình)","M Music Records",2,54,101,"272864"
75,"spotify:track:2naHX4cacns359w3ugyt3P","RAP VIỆT, Dangrangto","ĐÂU PHẢI VỢ ANH (feat. Dangrangto)","DAT VIET VAC",48,63,5,"272792"
76,"spotify:track:3rtOU0GwlsbCNiCqEDLZUN","Wxrdie, Dangrangto, TeuYungBoy, LVK","Tim Anh Ghen","Universal Music Indochina Distributed Labels",76,-1,1,"270846"
77,"spotify:track:7jLSThU5Kg1RWt19Leiaxm","RPT MCK, Trung Trần","Chìm Sâu","N0L4B3L",1,74,143,"270647"
78,"spotify:track:3A9A7mfVDVm3rrS9SMGhg5","Kha","Hư không","MaiDao Music",22,76,45,"269761"
79,"spotify:track:5iZHnufFUgATzrpGgH1K0W","T.R.I","Ánh Sao Và Bầu Trời","Yin Yang Media",1,84,159,"261595"
80,"spotify:track:4WZf4gJ2MvBec6XPdUiqcq","ANH TRAI ""SAY HI"", RHYDER, Jmi Ko","ANH BIẾT RỒI (feat. Rhyder, Jmi Ko)","Anh Trai Say Hi",15,62,12,"259970"
81,"spotify:track:1J3SmWwlYAG68LGKr86MVH","Sơn Tùng M-TP","Chúng Ta Của Hiện Tại","Universal Music Indochina Distributed Labels",1,82,205,"258014"
82,"spotify:track:78lw4wahFNotXb0mOEtPkM","WEAN","BADBYE","WEAN",20,71,39,"256202"
83,"spotify:track:07d8eaOuAWdC0DANq3tdPd","ANH TRAI ""SAY HI"", HIEUTHUHAI","QUAY ĐI QUAY LẠI (feat. HIEUTHUHAI)","Anh Trai Say Hi",14,60,12,"254380"
84,"spotify:track:65cM1nyMf9pFDZVV8xmPX9","GREY D","dự báo thời tiết hôm nay mưa","M Music Records",7,102,105,"253182"
85,"spotify:track:3Alwi53Ahc2GwHgvel42b2","Lou Hoàng","Ngày Đẹp Trời Để Nói Chia Tay","WM Vietnam",4,68,23,"253022"
86,"spotify:track:0fGJiHH6xSUJU1MAVjxq5m","Karik, GDucky","Bạn Đời","WM Vietnam",5,92,60,"251609"
87,"spotify:track:1xoadYaxtOp9gHDwgmPDuz","JSOL, Hoàng Duyên","Sài Gòn Hôm Nay Mưa","Universal Music Indochina",3,79,182,"248519"
88,"spotify:track:1GJ3suxtUVaguVQRemw6Zp","Andiez","Suýt Nữa Thì...","MaiDao Music",74,87,124,"245983"
89,"spotify:track:0PBTlQ84CBJF0tBnKGmQa6","V","FRI(END)S","BIGHIT MUSIC",1,77,36,"245948"
90,"spotify:track:6KgZf5gZgF1KLNxq1qZgHP","Phương Ly","Anh Là Ngoại Lệ Của Em","WM Vietnam",7,83,59,"244878"
91,"spotify:track:4qJSUFwZFouto5VZUlln75","tlinh, Trung Trần","Thích Quá Rùi Nà","Universal Music Indochina Distributed Labels",34,90,218,"243752"
92,"spotify:track:4hdOYl6xm8ry6hZzn9pBqw","RAP VIỆT, Hustlang Robber, Ngắn","QUA TỪNG KHUNG HÌNH (feat. Hustlang Robber & Ngắn)","DAT VIET VAC",92,-1,1,"241765"
93,"spotify:track:7Cnpb1vBbC46RgVyyKLH7p","aespa","Whiplash","SM Entertainment",36,59,5,"241542"
94,"spotify:track:27Z9T0mSWHYWSj9SNOGvyt","JustaTee, Phương Ly","Thằng Điên","NGUYEN THANH TUAN",2,85,120,"241515"
95,"spotify:track:5YiNxgEQQTuFi5dKLxxjWm","ANH TRAI ""SAY HI"", Quang Hùng MasterD, Negav, Công Dương, NICKY","CATCH ME IF YOU CAN (feat. Quang Hùng MasterD, Negav, Công Dương & Nicky)","Anh Trai Say Hi",11,81,20,"237027"
96,"spotify:track:0oL2jCTf9P9a7flY5mCpYu","Wxrdie, JustaTee","Trở Về","Universal Music Indochina Distributed Labels",96,-1,1,"235230"
97,"spotify:track:6f7M5UzYYeLFCMIBQhxk2J","Rhymastic","Lặng","Universal Music Indochina Distributed Labels",7,96,20,"232805"
98,"spotify:track:2dPJtlvoa3GDowCh035M8P","Vũ.","Nếu Những Tiếc Nuối","WM Vietnam",47,78,8,"230892"
99,"spotify:track:0vkExWiBJSrfWnlMC7x48b","UMIE","Không Yêu Xin Đừng Nói - Piano Version","LOOPS Music",37,94,90,"229567"
100,"spotify:track:5kJMW3pK49PvQDtpVryHf5","JustaTee","Forget About Her","Spacespeakers",31,130,15,"229069"
101,"spotify:track:4vfhartd7HDWGJbdVIycEu","Sơn Tùng M-TP","Muộn Rồi Mà Sao Còn","Universal Music Indochina Distributed Labels",1,93,187,"229002"
102,"spotify:track:5LQpQ6SDeaz6SIkR0lvsoC","GREY D, Chillies","đưa em về nhàa","M Music Records",3,115,83,"228902"
103,"spotify:track:4OXAneZHFJyQV1RuzCzmH3","VSOUL, RPT MCK, Obito, Ronboogz, Boyzed","Buồn Hay Vui (feat. RPT MCK, Obito, Ronboogz & Boyzed)","12 trái lê",3,86,48,"228042"
104,"spotify:track:7CyPwkp0oE8Ro9Dd5CUDjW","The Weeknd, JENNIE, Lily-Rose Depp","One Of The Girls (with JENNIE, Lily Rose Depp)","XO / Republic Records",11,88,74,"226974"
105,"spotify:track:1EmMFSLRVkOszCa4ul9z0F","W/N, Duongg, Nau, titie","3107 3","Universal Music Indochina Distributed Labels",1,99,173,"225424"
106,"spotify:track:3LWVXp636uLT356Rj08Jaz","Jimin","Be Mine","BIGHIT MUSIC",7,75,18,"221784"
107,"spotify:track:6uxuJ8Fr1AAfSPJUF9N1yr","Vũ.","Bước Qua Mùa Cô Đơn","WM Vietnam",1,89,206,"221333"
108,"spotify:track:5C1O3fpMsiisJpHiB1uuDf","52Hz, RIO","ĐỢI (Prod. RIO)","DAO Entertainment",13,98,46,"221160"
109,"spotify:track:6dOtVTDdiauQNBQEDOtlAB","Billie Eilish","BIRDS OF A FEATHER","Darkroom/Interscope Records",63,95,27,"220022"
110,"spotify:track:33S16Xa5cZmLPhn6eZI4Nm","52Hz, WEAN, RIO","ĐỢI (SPECIAL VERSION) [ft. WEAN]","DAO Entertainment",83,91,17,"218271"
111,"spotify:track:0WjdaO545q9Qn4SQtzRQu9","HIEUTHUHAI","TRÌNH","M Music Records",72,72,2,"217519"
112,"spotify:track:265hQASPY3HFmUH38zZrSK","Dangrangto, DONAL","MOIEM","Higher Dimension",112,159,2,"217416"
113,"spotify:track:5AsZiMkbxLlR68WM3HHKWZ","Wxrdie, Mason Nguyen","29","Universal Music Indochina Distributed Labels",113,-1,1,"215484"
114,"spotify:track:5rSAUmbOg4giDrM29vUyHe","Sơn Tùng M-TP","Nơi Này Có Anh","Universal Music Indochina Distributed Labels",5,109,285,"215483"
115,"spotify:track:5Bti0azlFhMattVY76qFr9","Vũ.","Lạ Lùng","WM Vietnam",17,101,346,"215264"
116,"spotify:track:6Hs2xIgB8nzyGFDvVA8lFa","Madihu, Low G","Có Em","NGUYEN CHI PHONG",4,108,135,"213596"
117,"spotify:track:2CFC7iLurCyDYuXQcfem2l","Quang Hùng MasterD","Thủy Triều","Quang Hùng MasterD",69,104,18,"210614"
118,"spotify:track:30CXPFiHrPmKxAxPpiMlLw","Trúc Nhân","Không Ra Gì","POPS WORLDWIDE",118,-1,1,"209104"
119,"spotify:track:44sYmL97Lv8mEbzgANFkPD","NICKY, AMEE","thật quá đáng.. để yêu","Yin Yang Media",89,103,6,"208456"
120,"spotify:track:3ukrFH17Zl6iEZ2QJ1Zwiy","RPT Orijinn, Ronboogz","Don't Côi","Rapital",3,97,100,"207978"
121,"spotify:track:0gzpqwLf1jhNjnSJEyweAX","Kuun Đức Nam, Linh Thộn","Tình cờ yêu em","MaiDao Music",12,118,65,"207964"
122,"spotify:track:3ER1r0HipeSSu7YNImC6vd","Wxrdie, Marlykid, Lucin3x","Bước Za Đi Xa","Universal Music Indochina Distributed Labels",61,149,9,"207815"
123,"spotify:track:1UQNU5O9VttUgO16pxUnjw","Obito, Shiki, RPT MCK","Đánh Đổi","12 trái lê",7,111,59,"207799"
124,"spotify:track:5J90ah0ppUSev1uahqQiN6","Andiez, AMEE","Anh Đánh Rơi Người Yêu Này","MaiDao Music",19,107,107,"207794"
125,"spotify:track:2o4dDfLK6NVI7TjBm5VoMv","Lou Hoàng, Miu Lê","Yêu Một Người Có Lẽ","Onlyc Entertainment",33,121,152,"207253"
126,"spotify:track:2pm7K14nHj2fLrpU8j9bit","PC","10 Ngàn Năm","12 trái lê",27,105,128,"205965"
127,"spotify:track:0QzuaeCEEOV40Pn7IvKEny","Dhruv","double take","Little Worry/RCA Records",8,122,185,"203019"
128,"spotify:track:3YctJXK6kznnWl68TnYobN","RPT MCK","Anh Đã Ổn Hơn","N0L4B3L",3,114,90,"202813"
129,"spotify:track:5KaZWNVmNQlqM8LdENnxuL","Thanh Hưng","Lao Tâm Khổ Tứ","LOOPS Music",122,128,15,"200639"
130,"spotify:track:7LVrrX8pkzI9fMF88nGabt","Đen, JustaTee","Đi Về Nhà","Đen",3,120,205,"200417"
131,"spotify:track:4wuiHjpRp6Wm0SbNPvDs0W","BigDaddy, GREY D","Mưa Thâm Lặng Giời","Universal Music Indochina Distributed Labels",112,112,3,"200008"
132,"spotify:track:6IHLOkgZftkcqS3fM0jMCT","MONO, Onionn.","Em Xinh","M Music Records",10,157,41,"199778"
133,"spotify:track:25edeHHueINMguqu9emCyV","Đen, Phương Anh Đào","Lối Nhỏ","Đen",1,144,265,"199476"
134,"spotify:track:6jcLKVmEKAQIXIVHJZ8vzS","MONSTAR, GREY D, NICKY, VƯƠNG BÌNH","tình yêu chậm trễ","Yin Yang Media",46,135,102,"198116"
135,"spotify:track:28bxbqNcAuNxYDZYet6eZ7","RPT MCK, tlinh","Chỉ Một Đêm Nữa Thôi","N0L4B3L",9,116,90,"196669"
136,"spotify:track:1wG0HYACxdu3Kdz3mI4ca6","Wxrdie, KayC","Thèn Chóa","Universal Music Indochina Distributed Labels",136,-1,1,"196045"
137,"spotify:track:3ET3xHCLMGd57u06A9RjJ0","Ronboogz","Nói Dối","MaiDao Music",79,136,55,"195209"
138,"spotify:track:255vSRpVq5YYKBJiem1BVx","Andree Right Hand","Chơi Như Tụi Mỹ","$maker Music",4,134,79,"193677"
139,"spotify:track:6iXGivPFpsqKmrINhIbPvx","Lynk Lee","Buồn Thì Cứ Khóc Đi","Lynk Lee",10,164,256,"192834"
140,"spotify:track:5tdz7T4hTxA1ipJMBe24uX","AMEE","ex's hate me, Pt.2","Yin Yang Media",13,113,109,"192597"
141,"spotify:track:3TBZ2VchMRulZU8SbJx0Sc","Rocky CDE, Dangrangto, VCC Left Hand","Việc Nên Làm","MaiDao Music",95,106,7,"189494"
142,"spotify:track:5cml547MByVlaVrKU2lJTg","Andree Right Hand, Wxrdie, Bình Gold, 2pillz","Em iu","$maker Music",18,154,78,"188749"
143,"spotify:track:3b34161QoxLwsqhWSPy9i5","Da LAB","Thanh Xuân","Sony Music Entertainment",1,125,326,"188181"
144,"spotify:track:3P3rcI48wwVEgxF5vPM6pG","Sơn Tùng M-TP","Buông Đôi Tay Nhau Ra","Universal Music Indochina Distributed Labels",73,171,71,"188168"
145,"spotify:track:0X28PqBpbQhWdi4usYw0w5","Wren Evans, itsnk","Tò Te Tí","Universal Music Indochina",3,147,45,"186819"
146,"spotify:track:5xuaCJaNAqRLwV7OO5zPiF","W/N, Duongg, Nâu","3 1 0 7 (feat. Duongg & Nâu)","HONG AN ENTERTAIMENT,.JSC",11,123,224,"186197"
147,"spotify:track:6Q2oEdOhRjZ1DTv2a7j0lN","PC, Dick, tofutns","Ghé Qua","12 trái lê",64,131,218,"185149"
148,"spotify:track:4tqXSj46umlymdIxqY8zso","SOOBIN","giá như","WDND",13,129,32,"184962"
149,"spotify:track:37uug3gaq86yvFTjV6WkaV","Kay Chau Anh","Think About U","Yin Yang Media",149,-1,1,"183394"
150,"spotify:track:2n00rcPaXcWfFB9irOKOmh","Ronboogz","Anh Chỉ Muốn","MaiDao Music",77,145,45,"183330"
151,"spotify:track:5XfGQZA0ioQAWUjlyJRcHc","Shiki, Obito","1000 Ánh Mắt","12 trái lê",8,143,21,"183204"
152,"spotify:track:2kauMp3YNHXULGXyJh4321","Wren Evans, itsnk","Phóng Đổ Tim Em","Universal Music Indochina",9,170,49,"182608"
153,"spotify:track:0A0oqleZkyD8FN6aW48Jzn","Khiem","Yên Bình Có Quá Đắt Không","Universal Music Indochina Distributed Labels",12,117,20,"181807"
154,"spotify:track:0ZP4bO2ywAv44HiEzzHaq5","Lê Hiếu, SOOBIN, Touliver","Ngày Mai Em Đi","Space Speakers",2,132,191,"181673"
155,"spotify:track:4h3K653rm69JYWpO4du2BJ","Andiez","Chờ Đợi Có Đáng Sợ","Yin Yang Media",76,124,127,"181553"
156,"spotify:track:0Y2ipMuhAlOnIkTXcCKWlL","Wxrdie, Thai VG","Get Money","Universal Music Indochina Distributed Labels",156,-1,1,"180300"
157,"spotify:track:4N99EuIjwSSFFFMDfTeOLU","buitruonglinh, Vũ Phụng Tiên","Em Không Khóc (feat. Vũ Phụng Tiên)","Yin Yang Media",62,142,109,"179864"
158,"spotify:track:1zzCiwKpbS6zNC3OAdejd2","ANH TRAI ""SAY HI"", RHYDER, WEAN, Đức Phúc, Hùng Huỳnh, tlinh","I'M THINKING ABOUT YOU (feat. RHYDER, WEAN, Đức Phúc, Hùng Huỳnh & tlinh)","Anh Trai Say Hi",15,119,15,"179553"
159,"spotify:track:1izPmgSW7FV6XFdEOiTvOY","Changg, Minh Huy","Em Không Hiểu","Universal Music Indochina Distributed Labels",27,148,177,"176549"
160,"spotify:track:1TcmqSx576eBcuTxTtcEAk","tlinh, Low G","NGÂN","M Music Records",42,110,9,"173843"
161,"spotify:track:3yDRcs0Y4pPzkvMbUfeF9H","LISA","Moonlit Floor (Kiss Me)","Lloud Co./RCA Records",34,100,7,"172796"
162,"spotify:track:71Q8QWLpvwvfQ6zM5BdCnm","2T, Văn","Liệu Giờ","LOOPS Music",22,181,220,"172627"
163,"spotify:track:5TtNxUZBjYR4wgzOpHpS7h","ANH TRAI ""SAY HI"", HIEUTHUHAI, JSOL, Ali Hoàng Dương, Vũ Thịnh","LOVE SAND (feat. HIEUTHUHAI, JSOL, Ali Hoàng Dương & Vũ Thịnh)","Anh Trai Say Hi",23,127,20,"171312"
164,"spotify:track:4Iz5EWPCAT8jYNk4IpLoll","buitruonglinh","Dù Cho Mai Về Sau","Yin Yang Media",10,152,191,"168304"
165,"spotify:track:4NTanSVXBkQ2NmDEbr2vLE","Kai Đinh, GREY D, Hoàng Thùy Linh","Trái đất ôm Mặt trời","Yin Yang Media",8,162,48,"167977"
166,"spotify:track:1Gqm6KaobG2A1mFVjGnJsS","Wxrdie","Ca Khúc Cuối","Universal Music Indochina Distributed Labels",166,-1,1,"167152"
167,"spotify:track:0hiQvlWSSTr7n1kc1X2Lus","HIEUTHUHAI, Harmonie","Bật Nhạc Lên","GERDNANG",59,126,211,"166567"
168,"spotify:track:1R1AFI3iNOYr0pGHwjFQBG","B Ray","Cao Ốc 20","Great Entertainment",109,168,32,"165536"
169,"spotify:track:2JuHIbFudHwDqQssgqsH3i","Vũ Phụng Tiên, DT Tập Rap, Drum7","Lệ Lưu Ly","Big Arts Entertainment",6,155,61,"164074"
170,"spotify:track:1Cv9w0KLlrz0t4ExKO76QE","kidsai, Dangrangto, WHENITSASUNNIDAY","TALAGI","kidsai",133,133,3,"163980"
171,"spotify:track:1dUmmBh2nw8XzEI3au0uFs","Thịnh Suy","Chết Trong Em","InQ International",4,169,108,"162812"
172,"spotify:track:3z7at2LZwJsg8UvqGw3JAv","MIN, Mr A","Có Em Chờ","MIN",139,175,24,"162250"
173,"spotify:track:3K7RddI2L8Wiv7uIbrhfLc","The Masked Singer, Lâm Bảo Ngọc, Hứa Kim Tuyền","Rồi Em Sẽ Gặp Một Chàng Trai Khác","THE MASKED SINGER",11,158,53,"161315"
174,"spotify:track:2zRzmGerfTxc2epZHgaTdh","Ngọt, Đen","Cho Tôi Lang Thang","Ngọt",35,165,234,"160467"
175,"spotify:track:7fNHfgOxPLcg4mQLhCnOHB","Rapital, Groovie Lã Thắng, tlinh, RPT MCK","XTC (Xích Thêm Chút) (Remix)","M Music Records",87,146,177,"159483"
176,"spotify:track:7paCdW3grnoEi95tjO1OkG","Thịnh Suy","Thắc Mắc?","InQ International",110,180,50,"159129"
177,"spotify:track:6u7HUAnyWxVjrKnFGYSQZp","SOOBIN, 16 Typh, Hà Lê, Hà Trần, Lil Wuyn, CHARLES., BROWN, Duy Sơn, KIMLONG","Tình Cờ (feat. CHARLES., Brown, KIMLONG & Duy Sơn)","WDND",101,137,3,"159056"
178,"spotify:track:3J3nv18iIrOhca1ZWNeuyW","JustaTee","Đã Lỡ Yêu Em Nhiều","NGUYEN THANH TUAN",36,150,102,"159003"
179,"spotify:track:6ImWeruCQWxZ9WNodYwjvg","Wxrdie, Gill","Anh Freestyle","Universal Music Indochina Distributed Labels",179,-1,1,"158280"
180,"spotify:track:5sTLGx6c7YRwnrWm6O091n","IVE, David Guetta","Supernova Love","Virgin",139,139,2,"158112"
181,"spotify:track:6xKs4CnVadRzdNZ48vhT27","Đức Phúc","Ngày Đầu Sau Chia Tay","Duc Phuc",54,161,22,"155941"
182,"spotify:track:7td8DTWoGC9u9db37mGHX6","Đen, PiaLinh","Nấu ăn cho em","Đen",8,172,68,"155272"
183,"spotify:track:5OrpSDeWfWr33q0a5Ydfhr","Cường Seven, Phan Đinh Tùng, Bằng Kiều, Jun Phạm, Tự Long, Trương Thế Vinh, Tuấn Hưng, SOOBIN, S.T Sơn Thạch, Kay Trần, BB Trần, (S)TRONG, Kiên Ứng","MẸ YÊU CON","Universal Music Indochina Distributed Labels",111,151,5,"154110"
184,"spotify:track:5sGAdzerznua6nkFZr4jW6","RAP VIỆT, Gill","TUYẾT TRÊN PHỐ (feat. Gill)","DAT VIET VAC",69,163,7,"153788"
185,"spotify:track:7h2zqUH4bYyknNUxsYnS5V","PhucXp, Freak D","Như Anh Đã Thấy Em","MaiDao Music",33,166,99,"152806"
186,"spotify:track:2rDtJL39iMme6RgWnETEWP","Tăng Duy Tân, Bích Phương, 2pillz","Ikigai","Big Arts Entertainment",157,-1,2,"152067"
187,"spotify:track:2PYDUM2IC01FOTDLQdFxJP","W/N, Duongg, Nau","3 1 0 7 - 2 (feat. DuongG & Nau)","GUM GROUP",27,189,194,"152054"
188,"spotify:track:51bYFYWODfYOZU0rwvjiCc","Binz, Đen","Cho Mình Em","Spacespeakers",32,167,80,"150602"
189,"spotify:track:7j3XQm7RR8T2EzaYtYK4rc","W/N, Tezzy, Tien","Crush 2","RioX Records",51,-1,125,"150567"
190,"spotify:track:0RKggS4he8LozKqMv09IrM","ANH TRAI ""SAY HI"", HURRYKNG, HIEUTHUHAI, Negav, Pháp Kiều, Isaac","WALK (feat. HURRYKNG, HIEUTHUHAI, Negav, Pháp Kiều & Isaac)","Anh Trai Say Hi",41,138,14,"150352"
191,"spotify:track:1Qrg8KqiBpW07V7PNxwwwL","SZA","Kill Bill","Top Dawg Entertainment/RCA Records",6,193,94,"149878"
192,"spotify:track:0dBKcPEAsdxWJsqNDNHcPz","Andree Right Hand, RHYDER, WOKEUP","Dân Chơi Sao Phải Khóc","$maker Music",16,199,33,"149680"
193,"spotify:track:6r5o9yIc16ZvymXUKJQ1yy","W/N","2 4","W NATION",8,156,16,"149412"
194,"spotify:track:4cdY6unqCUrHHI7KOELiaq","Wxrdie, QNT, SpideyBoy","Cả 2","Universal Music Indochina Distributed Labels",194,-1,1,"148625"
195,"spotify:track:45PPoUgqs3JrhkZGEzSUHT","W/N, ERIK, Nau","3107 4 (feat. Erik, Nâu)","Universal Music Indochina Distributed Labels",24,197,84,"148359"
196,"spotify:track:5gWnqeM0qdEWl2xQXcs1Kb","SIVAN, Kai Đinh","haydeanhduoccungemdau","LOOPS Music",140,196,38,"147838"
197,"spotify:track:6DyotcCWPqKQT8YWireU6L","Low G","Tán Gái 505","Rap Nhà Làm",65,187,77,"147698"
