rank,uri,artist_names,track_name,source,peak_rank,previous_rank,weeks_on_chart,streams
1,"spotify:track:2HRgqmZQC0MC7GeNuDIXHN","Jung Kook, Latto","Seven (feat. Latto) (Explicit Ver.)","BIGHIT MUSIC",1,1,66,"3901731"
2,"spotify:track:7tI8dRuH2Yc6RuoTjxo4dU","Jimin","Who","BIGHIT MUSIC",1,3,13,"2740872"
3,"spotify:track:2KslE17cAJNHTsI2MI0jb2","Jung Kook","Standing Next to You","BIGHIT MUSIC",1,2,49,"1981287"
4,"spotify:track:3COYA2vgfcUhDyRlVpZy5p","tlinh, Low G","PHÓNG ZÌN ZÌN","M Music Records",4,5,4,"1209153"
5,"spotify:track:41DlPJXKTCypXdf2eSqa03","Vũ., Binz","bình yên","WM Vietnam",4,4,7,"1107900"
6,"spotify:track:2CspwnypzT7rcWI9RfsoSb","JENNIE","Mantra","OA Entertainment/Columbia",6,-1,1,"1023284"
7,"spotify:track:2oVLEoBVDvYrGmzrU7dEm5","ANH TRAI ""SAY HI"", Dương Domic","TRÀN BỘ NHỚ (feat. Dương Domic)","Anh Trai Say Hi",5,6,6,"1017371"
8,"spotify:track:7fCeYpR02Q8JVuD88hJZVT","Da LAB, Minh Tốc & Lam","Bầu Trời Mới","Universal Music Indochina Distributed Labels",8,18,2,"959841"
9,"spotify:track:446ygEWkggc5FMbBPQSMuM","ANH TRAI ""SAY HI"", HIEUTHUHAI, Dương Domic, Song Luân, JSOL, Trần Đăng Dương","SAO HẠNG A (feat. HIEUTHUHAI, Dương Domic, Song Luân, Jsol & Trần Đăng Dương)","Anh Trai Say Hi",7,7,5,"827509"
10,"spotify:track:0SLzsfxED15vyUccX4bCqo","tlinh, Low G","HOP ON DA SHOW","M Music Records",5,8,5,"822315"
11,"spotify:track:4nXrVH5xwN1w6TpmP7uu8n","HIEUTHUHAI, marzuz","Exit Sign","M Music Records",8,9,53,"782452"
12,"spotify:track:2GE2p2dFpxp7OIz2QOFBzW","ANH TRAI ""SAY HI"", HURRYKNG, HIEUTHUHAI, Negav, Pháp Kiều, Isaac","KIM PHÚT, KIM GIỜ (feat. HURRYKNG, HIEUTHUHAI, Negav, Pháp Kiều & Isaac)","Anh Trai Say Hi",5,10,8,"711695"
13,"spotify:track:2plbrEY59IikOBgBGLjaoe","Lady Gaga, Bruno Mars","Die With A Smile","Interscope",4,11,9,"708397"
14,"spotify:track:4fj4Jn4nw8fGX8xdbCntJf","CoolKid, RHYDER","Sau Cơn Mưa","MaiDao Music",8,14,59,"704157"
15,"spotify:track:7gSQxwCpEMjg8wb6Y3oqe7","ANH TRAI ""SAY HI"", RHYDER, Dương Domic, Pháp Kiều","HÀO QUANG (feat. RHYDER, Dương Domic & Pháp Kiều)","Anh Trai Say Hi",6,12,14,"676604"
16,"spotify:track:3Nn9QjxOEj1pleW9xTG6cq","ANH TRAI ""SAY HI"", Quang Hùng MasterD, Negav, Pháp Kiều, ERIK","TÌNH ĐẦU QUÁ CHÉN (feat. Quang Hùng MasterD, Negav, Pháp Kiều & Erik)","Anh Trai Say Hi",13,13,5,"655141"
17,"spotify:track:1K0HQ30Wc11okzlcnFA7Ub","HIEUTHUHAI","Không Thể Say","M Music Records",7,19,78,"615579"
18,"spotify:track:3uT8QfoX0BE8ZJa4h98LDW","Puppy, Dangrangto","Wrong Times","MaiDao Music",18,23,50,"614612"
19,"spotify:track:31VNCmwspR7nVJ6kruUuJt","Sơn Tùng M-TP","Đừng Làm Trái Tim Anh Đau","Universal Music Indochina Distributed Labels",1,20,19,"613563"
20,"spotify:track:3ZbZtdEw9U0uZW4tZItIwq","RHYDER, CoolKid, BAN","Chịu Cách Mình Nói Thua","RHYDER",6,16,47,"599307"
21,"spotify:track:0BX2eDMZJrGzApf4ZGXrFi","ANH TRAI ""SAY HI"", HIEUTHUHAI, ERIK, Anh Tú Atus, JSOL, Orange","NGÁO NGƠ (feat. HIEUTHUHAI, ERIK, Anh Tú Atus, JSOL & Orange)","Anh Trai Say Hi",6,17,11,"596527"
22,"spotify:track:0e6fZkLArSmDIHnZcIua7t","Vũ., Low G","Không Yêu Em Thì Yêu Ai?","WM Vietnam",22,27,3,"584565"
23,"spotify:track:5oFEvbM7lGnx8jfAkuhVyo","AMEE, RPT MCK","MỘNG YU","Yin Yang Media",3,15,11,"556495"
24,"spotify:track:2N0SPREDYqILVEFSsWF5N5","V","Love Me Again","BIGHIT MUSIC",2,21,62,"556211"
25,"spotify:track:4eeflgjzTF8xN8U2E0dech","Dangrangto, TeuYungBoy, DONAL","NGỰA Ô","Higher Dimension",25,85,2,"499606"
26,"spotify:track:26zqmmkqUK6mCc87XDzPym","ANH TRAI ""SAY HI"", RHYDER, Captain, Quang Hùng MasterD, WEAN, Ali Hoàng Dương","CHÂN THÀNH (feat. RHYDER, Captain, Quang Hùng MasterD, WEAN & Ali Hoàng Dương)","Anh Trai Say Hi",14,25,9,"474989"
27,"spotify:track:0s7RyyUlQfd8mnnboHe18n","MANBO, HIEUTHUHAI, HURRYKNG","Hẹn Gặp Em Dưới Ánh Trăng","Gerdnang",22,24,31,"471398"
28,"spotify:track:7Cjsw965r7mVK888ZqP6Wo","Negav","Mình Anh Thôi","MIXUS",18,28,6,"466299"
29,"spotify:track:3JIfmjJbanxJkwaPzYa2gN","ANH TRAI ""SAY HI"", Quân A.P, Pháp Kiều, Quang Trung, Ali Hoàng Dương, Lâm Bảo Ngọc","REGRET (feat. Quân A.P, Pháp Kiều, Quang Trung, Ali Hoàng Dương & Lâm Bảo Ngọc)","Anh Trai Say Hi",5,22,11,"465693"
30,"spotify:track:07d8eaOuAWdC0DANq3tdPd","ANH TRAI ""SAY HI"", HIEUTHUHAI","QUAY ĐI QUAY LẠI (feat. HIEUTHUHAI)","Anh Trai Say Hi",14,26,7,"454575"
31,"spotify:track:4gaxEUZE4z9pJAVTSFwgQI","14 Casper, Bon Nghiêm, buitruonglinh","một đời","DANDERLÉON",28,33,29,"441466"
32,"spotify:track:3LWVXp636uLT356Rj08Jaz","Jimin","Be Mine","BIGHIT MUSIC",7,62,13,"441106"
33,"spotify:track:4jWmhzf53Q0ZvZMuGdiR9x","WEAN, tlinh","shhhhhhh..","WEAN",9,38,54,"432084"
34,"spotify:track:4CUvVaAYuXtvYURLFz7EIL","Emcee L (Da LAB), Da LAB, Muộii (Starry Night)","Chuyện Đôi Ta (feat. Muộii)","Yin Yang Media",3,35,150,"432018"
35,"spotify:track:6D94p9ASguBcYlDC0o56vx","HIEUTHUHAI","NOLOVENOLIFE","M Music Records",24,29,53,"429468"
36,"spotify:track:4qYfRfSxsmhJ1WMaywtLyI","Wren Evans, itsnk","Từng Quen","Universal Music Indochina",1,44,51,"424409"
37,"spotify:track:4HgTGTXHt1zie3upsI50zm","Ngô Lan Hương","Đi Giữa Trời Rực Rỡ - From ""Đi Giữa Trời Rực Rỡ""","SK Pictures",34,34,8,"423429"
38,"spotify:track:4WZf4gJ2MvBec6XPdUiqcq","ANH TRAI ""SAY HI"", RHYDER, Jmi Ko","ANH BIẾT RỒI (feat. Rhyder, Jmi Ko)","Anh Trai Say Hi",15,39,7,"422235"
39,"spotify:track:7tFwBnuaGXqiiONukPRaCo","Minh Huy","Miên Man","LOOPS Music",11,31,59,"419728"
40,"spotify:track:1LJyhnPdYGRLerwJd8CmL1","Vũ., Dear Jane","Những Lời Hứa Bỏ Quên","WM Vietnam",1,36,44,"419272"
41,"spotify:track:2uZmeuNAxSm7XfVIwLkhCx","Ronboogz","nhắn nhủ","MaiDao Music",14,32,44,"405443"
42,"spotify:track:4pygz13A6EcLL6ti7kqGaf","Jin","Super Tuna","BIGHIT MUSIC",42,-1,1,"404829"
43,"spotify:track:5ECHJ1llWBNYLVCYrllD3x","Da LAB, Phương Ly","Chạy Khỏi Thế Giới Này","LOOPS Music",11,43,120,"402170"
44,"spotify:track:5J3m0taZ0W1E9HTE0MwcSv","Low G","Simp Gái 808","Rap Nhà Làm",9,40,53,"398488"
45,"spotify:track:1o6cYDMHvKOfizi4d9Lqxr","W/N","id 072019","Universal Music Indochina Distributed Labels",3,41,64,"397259"
46,"spotify:track:7kKu4NWeBh01I6aTIEP9bg","ANH TRAI ""SAY HI"", Quang Hùng MasterD","TRÓI EM LẠI (feat. Quang Hùng MasterD)","Anh Trai Say Hi",27,37,6,"394076"
47,"spotify:track:2dPJtlvoa3GDowCh035M8P","Vũ.","Nếu Những Tiếc Nuối","WM Vietnam",47,50,3,"387220"
48,"spotify:track:6VXVYATpQXEIoZ97NnWCmn","Madihu, Vũ.","Vì Anh Đâu Có Biết","WM Vietnam",2,61,115,"387108"
49,"spotify:track:4exlWP8cokkWVCvyP3kg7c","tlinh, 2pillz","nếu lúc đó","Universal Music Indochina Distributed Labels",1,45,85,"385034"
50,"spotify:track:1J12HjUuXfJnaUdubTEzSR","HIEUTHUHAI","Nghe Như Tình Yêu","M Music Records",39,46,161,"376144"
51,"spotify:track:7mbWwlHgukuuW8r7Nc3FHv","Chọn gì? Chọn đi!, OgeNus, PiaLinh","Say Yes (Vietnamese Version)","MaiDao Music",30,30,6,"372007"
52,"spotify:track:65aTHDZWUdh6WIafu9MtNF","HIEUTHUHAI, Negav, Kewtiie","ngủ một mình (tình rất tình)","M Music Records",2,58,96,"353696"
53,"spotify:track:2xOhv7XudrBDtkID1jwsFE","Vũ Cát Tường","Từng Là","Universal Music Indochina Distributed Labels",2,49,33,"350093"
54,"spotify:track:5BTzf3doGTigDIYUFtbkI9","Emcee L (Da LAB), Da LAB, Badbies","Sinh Ra Đã Là Thứ Đối Lập Nhau (feat. Badbies)","Yin Yang Media",5,65,199,"348528"
55,"spotify:track:3yDRcs0Y4pPzkvMbUfeF9H","LISA","Moonlit Floor (Kiss Me)","Lloud Co./RCA Records",48,48,2,"346880"
56,"spotify:track:1TcmqSx576eBcuTxTtcEAk","tlinh, Low G","NGÂN","M Music Records",42,42,4,"335867"
57,"spotify:track:5PLjpBivzvuaIIqqkQgnRK","GREY D, tlinh","vaicaunoicokhiennguoithaydoi","M Music Records",2,60,122,"335293"
58,"spotify:track:2a5hng9yXtbjtTVVm9UviC","Vũ Cát Tường","Mơ","Universal Music Indochina Distributed Labels",21,51,112,"319186"
59,"spotify:track:5PGh9MyKry8slG5AfvD1eD","Obito, Shiki, VSTRA","Hà Nội","12 trái lê",10,54,54,"315488"
60,"spotify:track:3a2Oftcs10wtzw6AmxuTMU","Olew","Rồi Ta Sẽ Ngắm Pháo Hoa Cùng Nhau","LOOPS Music",8,55,91,"313790"
61,"spotify:track:5T6j0rfpCDBzAxC8Fpd0N7","Low G, Thắng","An Thần","Rap Nhà Làm",2,53,156,"313322"
62,"spotify:track:6r5o9yIc16ZvymXUKJQ1yy","W/N","2 4","W NATION",8,52,11,"311190"
63,"spotify:track:5YiNxgEQQTuFi5dKLxxjWm","ANH TRAI ""SAY HI"", Quang Hùng MasterD, Negav, Công Dương, NICKY","CATCH ME IF YOU CAN (feat. Quang Hùng MasterD, Negav, Công Dương & Nicky)","Anh Trai Say Hi",11,47,15,"309142"
64,"spotify:track:3OVMe3H6iAxbLF8iD2UYrw","Sơn Tùng M-TP","Chúng Ta Của Tương Lai","Universal Music Indochina Distributed Labels",1,56,32,"307195"
65,"spotify:track:78lw4wahFNotXb0mOEtPkM","WEAN","BADBYE","WEAN",20,57,34,"302557"
66,"spotify:track:3Alwi53Ahc2GwHgvel42b2","Lou Hoàng","Ngày Đẹp Trời Để Nói Chia Tay","WM Vietnam",4,59,18,"286288"
67,"spotify:track:1MiJk3dXC5jzhvLFP0dUM7","Da LAB","Thức Giấc","Yin Yang Media",1,77,171,"283920"
68,"spotify:track:3DLtPObflLQBodZN8qGODT","JustaTee, BigDaddy","2AM","WM Vietnam",18,64,129,"283560"
69,"spotify:track:5sGAdzerznua6nkFZr4jW6","RAP VIỆT, Gill","TUYẾT TRÊN PHỐ (feat. Gill)","DAT VIET VAC",69,72,2,"278339"
70,"spotify:track:7CyPwkp0oE8Ro9Dd5CUDjW","The Weeknd, JENNIE, Lily-Rose Depp","One Of The Girls (with JENNIE, Lily Rose Depp)","XO / Republic Records",11,71,69,"277619"
71,"spotify:track:7kgzRBNkBRArtTPkYjWLYT","14 Casper, Bon Nghiêm","bao tiền một mớ bình yên?","DANDERLÉON",9,87,182,"273764"
72,"spotify:track:7jLSThU5Kg1RWt19Leiaxm","RPT MCK, Trung Trần","Chìm Sâu","N0L4B3L",1,80,138,"272456"
73,"spotify:track:27Z9T0mSWHYWSj9SNOGvyt","JustaTee, Phương Ly","Thằng Điên","NGUYEN THANH TUAN",2,84,115,"270429"
74,"spotify:track:1zzCiwKpbS6zNC3OAdejd2","ANH TRAI ""SAY HI"", RHYDER, WEAN, Đức Phúc, Hùng Huỳnh, tlinh","I'M THINKING ABOUT YOU (feat. RHYDER, WEAN, Đức Phúc, Hùng Huỳnh & tlinh)","Anh Trai Say Hi",15,63,10,"267885"
75,"spotify:track:0PBTlQ84CBJF0tBnKGmQa6","V","FRI(END)S","BIGHIT MUSIC",1,66,31,"263945"
76,"spotify:track:5iZHnufFUgATzrpGgH1K0W","T.R.I","Ánh Sao Và Bầu Trời","Yin Yang Media",1,73,154,"259221"
77,"spotify:track:2wZAvkgiOE5tyrnqhB69KA","Sơn Tùng M-TP","Âm Thầm Bên Em","Universal Music Indochina Distributed Labels",34,88,208,"258963"
78,"spotify:track:3QjcsqERv4IfmopRvXFoWB","tlinh, Low G","DÂU TẰM","M Music Records",65,67,4,"255885"
79,"spotify:track:3qllaNK66kKxX123f0eKpj","Vũ.","Mùa Mưa Ấy","WM Vietnam",79,113,3,"253633"
80,"spotify:track:6KgZf5gZgF1KLNxq1qZgHP","Phương Ly","Anh Là Ngoại Lệ Của Em","WM Vietnam",7,70,54,"253499"
81,"spotify:track:3A9A7mfVDVm3rrS9SMGhg5","Kha","Hư không","MaiDao Music",22,78,40,"253365"
82,"spotify:track:3ER1r0HipeSSu7YNImC6vd","Wxrdie, Marlykid, Lucin3x","Bước Za Đi Xa","Universal Music Indochina Distributed Labels",61,68,4,"253218"
83,"spotify:track:1J3SmWwlYAG68LGKr86MVH","Sơn Tùng M-TP","Chúng Ta Của Hiện Tại","Universal Music Indochina Distributed Labels",1,106,200,"248988"
84,"spotify:track:6uxuJ8Fr1AAfSPJUF9N1yr","Vũ.","Bước Qua Mùa Cô Đơn","WM Vietnam",1,91,201,"248553"
85,"spotify:track:5Bti0azlFhMattVY76qFr9","Vũ.","Lạ Lùng","WM Vietnam",17,116,341,"243222"
86,"spotify:track:1GJ3suxtUVaguVQRemw6Zp","Andiez","Suýt Nữa Thì...","MaiDao Music",74,74,119,"239955"
87,"spotify:track:4OXAneZHFJyQV1RuzCzmH3","VSOUL, RPT MCK, Obito, Ronboogz, Boyzed","Buồn Hay Vui (feat. RPT MCK, Obito, Ronboogz & Boyzed)","12 trái lê",3,79,43,"235100"
88,"spotify:track:6dOtVTDdiauQNBQEDOtlAB","Billie Eilish","BIRDS OF A FEATHER","Darkroom/Interscope Records",63,82,22,"234255"
89,"spotify:track:6kCU6i8iRrAAmJJ8Sj4JYC","Shartnuss, Tr.D, Phankeo","Nắng có mang em về","MaiDao Music",44,76,36,"231155"
90,"spotify:track:65cM1nyMf9pFDZVV8xmPX9","GREY D","dự báo thời tiết hôm nay mưa","M Music Records",7,126,100,"229234"
91,"spotify:track:6f7M5UzYYeLFCMIBQhxk2J","Rhymastic","Lặng","Universal Music Indochina Distributed Labels",7,69,15,"227732"
92,"spotify:track:5C1O3fpMsiisJpHiB1uuDf","52Hz, RIO","ĐỢI (Prod. RIO)","DAO Entertainment",13,100,41,"227274"
93,"spotify:track:1xoadYaxtOp9gHDwgmPDuz","JSOL, Hoàng Duyên","Sài Gòn Hôm Nay Mưa","Universal Music Indochina",3,93,177,"226997"
94,"spotify:track:5XfGQZA0ioQAWUjlyJRcHc","Shiki, Obito","1000 Ánh Mắt","12 trái lê",8,114,16,"225311"
95,"spotify:track:4qJSUFwZFouto5VZUlln75","tlinh, Trung Trần","Thích Quá Rùi Nà","Universal Music Indochina Distributed Labels",34,89,213,"225026"
96,"spotify:track:5LQpQ6SDeaz6SIkR0lvsoC","GREY D, Chillies","đưa em về nhàa","M Music Records",3,107,78,"224221"
97,"spotify:track:0fGJiHH6xSUJU1MAVjxq5m","Karik, GDucky","Bạn Đời","WM Vietnam",5,94,55,"223735"
98,"spotify:track:0hiQvlWSSTr7n1kc1X2Lus","HIEUTHUHAI, Harmonie","Bật Nhạc Lên","GERDNANG",59,99,206,"220297"
99,"spotify:track:6Hs2xIgB8nzyGFDvVA8lFa","Madihu, Low G","Có Em","NGUYEN CHI PHONG",4,120,130,"219394"
100,"spotify:track:0QzuaeCEEOV40Pn7IvKEny","Dhruv","double take","Little Worry/RCA Records",8,95,180,"219292"
101,"spotify:track:5TtNxUZBjYR4wgzOpHpS7h","ANH TRAI ""SAY HI"", HIEUTHUHAI, JSOL, Ali Hoàng Dương, Vũ Thịnh","LOVE SAND (feat. HIEUTHUHAI, JSOL, Ali Hoàng Dương & Vũ Thịnh)","Anh Trai Say Hi",23,81,15,"218573"
102,"spotify:track:12bcCsDriq4kuXeC6egRUT","Vũ., Hà Anh Tuấn","Dành Hết Xuân Thì Để Chờ Nhau","WM Vietnam",13,109,27,"217985"
103,"spotify:track:28bxbqNcAuNxYDZYet6eZ7","RPT MCK, tlinh","Chỉ Một Đêm Nữa Thôi","N0L4B3L",9,92,85,"216459"
104,"spotify:track:5J90ah0ppUSev1uahqQiN6","Andiez, AMEE","Anh Đánh Rơi Người Yêu Này","MaiDao Music",19,75,102,"216296"
105,"spotify:track:2CFC7iLurCyDYuXQcfem2l","Quang Hùng MasterD","Thủy Triều","Quang Hùng MasterD",69,129,13,"215112"
106,"spotify:track:3YctJXK6kznnWl68TnYobN","RPT MCK","Anh Đã Ổn Hơn","N0L4B3L",3,97,85,"212948"
107,"spotify:track:2n00rcPaXcWfFB9irOKOmh","Ronboogz","Anh Chỉ Muốn","MaiDao Music",77,90,40,"212152"
108,"spotify:track:6P7xEmk7ZZYz0AV84uOwiW","AMEE","Cuộc gọi lúc nửa đêm","Yin Yang Media",11,83,11,"211128"
109,"spotify:track:5tdz7T4hTxA1ipJMBe24uX","AMEE","ex's hate me, Pt.2","Yin Yang Media",13,110,104,"211013"
110,"spotify:track:3ukrFH17Zl6iEZ2QJ1Zwiy","RPT Orijinn, Ronboogz","Don't Côi","Rapital",3,96,95,"210758"
111,"spotify:track:1R1AFI3iNOYr0pGHwjFQBG","B Ray","Cao Ốc 20","Great Entertainment",109,117,27,"210188"
112,"spotify:track:0A0oqleZkyD8FN6aW48Jzn","Khiem","Yên Bình Có Quá Đắt Không","Universal Music Indochina Distributed Labels",12,101,15,"207749"
113,"spotify:track:4vfhartd7HDWGJbdVIycEu","Sơn Tùng M-TP","Muộn Rồi Mà Sao Còn","Universal Music Indochina Distributed Labels",1,98,182,"206560"
114,"spotify:track:1UQNU5O9VttUgO16pxUnjw","Obito, Shiki, RPT MCK","Đánh Đổi","12 trái lê",7,118,54,"205743"
115,"spotify:track:2pm7K14nHj2fLrpU8j9bit","PC","10 Ngàn Năm","12 trái lê",27,115,123,"205714"
116,"spotify:track:1EmMFSLRVkOszCa4ul9z0F","W/N, Duongg, Nau, titie","3107 3","Universal Music Indochina Distributed Labels",1,134,168,"204065"
117,"spotify:track:0gzpqwLf1jhNjnSJEyweAX","Kuun Đức Nam, Linh Thộn","Tình cờ yêu em","MaiDao Music",12,111,60,"202945"
118,"spotify:track:2o4dDfLK6NVI7TjBm5VoMv","Lou Hoàng, Miu Lê","Yêu Một Người Có Lẽ","Onlyc Entertainment",33,86,147,"202820"
119,"spotify:track:4h3K653rm69JYWpO4du2BJ","Andiez","Chờ Đợi Có Đáng Sợ","Yin Yang Media",76,121,122,"200333"
120,"spotify:track:6jcLKVmEKAQIXIVHJZ8vzS","MONSTAR, GREY D, NICKY, VƯƠNG BÌNH","tình yêu chậm trễ","Yin Yang Media",46,104,97,"200084"
121,"spotify:track:3ET3xHCLMGd57u06A9RjJ0","Ronboogz","Nói Dối","MaiDao Music",79,108,50,"199833"
122,"spotify:track:7LVrrX8pkzI9fMF88nGabt","Đen, JustaTee","Đi Về Nhà","Đen",3,127,200,"199657"
123,"spotify:track:3P3rcI48wwVEgxF5vPM6pG","Sơn Tùng M-TP","Buông Đôi Tay Nhau Ra","Universal Music Indochina Distributed Labels",73,144,66,"199187"
124,"spotify:track:3hqOrxH5qPlvrApcb7Ac8c","Ronboogz","Lan Man","MaiDao Music",33,112,79,"199187"
125,"spotify:track:4N99EuIjwSSFFFMDfTeOLU","buitruonglinh, Vũ Phụng Tiên","Em Không Khóc (feat. Vũ Phụng Tiên)","Yin Yang Media",62,122,104,"199122"
126,"spotify:track:3b34161QoxLwsqhWSPy9i5","Da LAB","Thanh Xuân","Sony Music Entertainment",1,141,321,"198773"
127,"spotify:track:2kauMp3YNHXULGXyJh4321","Wren Evans, itsnk","Phóng Đổ Tim Em","Universal Music Indochina",9,159,44,"198059"
128,"spotify:track:44sYmL97Lv8mEbzgANFkPD","NICKY, AMEE","thật quá đáng.. để yêu","Yin Yang Media",128,-1,1,"197207"
129,"spotify:track:1izPmgSW7FV6XFdEOiTvOY","Changg, Minh Huy","Em Không Hiểu","Universal Music Indochina Distributed Labels",27,135,172,"196613"
130,"spotify:track:0RKggS4he8LozKqMv09IrM","ANH TRAI ""SAY HI"", HURRYKNG, HIEUTHUHAI, Negav, Pháp Kiều, Isaac","WALK (feat. HURRYKNG, HIEUTHUHAI, Negav, Pháp Kiều & Isaac)","Anh Trai Say Hi",41,105,9,"196500"
131,"spotify:track:5xuaCJaNAqRLwV7OO5zPiF","W/N, Duongg, Nâu","3 1 0 7 (feat. Duongg & Nâu)","HONG AN ENTERTAIMENT,.JSC",11,142,219,"195353"
132,"spotify:track:255vSRpVq5YYKBJiem1BVx","Andree Right Hand","Chơi Như Tụi Mỹ","$maker Music",4,103,74,"195017"
133,"spotify:track:5KaZWNVmNQlqM8LdENnxuL","Thanh Hưng","Lao Tâm Khổ Tứ","LOOPS Music",122,131,10,"190872"
134,"spotify:track:0vkExWiBJSrfWnlMC7x48b","UMIE","Không Yêu Xin Đừng Nói - Piano Version","LOOPS Music",37,143,85,"187291"
135,"spotify:track:54PbBpquVfhfrwRwvjSXbI","Charlie Puth, Selena Gomez","We Don't Talk Anymore (feat. Selena Gomez)","Artist Partner",71,125,215,"187266"
136,"spotify:track:4tqXSj46umlymdIxqY8zso","SOOBIN","giá như","WDND",13,137,27,"183148"
137,"spotify:track:45PPoUgqs3JrhkZGEzSUHT","W/N, ERIK, Nau","3107 4 (feat. Erik, Nâu)","Universal Music Indochina Distributed Labels",24,124,79,"183130"
138,"spotify:track:7j3XQm7RR8T2EzaYtYK4rc","W/N, Tezzy, Tien","Crush 2","RioX Records",51,132,121,"183100"
139,"spotify:track:01qFKNWq73UfEslI0GvumE","Jung Kook, Jack Harlow","3D (feat. Jack Harlow)","BIGHIT MUSIC",2,102,55,"180784"
140,"spotify:track:7paCdW3grnoEi95tjO1OkG","Thịnh Suy","Thắc Mắc?","InQ International",110,128,45,"179311"
141,"spotify:track:3TBZ2VchMRulZU8SbJx0Sc","Rocky CDE, Dangrangto, VCC Left Hand","Việc Nên Làm","MaiDao Music",141,-1,2,"179132"
142,"spotify:track:7yfcQynap4xcNqnydaFw83","SOOBIN, tlinh","Ai Mà Biết Được (feat. tlinh)","WDND",9,133,17,"177359"
143,"spotify:track:6iXGivPFpsqKmrINhIbPvx","Lynk Lee","Buồn Thì Cứ Khóc Đi","Lynk Lee",10,157,251,"176906"
144,"spotify:track:5rSAUmbOg4giDrM29vUyHe","Sơn Tùng M-TP","Nơi Này Có Anh","Universal Music Indochina Distributed Labels",5,123,280,"176845"
145,"spotify:track:3K7RddI2L8Wiv7uIbrhfLc","The Masked Singer, Lâm Bảo Ngọc, Hứa Kim Tuyền","Rồi Em Sẽ Gặp Một Chàng Trai Khác","THE MASKED SINGER",11,145,48,"173214"
146,"spotify:track:6Q2oEdOhRjZ1DTv2a7j0lN","PC, Dick, tofutns","Ghé Qua","12 trái lê",64,163,213,"173024"
147,"spotify:track:4Iz5EWPCAT8jYNk4IpLoll","buitruonglinh","Dù Cho Mai Về Sau","Yin Yang Media",10,154,186,"172677"
148,"spotify:track:52cD79EubHFgrw4lW0AnGB","ANH TRAI ""SAY HI"", Dương Domic, Anh Tú Atus, Song Luân, Quang Trung, Anh Tú","BAO LỜI CON CHƯA NÓI (feat. Dương Domic, Anh Tú Atus, Song Luân, Quang Trung & Anh Tú)","Anh Trai Say Hi",59,130,9,"172653"
149,"spotify:track:4AgFXIVT7hVhBZ5DEOaLu3","Thịnh Suy","tiny love","Yin Yang Media",3,155,150,"171929"
150,"spotify:track:3z7at2LZwJsg8UvqGw3JAv","MIN, Mr A","Có Em Chờ","MIN",139,139,19,"171388"
151,"spotify:track:6xKs4CnVadRzdNZ48vhT27","Đức Phúc","Ngày Đầu Sau Chia Tay","Duc Phuc",54,138,17,"170383"
152,"spotify:track:2JuHIbFudHwDqQssgqsH3i","Vũ Phụng Tiên, DT Tập Rap, Drum7","Lệ Lưu Ly","Big Arts Entertainment",6,149,56,"169720"
153,"spotify:track:7eDrdQ7PK9Xm1CZCKWsgmH","Vũ., TRANG","Anh Nhớ Ra (feat. TRANG)","WM Vietnam",19,178,81,"167782"
154,"spotify:track:1dUmmBh2nw8XzEI3au0uFs","Thịnh Suy","Chết Trong Em","InQ International",4,146,103,"165139"
155,"spotify:track:4g34IscInBSNfzaaaEqfZN","Quang Hùng MasterD","Đừng Vì Anh Mà Khóc","Zing MP3",152,190,5,"164850"
156,"spotify:track:7fNHfgOxPLcg4mQLhCnOHB","Rapital, Groovie Lã Thắng, tlinh, RPT MCK","XTC (Xích Thêm Chút) (Remix)","M Music Records",87,161,172,"164464"
157,"spotify:track:6aeU5IH8DB1qHK5jRFTNUv","Văn Mai Hương, Negav","Hương (feat. Negav)","Yin Yang Media",7,167,35,"164093"
158,"spotify:track:33S16Xa5cZmLPhn6eZI4Nm","52Hz, WEAN, RIO","ĐỢI (SPECIAL VERSION) [ft. WEAN]","DAO Entertainment",102,-1,12,"164092"
159,"spotify:track:4cdlZnUEuT8EYisPQkf01g","MONO, 2pillz","Đi Tìm Tình Yêu","M Music Records",61,151,7,"163333"
160,"spotify:track:5sjnkOfTLCLNfkkchI2re2","aespa","UP - KARINA Solo","SM Entertainment",160,-1,1,"163189"
161,"spotify:track:4oGgxjxVOI69h9uOpHOzwn","Wren Evans","Để Ý","Universal Music Indochina Distributed Labels",10,136,18,"162672"
162,"spotify:track:2PYDUM2IC01FOTDLQdFxJP","W/N, Duongg, Nau","3 1 0 7 - 2 (feat. DuongG & Nau)","GUM GROUP",27,164,190,"162641"
163,"spotify:track:1pwyiEOvhXLvlpzTZcgfhe","ANH TRAI ""SAY HI"", Negav, GREY D","CHÀNG KHỜ THUỶ CUNG (feat. Negav & GREY D)","Anh Trai Say Hi",53,148,7,"159914"
164,"spotify:track:0X28PqBpbQhWdi4usYw0w5","Wren Evans, itsnk","Tò Te Tí","Universal Music Indochina",3,194,40,"159622"
165,"spotify:track:2zRzmGerfTxc2epZHgaTdh","Ngọt, Đen","Cho Tôi Lang Thang","Ngọt",35,173,229,"159252"
166,"spotify:track:25edeHHueINMguqu9emCyV","Đen, Phương Anh Đào","Lối Nhỏ","Đen",1,147,260,"158830"
167,"spotify:track:5cml547MByVlaVrKU2lJTg","Andree Right Hand, Wxrdie, Bình Gold, 2pillz","Em iu","$maker Music",18,150,73,"158438"
168,"spotify:track:5kJMW3pK49PvQDtpVryHf5","JustaTee","Forget About Her","Spacespeakers",31,-1,10,"158260"
169,"spotify:track:2ctmaWoBxLBYiZB7AKmK1D","Low G","Bảo Tàng","Nhà Hóa Học Đống Đa",33,160,20,"158039"
170,"spotify:track:71Q8QWLpvwvfQ6zM5BdCnm","2T, Văn","Liệu Giờ","LOOPS Music",22,169,215,"157666"
171,"spotify:track:4NTanSVXBkQ2NmDEbr2vLE","Kai Đinh, GREY D, Hoàng Thùy Linh","Trái đất ôm Mặt trời","Yin Yang Media",8,152,43,"156940"
172,"spotify:track:2HRqTpkrJO5ggZyyK6NPWz","Sabrina Carpenter","Espresso","Island Records",13,158,26,"156684"
173,"spotify:track:4LAdZsiks8vsw3e1iZQgVY","HIEUTHUHAI, B Ray, Tage","Không Phải Gu","M Music Records",51,176,30,"154779"
174,"spotify:track:51bYFYWODfYOZU0rwvjiCc","Binz, Đen","Cho Mình Em","Spacespeakers",32,177,75,"154052"
175,"spotify:track:6gcuJpHu0Ey30D5WR76y98","JENNIE","You & Me","YG Entertainment",7,-1,17,"153722"
176,"spotify:track:3J3nv18iIrOhca1ZWNeuyW","JustaTee","Đã Lỡ Yêu Em Nhiều","NGUYEN THANH TUAN",36,171,97,"153306"
177,"spotify:track:38rjRVqEHSlDRrDWDvjkqW","Vũ.","Bước Qua Nhau","WM Vietnam",1,-1,115,"152717"
178,"spotify:track:3nOQ8LlNDS2U9vohMlBWJq","SIXTYUPTOWN, Dangrangto, Lu, Rem","Girl Hà Nội","DetentionRoom",134,172,5,"151602"
179,"spotify:track:2nR51wakN5K3AJENqGaNg9","Đen, MIN","Bài Này Chill Phết","Đen",1,198,281,"151398"
180,"spotify:track:6DyotcCWPqKQT8YWireU6L","Low G","Tán Gái 505","Rap Nhà Làm",65,166,74,"150247"
181,"spotify:track:5gWnqeM0qdEWl2xQXcs1Kb","SIVAN, Kai Đinh","haydeanhduoccungemdau","LOOPS Music",140,189,33,"150190"
182,"spotify:track:0ezCZF82GYZFV1W6W1os7N","W/N, 267","id thang máy (feat. 267)","W NATION",10,153,11,"149876"
183,"spotify:track:5cn5oHiXJTLiuthgbgfkMh","Vũ Cát Tường","Vết Mưa","Universal Music Indochina Distributed Labels",57,-1,46,"149866"
184,"spotify:track:79bSb2Ilugozn6VygdplEZ","Andiez","1 Phút","MaiDao Music",21,174,178,"148222"
185,"spotify:track:18iADruKMXIloyA9vCJXFE","An Vũ, Sino","Chàng Trai Bất Tử","Yin Yang Media",56,181,37,"147199"
186,"spotify:track:7pqx5vF7DzkVtEdsXQ9iua","ANH TRAI ""SAY HI"", Quân A.P, HURRYKNG, Hùng Huỳnh","ĐẦU ĐỘI SỪNG (feat. Quân A.P, HURRYKNG & Hùng Huỳnh)","Anh Trai Say Hi",48,162,14,"146388"
187,"spotify:track:23ep27rDA9gklIzuJ6qzRD","Dương Domic","Yêu Em 2 Ngày","DAO Entertainment",174,185,4,"146232"
188,"spotify:track:2qWP5ZarXRsdmxzz3L3BtP","SUNI, Hoàng Dũng, GREY D, Orange, tlinh","có hẹn với thanh xuân","Universal Music Indochina Distributed Labels",27,180,116,"145665"
189,"spotify:track:7AD5F85waSb3yZxZxEXhJM","Tóc Tiên, Touliver","Có Ai Thương Em Như Anh","Yin Yang Media",20,182,119,"144330"
190,"spotify:track:7td8DTWoGC9u9db37mGHX6","Đen, PiaLinh","Nấu ăn cho em","Đen",8,199,64,"143717"
191,"spotify:track:3vkCueOmm7xQDoJ17W1Pm3","Mitski","My Love Mine All Mine","Dead Oceans",30,179,54,"143451"
192,"spotify:track:2DzFmWhrnRHROJuxW5e1t2","KayC, tlinh","Bao Nhiêu Loài Hoa Remix (feat. tlinh, Machiot)","MaiDao Music",125,165,7,"143077"
193,"spotify:track:53zusvCJkyGYjEZ6bnLIjh","Hà Anh Tuấn","Tháng Tư Là Lời Nói Dối Của Em","Yin Yang Media",49,-1,41,"142594"
194,"spotify:track:1Qrg8KqiBpW07V7PNxwwwL","SZA","Kill Bill","Top Dawg Entertainment/RCA Records",6,168,89,"142439"
195,"spotify:track:786cTF2koRtvnQd4HZCrJi","ANH TRAI ""SAY HI"", Dương Domic, Quang Hùng MasterD, Lou Hoàng, Song Luân, Bảo Anh","CỨ ĐỂ ANH TA RỜI ĐI (feat. Dương Domic, Quang Hùng MasterD, Lou Hoàng, Song Luân & Bảo Anh)","Anh Trai Say Hi",66,170,11,"142179"
196,"spotify:track:2WOpp4vm16unl0N3i3BNNv","Ngơ, NÂN","Tình Đắng Như Ly Cà Phê","12 trái lê",15,196,247,"141904"
197,"spotify:track:3QD2NfLEIvMRbzv2uTu4B7","Myra Trần","Anh Chưa Thương Em Đến Vậy Đâu","Sony Music Entertainment",6,188,90,"141896"
