rank,uri,artist_names,track_name,source,peak_rank,previous_rank,weeks_on_chart,streams
1,"spotify:track:5tpft20jhQvRlG3O7XfwWy","Tyler ICU, Tumelo_za, DJ Maphorisa, Nandipha808, Ceeka RSA, Tyrone Dee","Mnike (feat. DJ Maphorisa, Nandipha808, Ceeka RSA & Tyron Dee)","New Money Gang Records",1,1,13,"478067"
2,"spotify:track:0XSYoJ0MJpMB2tddyRcBEC","De Mthuda, Da Muziqal Chef, Eemoh","Sgudi Snyc","Universal Music (Pty) Ltd.",2,2,10,"374941"
3,"spotify:track:4J1H4EuucGhhYfcPpYCBRr","DJ Stokie, Zee_nhle, Omit ST, Sobzeen","Awukhuzeki","Universal Music (Pty) Ltd.",3,6,6,"331600"
4,"spotify:track:2FDTHlrBguDzQkp7PVj16Q","Dave, Central Cee","Sprinter","Neighbourhood / Live Yours",4,4,8,"290577"
5,"spotify:track:4rXLjWdF2ZZpXCVTfWcshS","Gunna","fukumean","300 Entertainment",5,5,6,"271656"
6,"spotify:track:1CrwpdodnkXcjPSrg8kw9g","Mas Musiq, Daliwonga, DJ Maphorisa, Kabza De Small","Gangnam Style (feat. DJ Maphorisa & Kabza De Small)","New Money Gang Records",2,3,16,"267021"
7,"spotify:track:4k5FlWz3dfhyQzmRpVPZsW","Lady Amar, JL SA, Cici, Murumba Pitch","Hamba Juba","Lea Records",1,7,23,"217210"
8,"spotify:track:5SjrCoaMIUauMrOZG2CUnq","Sam Deep, Eemoh, Da Muziqal Chef","iMpumelelo","Universal Music (Pty) Ltd.",8,8,20,"201545"
9,"spotify:track:741UUVE2kuITl0c6zuqqbO","Nicki Minaj, Ice Spice, Aqua","Barbie World (with Aqua) [From Barbie The Album]","Atlantic Records",9,30,5,"201106"
10,"spotify:track:7ko9EAsZ2N1ZpEBlMUkR3J","Kabza De Small, DJ Maphorisa, Njelic, Young Stunna, Nkosazana Daughter, Xolani Guitar","Nana Thula (feat. Njelic, Young Stunna, Nkosazana Daughter & Xolani Guitar)","Piano Hub",6,10,10,"189383"
11,"spotify:track:3js04Z5R4L1ZvtLPopSG8l","Myztro, Daliwonga, Xduppy, ShaunMusiq & Ftears","Kunkra (feat. Xduppy & ShaunMusiq & Ftears)","New Money Gang Records",4,9,6,"184078"
12,"spotify:track:6T7FXSuXykeGktMLGp8WgE","Lil Durk, J. Cole","All My Life (feat. J. Cole)","Alamo",2,12,11,"167417"
13,"spotify:track:1y5eHXBYiLgNv00KoHXm4o","Soa Mattrix, Mashudu, Happy Jazzman, Emotionz DJ","Mina Nawe","Soa Music Group",1,13,41,"146582"
14,"spotify:track:0AY3sNqV7qAdAZ8j6TRVBd","2Point1, Ntate Stunna, Nthabi Sings","Stimela","Penya Play Productions",1,14,31,"142544"
15,"spotify:track:5O677N09WkpiDFluKb1fXh","Jimmy Maradona, QuayR Musiq, Mellow & Sleazy, Ch'cco, LeeMcKrazy","Wena Wa Pallwa (feat. Ch'cco & LeeMcKrazy)","Sound African Recordings",15,26,2,"141422"
16,"spotify:track:6s1k8Ry40znPtEb9ijOlnw","Kaylow","24 Hours","Kaylow Publishing",2,17,8,"131754"
17,"spotify:track:1bmZLmDu9jkzwHInzPsYLD","Inkabi Zezwe, Sjava, Big Zulu","Umbayimbayi","Warner Music Africa",1,15,18,"130137"
18,"spotify:track:1nWA9Vtg9EW4i4Lr2YVsJJ","Busta 929, Pcee","Uyavala","Umsebenzi Wethu Records",15,16,5,"127859"
19,"spotify:track:26b3oVLrRUaaybJulow9kz","Libianca","People","5K Records Limited",5,21,32,"123061"
20,"spotify:track:1SB1UdyYs3DMyzHVxZg0QE","ShaunMusiq & Ftears, Xduppy, Myztro, Mellow & Sleazy, QuayR Musiq, Matute Boy","Bhebha (feat. Myztro, Mellow & Sleazy, QuayR Musiq & Matuteboy)","Sound African Recordings",3,18,20,"120161"
21,"spotify:track:7x9aauaA9cu6tyfpHnqDLo","Jung Kook, Latto","Seven (feat. Latto)","BIGHIT MUSIC",11,11,2,"116332"
22,"spotify:track:4FEi7i9oDxDzcYbx53IHwq","Kelvin Momo, Babalwa M, Sfarzo Rtee","Sukakude (feat. Sfarzo Rtee)","Kelvin Momo Productions",7,23,33,"115542"
23,"spotify:track:37ISMEYWqhRHcPEitHn8Er","uLazi, Infinity MusiQ","yey","Mguzuguzu Records",15,22,17,"111272"
24,"spotify:track:3HCs7v1ac2ReqcUlTs7YVm","Mellow & Sleazy, Tman Xpress, Keynote","Kwelinye (feat. Keynote)","Sound African Recordings",12,20,21,"110995"
25,"spotify:track:4iZ4pt7kvcaH6Yo8UoZ4s2","SZA","Snooze","Top Dawg Entertainment/RCA Records",12,28,33,"110853"
26,"spotify:track:51fIDcNGiIp7pxHCCN5QaL","Tyler ICU, Khanyisa, Tumelo_za, Tyrone Dee","NGIMOJA (feat. Khanyisa, Tumelo_za & Tyrondee)","New Money Gang Records",1,19,23,"110430"
27,"spotify:track:6wf7Yu7cxBSPrRlWeSeK0Q","Billie Eilish","What Was I Made For? [From The Motion Picture ""Barbie""]","Darkroom/Interscope Records",27,48,2,"110340"
28,"spotify:track:1xs8bOvm3IzEYmcLJVOc34","Ayra Starr","Rush","Mavin Records",7,25,43,"109940"
29,"spotify:track:1eb2pZlRqGLndvOj8MHaTD","Khanyisa, Tyler ICU, Ceeka RSA, Nandipha808","SUKA (feat. Nandipha808, Ceeka RSA)","Superstar Studios",10,24,7,"109644"
30,"spotify:track:1s7oOCT8vauUh01PbJD6ps","Rema, Selena Gomez","Calm Down (with Selena Gomez)","Mavin Records / Jonzing World",7,29,48,"109509"
31,"spotify:track:0JXXNGljqupsJaZsgSbMZV","Miguel","Sure Thing","Jive",13,36,134,"108858"
32,"spotify:track:58u8z6ia8GTm9yZlkmtCtV","Aymos, Ami Faku","Fatela","Lyf Styl Entertainment",3,27,36,"104713"
33,"spotify:track:4hDjmMljGvNZuYUXw1HWw3","Murumba Pitch, Omit ST, Dinky Kunene, Soa Mattrix, Buhle Sax","Wena Dali","Murumba Pitch",19,31,19,"104134"
34,"spotify:track:59nOXPmaKlBfGMDeOVGrIK","Future, Drake, Tems","WAIT FOR U (feat. Drake & Tems)","Epic/Freebandz",1,33,65,"101075"
35,"spotify:track:2f86Ae3R4OKAu1lEIqouih","Summer Walker, J. Cole","To Summer, From Cole - Audio Hug","LVRN/Interscope Records",12,35,10,"100961"
36,"spotify:track:6WzRpISELf3YglGAh7TXcG","The Weeknd, Playboi Carti, Madonna","Popular (with Playboi Carti & Madonna) - From The Idol Vol. 1 (Music from the HBO Original Series)","XO / Republic Records",36,40,8,"100573"
37,"spotify:track:0Wa6EyiyMpByx1vmufeSc0","Elvirgo, Chicco, TallexQ","Malume (Nta Swi Byela Mani Revisit)","Gallo Record Company",32,32,6,"100208"
38,"spotify:track:5YbPxJwPfrj7uswNwoF1pJ","Burna Boy","Last Last","Spaceship/ Bad Habit/Atlantic Records",1,53,63,"97070"
39,"spotify:track:30KX5p3u1xN8TF83eGY0bQ","Sykes, Skillz, Rudeboyz","Sisekakeni Babies (feat. Skillz & RudeBoyz)","Emazulwini Productions",28,37,4,"96892"
40,"spotify:track:7wcjeveluiW5djtxLCxNSx","Spirit Of Praise, Mpumi Mtsweni","Thath'Indawo (Live)","Spirit Music",23,49,22,"95476"
41,"spotify:track:3x3aen8g82ZErdMyGBuHNN","Loatinover Pounds, 25K, Thapelo Ghutra","Sosh Plata - Remix","Punyete Premier League",12,47,22,"93389"
42,"spotify:track:4HrTGHLIffBYPFan9QaAjg","Pabi Cooper, Yumbs, MaWhoo, Nkosazana Daughter","Dali Wam (feat. Nkosazana Daughter)","Cooper Entertainment",18,34,10,"93217"
43,"spotify:track:4iuNZTcvT9diFySSzVsnVS","Fantasia","When I See U","J Records",39,54,168,"93154"
44,"spotify:track:5L3ecxQnQ9qTBmnLQiwf0C","Travis Scott, Bad Bunny, The Weeknd","K-POP","Cactus Jack/Epic",44,-1,1,"93148"
45,"spotify:track:1odExI7RdWc4BT515LTAwj","David Kushner","Daylight","Miserable Music Group, LLC",18,42,15,"92985"
46,"spotify:track:3PdO57q0KLWkfWXsXQJlV6","Mas Musiq, Aymos, Young Stunna","Sengizwile (feat. Aymos & Young Stunna)","New Money Gang Records",3,38,64,"91847"
47,"spotify:track:68Dni7IE4VyPkTOH9mRWHr","J. Cole","No Role Modelz","Roc Nation Records LLC",39,51,145,"91426"
48,"spotify:track:183zjMwtPbSQjsE71Yrfoo","Focalistic, Eeque, Thama Tee","Khekheleza (Dlala Dlala) [feat. Thama Tee & Eeque]","18 Area Holdings",17,41,6,"91005"
49,"spotify:track:4VrYIDyFUN4IYU3wtjbF8p","DJ Maphorisa, Visca, Da Muziqal Chef, MaWhoo, Kabza De Small","Shona Kwelanga (feat. Mawhoo, Da Muziqal Chef & Kabza De Small)","New Money Gang Records",19,44,37,"90535"
50,"spotify:track:74csF4EizLF5y0yT2qoSHH","Wanitwa Mos, Master KG, Seemah, Lowsheen","Thando (feat. Lowsheen)","Wanitwa Mos Entertainment",34,39,7,"89598"
51,"spotify:track:3Pv1NcASIE987vF8t1VWVu","Lwah Ndlunkulu","Ngiyeza","Nkabi Records",8,45,27,"88849"
52,"spotify:track:7cNUMPXO8gGjKnKkXVn5T0","Nasty C","No More","Universal Music (Pty) Ltd.",23,62,4,"88845"
53,"spotify:track:1kKltSWkRUTB7LYVFJXS2w","Murumba Pitch, Omit ST, Nkosazana Daughter, Sipho Magudulela","Esangweni","Murumba Pitch",40,52,20,"88292"
54,"spotify:track:5IgjP7X4th6nMNDh4akUHb","Chris Brown","Under The Influence","Chris Brown Entertainment/RCA Records",2,55,71,"86254"
55,"spotify:track:0Yx0dpXq9K6vIkRWxPvKWI","Dr Dope, Pro Tee, Qveen-rsa, Mzwilili, Kitso Nave","Hamba Wena","3174598 Records DK",55,76,4,"85317"
56,"spotify:track:5JYPXqMwYc0zTODQdjMEZN","Ice Spice","Deli","10K Projects/Capitol Records",56,-1,1,"84132"
57,"spotify:track:2dHHgzDwk4BJdRwy9uXhTO","Metro Boomin, The Weeknd, 21 Savage","Creepin' (with The Weeknd & 21 Savage)","Republic Records",2,56,34,"83933"
58,"spotify:track:5U6zQqXCVZokE7UH4kdAB1","MÖRDA, Oscar Mbo, Murumba Pitch","Mohigan Sun","Asante Music (PTY)Ltd",36,57,24,"83665"
59,"spotify:track:26rx4ek7zk05Q9wEUbN1NF","Myztro, Xduppy, ShaunMusiq & Ftears","Myztro Ah Ah (feat. Xduppy & ShaunMusiq & Ftears)","New Money Gang Records",13,46,11,"83445"
60,"spotify:track:3k79jB4aGmMDUQzEwa46Rz","Olivia Rodrigo","vampire","Olivia Rodrigo PS",37,50,4,"83294"
61,"spotify:track:2qp7rTcFVz67fz88JSnbkU","Uncle Waffles, Tony Duardo, Justin99, Pcee, EeQue, Chley","Yahyuppiyah (feat. Pcee, EeQue & Chley)","Encore Recordings",3,43,17,"82691"
62,"spotify:track:4EI8VuxUuIHKfafU72emqz","Mariah Carey","We Belong Together","Def Jam Recordings",53,59,73,"82086"
63,"spotify:track:1nYOtsnFaAUQOZndulgzNb","AKA, KDDO","Company","Sound African Recordings",1,63,23,"79590"
64,"spotify:track:1Qrg8KqiBpW07V7PNxwwwL","SZA","Kill Bill","Top Dawg Entertainment/RCA Records",5,60,33,"78007"
65,"spotify:track:3pXF1nA74528Edde4of9CC","Bryson Tiller","Don't","TrapSoul/RCA Records",55,64,82,"77933"
66,"spotify:track:4DHcnVTT87F0zZhRPYmZ3B","Miley Cyrus","Flowers","Columbia",1,58,28,"77856"
67,"spotify:track:65NAMIdsZkxYIM5ui8SJSw","K.O, Young Stunna, Blxckie","SETE (feat. Young Stunna & Blxckie)","Sound African Recordings",1,68,49,"75822"
68,"spotify:track:3xKsf9qdS1CyvXSMEid6g8","Frank Ocean","Pink + White","Boys Don't Cry",68,79,36,"74728"
69,"spotify:track:05A1KzxTLvShctiD0Bsydd","Inkabi Zezwe, Sjava, Big Zulu","Sayona","Warner Music Africa",51,61,10,"74533"
70,"spotify:track:2THbHmoRIjbGQgP0HylMbx","AKA, Nasty C","Lemons (Lemonade)","Sound African Recordings",2,84,45,"73169"
71,"spotify:track:2HbKqm4o0w5wEeEFXm2sD4","Kendrick Lamar, Jay Rock","Money Trees","Aftermath",49,70,66,"72693"
72,"spotify:track:0ZxhtATQ0a6EvQNZ0z6NKV","Ice Spice, Nicki Minaj","Princess Diana (with Nicki Minaj)","10K Projects/Capitol Records",19,90,15,"72353"
73,"spotify:track:7aRCf5cLOFN1U7kvtChY1G","Drake","Search & Rescue","OVO/Republic Records",5,67,16,"72336"
74,"spotify:track:7GaFYUqP2WdR4KTPk7cXoP","Mario","Let Me Love You","J Records",64,83,242,"71420"
75,"spotify:track:7qEHsqek33rTcFNT9PFqLf","Lewis Capaldi","Someone You Loved","Vertigo Berlin",7,71,237,"71417"
76,"spotify:track:3F5CgOj3wFlRv51JsHbxhe","Drake, 21 Savage","Jimmy Cooks (feat. 21 Savage)","OVO",1,75,58,"71363"
77,"spotify:track:2Hh3ETdQKrmSI3QS0hme7g","Metro Boomin, Future, Don Toliver","Too Many Nights (feat. Don Toliver & with Future)","Republic Records",18,66,34,"70526"
78,"spotify:track:5wG3HvLhF6Y5KTGlK0IW3J","Metro Boomin, Travis Scott, Young Thug","Trance (with Travis Scott & Young Thug)","Republic Records",29,77,26,"70476"
79,"spotify:track:05lM7Ep8UESoe3LV5yrew5","Lloyiso","Dream About You","Ambitiouz Entertainment",54,73,73,"70201"
80,"spotify:track:0u2P5u6lvoDfwTYjAADbn4","Billie Eilish, Khalid","lovely (with Khalid)","Darkroom",22,72,274,"69696"
81,"spotify:track:0HaRLPnr887lcQM2YQzkff","Burna Boy, Ed Sheeran","For My Hand (feat. Ed Sheeran)","Spaceship/ Bad Habit/Atlantic Records",11,96,55,"69428"
82,"spotify:track:1bDbXMyjaUIooNwFE9wn0N","Drake, 21 Savage","Rich Flex","OVO / Republic Records",1,78,38,"68496"
83,"spotify:track:43PuMrRfbyyuz4QpZ3oAwN","Bryson Tiller","Exchange","TrapSoul/RCA Records",79,99,77,"67522"
84,"spotify:track:6AQbmUe0Qwf5PZnt4HmTXv","PinkPantheress, Ice Spice","Boy's a liar Pt. 2","Warner Records",10,65,25,"67392"
85,"spotify:track:4uUG5RXrOk84mYEfFvj3cK","David Guetta, Bebe Rexha","I'm Good (Blue)","Parlophone UK",8,82,48,"67198"
86,"spotify:track:4pxH1dqKimocSU5kaA4GYp","De Mthuda, Da Muziqal Chef, Kwiish SA, Eemoh","iThuba","Universal Music (Pty) Ltd.",86,93,4,"67021"
87,"spotify:track:2LBqCSwhJGcFQeTHMVGwy3","The Weeknd","Die For You","Universal Republic Records",35,85,63,"66594"
88,"spotify:track:4Dvkj6JhhA12EX05fT7y2e","Harry Styles","As It Was","Columbia",1,81,69,"65833"
89,"spotify:track:0RiRZpuVRbi7oqRdSMwhQY","Post Malone, Swae Lee","Sunflower - Spider-Man: Into the Spider-Verse","Republic Records",1,101,204,"65367"
90,"spotify:track:4fYte8ZvTK14NEhAOZocBi","OneRepublic","I Ain't Worried","Mosley Music/Interscope Records",11,86,59,"65018"
91,"spotify:track:1CViD4tJqNMF4jjgP5Ug62","Jamie Fine","If Anything's Left","Universal Music Canada",73,89,18,"65008"
92,"spotify:track:1vYXt7VSjH9JIM5oRRo7vA","Dua Lipa","Dance The Night - From Barbie The Album","Atlantic Records",92,-1,1,"63164"
93,"spotify:track:6n3HGiq4v35D6eFOSwqYuo","Drake","Teenage Fever","Cash Money Records/Young Money Ent./Universal Rec.",70,98,71,"62577"
94,"spotify:track:2IlT65thKQQw248mhk2PjQ","Brent Faiyaz","JACKIE BROWN","Lost Kids LLC., Marketed by Venice / Stem",52,94,22,"62324"
95,"spotify:track:2ktg2oZDyFAX3iY1QNkXl5","Summer Walker","Session 32","LVRN Records",87,87,42,"61084"
96,"spotify:track:4vRE28THNRQoTzZLuwaGmh","Zan'Ten, Kyika DeSoul","I like your style (feat. Kyika DeSoul)","Sound African Recordings",96,-1,1,"61002"
97,"spotify:track:6PGoSes0D9eUDeeAafB2As","Kendrick Lamar, Zacari","LOVE. FEAT. ZACARI.","Aftermath",74,109,45,"60948"
98,"spotify:track:4tqcoej1zPvwePZCzuAjJd","J. Cole","Wet Dreamz","Roc Nation Records LLC",91,107,69,"60828"
99,"spotify:track:7KA4W4McWYRpgf0fWsJZWB","Tyler, The Creator, Kali Uchis","See You Again (feat. Kali Uchis)","Columbia",57,97,15,"60360"
100,"spotify:track:4aAxUQUNTtBhDgDcyCfXUu","Pcee, Sgija'Disciples, Zan'Ten, Justin99, Mema_Percent, Mr JazziQ","Kilimanjaro (feat. Justin99, Mema_Percent & Mr JazziQ)","Sound African Recordings",3,74,23,"60107"
101,"spotify:track:3fvyqhNTjtobvYV8VYr5w0","Riaan Benadé","Spontaan","WM South Africa",72,121,125,"59647"
102,"spotify:track:2J6OF7CkpdQGSfm1wdclqn","Brent Faiyaz","Clouded","Lost Kids",86,100,28,"59522"
103,"spotify:track:2e3Ea0o24lReQFR4FA7yXH","J. Cole","Love Yourz","Roc Nation Records LLC",93,108,24,"59044"
104,"spotify:track:4wVOKKEHUJxHCFFNUWDn0B","Drake, Giveon","Chicago Freestyle (feat. Giveon)","OVO",5,95,143,"58986"
105,"spotify:track:5hJFhO9dvhJoDvUZZ9iWSw","Miguel","Adorn","ByStorm Entertainment/RCA Records",79,103,45,"58938"
106,"spotify:track:7sliFe6W30tPBPh6dvZsIH","Kaliii","Area Codes","Atlantic Records",25,91,12,"58038"
107,"spotify:track:5ZDw1sqZQDlC5aV7ir6kkN","Myztro, Focalistic, Daliwonga, ShaunMusiq & Ftears","Tobetsa Remake (feat. Focalistic, Daliwonga & ShaunMusiq & Ftears)","New Money Gang Records",5,88,34,"58035"
108,"spotify:track:1AVIL2s4vkE92Qupej37JR","Dj Jaivane, LeeMcKrazy, Skandisoul","uLala Kanjani (feat. LeeMcKrazy & Skandisoul)","Ziiki Media",108,-1,1,"57945"
109,"spotify:track:2JvzF1RMd7lE3KmFlsyZD8","J. Cole","MIDDLE CHILD","Dreamville, Inc., Under exclusive license to Roc Nation Records",2,114,121,"57357"
110,"spotify:track:5fEB6ZmVkg63GZg9qO86jh","PARTYNEXTDOOR","Break from Toronto","OVO Sound",110,123,31,"56620"
111,"spotify:track:3USxtqRwSYz57Ewm6wWRMp","Glass Animals","Heat Waves","Polydor Records",5,113,134,"55992"
112,"spotify:track:2kaH2Z8ezDUKf6fNw250rZ","Davido, Musa Keys","UNAVAILABLE (feat. Musa Keys)","Columbia",73,80,17,"55886"
113,"spotify:track:14SaZBTjxlorHJQxXh01Hu","Summer Walker, Drake","Girls Need Love (with Drake) - Remix","LVRN/Interscope Records",43,122,172,"55838"
114,"spotify:track:1BxfuPKGuaTgP7aM0Bbdwr","Taylor Swift","Cruel Summer","Taylor Swift",26,102,7,"55823"
115,"spotify:track:6kgaI3kHkqmRimeGQdS4Ga","J Hus, Drake","Who Told You (feat. Drake)","Black Butter",46,104,7,"55523"
116,"spotify:track:1zi7xx7UVEFkmKfv06H8x0","Drake, Wizkid, Kyla","One Dance","Cash Money Records/Young Money Ent./Universal Rec.",78,115,115,"55094"
117,"spotify:track:2eAvDnpXP5W0cVtiI0PUxV","Ruth B.","Dandelions","Columbia",56,133,79,"54833"
118,"spotify:track:5126E37MXDlVwL3GNsFE81","ChubbyCheeks","Kuyabongwa","ChubbyCheeks",111,111,3,"54822"
119,"spotify:track:561jH07mF1jHuk7KlaeF0s","Eminem","Mockingbird","Aftermath",52,116,41,"54346"
120,"spotify:track:7zFXmv6vqI4qOt4yGf3jYZ","Daniel Caesar, Kali Uchis","Get You (feat. Kali Uchis)","Golden Child Recordings",119,124,29,"54235"
121,"spotify:track:7MXVkk9YMctZqd1Srtv4MB","The Weeknd, Daft Punk","Starboy","Universal Republic Records",80,119,67,"53796"
122,"spotify:track:2DTnuVhrGnLcmgutAW4vb1","Lwah Ndlunkulu, Siya Ntuli","Ithuba","Nkabi Records",33,92,49,"53538"
123,"spotify:track:0AtUfScqL8UjpRGI2Mt4BI","Deejaykgosi, Baby Momo, Lington, Phemelo Saxer, Zee_nhle, iam.psalm","Ngizwile (feat. Lington, Zee_nhle, iam.psalm, Phemelo Saxer)","Wanitwa Mos Entertainment",123,-1,1,"53102"
124,"spotify:track:2gO1rty4jBXQaP7jSuVIh2","Sjava, Qwabe Twins, Mzukulu","Isoka","1020 Cartel",7,142,26,"53047"
125,"spotify:track:5Dsuz6UsZyoWM3HOaRgQeC","Lloyiso","Seasons","Universal Music (Pty) Ltd.",62,125,92,"52982"
126,"spotify:track:3JyEmaZmPsuIvFivnwN22k","Glenn Jones","All for You","Jive",126,134,20,"52243"
127,"spotify:track:3c6afiysmB7OnxQzzSqRfD","Tamia","So Into You","Rhino/Warner Records",119,140,8,"52210"
128,"spotify:track:7jtQIBanIiJOMS6RyCx6jZ","Tom Odell","Another Love","ITNO/Columbia",45,129,71,"52147"
129,"spotify:track:7yJ5UfiXvtePhopnvxyXOV","Big Nuz, Dj Yamza","Ngeke","Afrotainment",1,153,35,"51773"
130,"spotify:track:7iTTWHbr4tAlsRJN4m4bay","Lil Yachty","Strike (Holster)","Quality Control Music/Motown Records",13,110,16,"51420"
131,"spotify:track:0vjeOZ3Ft5jvAi9SBFJm1j","Metro Boomin, Future, Chris Brown","Superhero (Heroes & Villains) [with Future & Chris Brown]","Republic Records",10,128,34,"51242"
132,"spotify:track:46IZ0fSY2mpAiktS3KOqds","Adele","Easy On Me","Columbia",1,132,93,"51153"
133,"spotify:track:3BTszrSLAt9f11eWeHNTTc","Joyous Celebration","Ndenzel' Uncedo Hymn 377 - Live","Universal Music (Pty) Ltd.",107,152,22,"51071"
134,"spotify:track:1RMJOxR6GRPsBHL8qeC2ux","Daniel Caesar, H.E.R.","Best Part (feat. H.E.R.)","Golden Child Recordings",83,156,200,"51036"
135,"spotify:track:3eRE1KwnUma75nu1HhoNY4","Tevin Campbell","Can We Talk","Rhino/Warner Records",135,146,29,"50917"
136,"spotify:track:3xWGA8pa0IKFI7IMPri4P0","Ed Sheeran","Shivers","Atlantic Records UK",11,135,98,"50381"
137,"spotify:track:5uCax9HTNlzGybIStD3vDh","James Arthur","Say You Won't Let Go","Columbia",85,143,275,"50158"
138,"spotify:track:78QR3Wp35dqAhFEc2qAGjE","Lil Baby, Gunna","Drip Too Hard (Lil Baby & Gunna)","Quality Control Music/Young Stoner Life Records, a 300 Entertainment Label/Motown Records/Capitol Records",41,155,93,"49955"
139,"spotify:track:7ErtOGQ9DwyQa3lwP77j4u","Ruger","Asiwaju","Promised Land Recordings",48,117,27,"49918"
140,"spotify:track:7yq4Qj7cqayVTp3FF9CWbm","Vance Joy","Riptide","F-Stop Records/Atlantic",135,145,36,"49900"
141,"spotify:track:2C25ZeenileLHXXSS9WZvT","Mfr Souls, MDU aka TRP","The Game (Amapiano Bootleg)","Kombelani",141,-1,1,"49802"
142,"spotify:track:3LtpKP5abr2qqjunvjlX5i","Central Cee","Doja","Central Cee",20,163,38,"49746"
143,"spotify:track:7qLr3HMApUbyDkUvgIvHnB","Young Thug, Drake","Oh U Went (feat. Drake)","300 Entertainment/Atl",37,126,5,"49706"
144,"spotify:track:6MqItn0BCv0z0jYJymAmKN","King Monada","LEMENEMENE","Moreki Music",46,112,17,"49610"
145,"spotify:track:1vBqDhQhSlwr8rgIWTpCWT","Pcee, Mr JazziQ, Zan'Ten, papi_sa","Johnny ke Johnny (feat. Papi_SA)","Sound African Recordings",23,105,18,"49602"
146,"spotify:track:2mzM4Y0Rnx2BDZqRnhQ5Q6","Tems","Free Mind","Leading Vibe Ltd",68,131,67,"49597"
147,"spotify:track:3AN96mijpWgIeUEJpvCNaO","Barto","Impulsief","Select",92,130,33,"49581"
148,"spotify:track:1PDP7mLiAMwhfmgIwzhOm2","Drake, Yebba","Yebba’s Heartbreak","OVO",13,148,54,"49173"
149,"spotify:track:22VHOlVYBqytsrAqV8yXBK","Noah Kahan, Post Malone","Dial Drunk (with Post Malone)","Mercury Records/Republic Records",149,-1,1,"49155"
150,"spotify:track:2xyx0o4xNOLLjBSbOOdcbA","Summer Walker, Bryson Tiller","Playing Games (with Bryson Tiller) - Extended Version","LVRN/Interscope Records",37,161,64,"48937"
151,"spotify:track:4at3d5QWnlibMVN75ECDrp","6LACK, J. Cole","Pretty Little Fears (feat. J. Cole)","LVRN Records",11,173,118,"48649"
152,"spotify:track:0KG5PG0nz6MmKLbDWtmpdk","Inkabi Zezwe, Sjava, Big Zulu","Khaya Lami","Warner Music Africa",15,120,11,"48483"
153,"spotify:track:6I2GrwoJw23AKpqpE14KFq","the King will come","Yet","the King will come",153,192,2,"48455"
154,"spotify:track:0GdL8auv7mZFQVoSe04wFw","Major_Keys","Forever Yena 2.0","Major Keys Records",64,106,9,"47970"
155,"spotify:track:0VjIjW4GlUZAMYd2vXMi3b","The Weeknd","Blinding Lights","Republic Records",1,149,191,"47877"
156,"spotify:track:5dQdnw6G1URbrpwnDOyZxt","Vigro Deep","Soundcheck","Rinse",156,-1,1,"47873"
157,"spotify:track:40iJIUlhi6renaREYGeIDS","Drake, Travis Scott","Fair Trade (with Travis Scott)","OVO",1,160,79,"47823"
158,"spotify:track:2NtezvrtAmddHppRofjGRx","Sam Deep, De Mthuda, MaWhoo, Mkeyz","Isthutha (Inkinga Abangan Bam)","Universal Music (Pty) Ltd.",115,147,4,"47800"
159,"spotify:track:1ULFJZX54HXXjSTMx63dk0","Kabza De Small, Msaki","Khusela (feat. Msaki)","Piano Hub",5,151,61,"47779"
160,"spotify:track:3uUuGVFu1V7jTQL60S1r8z","Lost Frequencies, Calum Scott","Where Are You Now","Epic Amsterdam",13,141,101,"47635"
161,"spotify:track:4BIGl9cDzyw1znsjRytGLd","Kelvin Momo, Babalwa M, Chley, MaWhoo","Izono (feat. Mawhoo & Babalwa M & Chley)","Kelvin Momo Productions",12,137,33,"47334"
162,"spotify:track:3IKb9dsBhceDuKzxvJQdpu","Mellow & Sleazy, Tman Xpress, SjavasDaDeejay, TitoM","Amasango (feat. Sjavas Da Deejay & TitoM)","Sound African Recordings",38,139,31,"47193"
163,"spotify:track:2KcQ0PbPj0O3P48B9YX7iN","Young Nudy, 21 Savage","Peaches & Eggplants (feat. 21 Savage)","PDE Records/Same Plate/RCA Records",163,170,5,"47072"
164,"spotify:track:4W4fNrZYkobj539TOWsLO2","The Weeknd, Ariana Grande","Die For You (with Ariana Grande) - Remix","XO / Republic Records",15,166,22,"47010"
165,"spotify:track:5Yx3xbh3ob1TzcSkTZRYjT","Tebza De DJ, DJ Nomza The King","Ka Valungu","Music Band Production / EMPIRE",165,-1,1,"46792"
166,"spotify:track:3VBwoaePYGdOmG1YHgGOHi","Ice Beats Slide, Sbuda Maleather, 2woBunnies","JAGERMEISTER","Kreativekornerr",14,157,29,"46787"
167,"spotify:track:2gMXnyrvIjhVBUZwvLZDMP","Lewis Capaldi","Before You Go","Vertigo Berlin",25,162,164,"46662"
168,"spotify:track:5BbdKBZO0TH0GhfxUfyhL9","Lil Baby","Freestyle","Quality Control Music (Caroline)",136,185,26,"46448"
169,"spotify:track:4yzk4gNqwHkBrVWgGcIiJF","Kharishma, Ba Bethe Gaoshazen","Matome","4397321 Records DK",138,154,8,"46372"
170,"spotify:track:1mtEVTOOD8akXBpXT7BvFc","Royal MusiQ, Mr JazziQ, Mash Sa, Djy Zan SA","Awu'Yebo","Sedi La Keba",159,167,4,"46281"
171,"spotify:track:181RlW4FYWSzaV9xt8xUPQ","Riaan Benadé","Vat 'n Bietjie","WM South Africa",69,136,104,"46251"
172,"spotify:track:6NB2npCHsGXQ059pMhXJzl","Barto","H2Oë","Select",92,158,27,"46116"
173,"spotify:track:6Mrtxkv2PZiA4667ZQnRXh","Casswell P, Master KG, Lwami","Mangihlale (feat. Lwami)","Wanitwa Mos Entertainment",40,138,11,"46087"
174,"spotify:track:3FAJ6O0NOHQV8Mc5Ri6ENp","Giveon","Heartbreak Anniversary","Epic/Not So Fast",3,159,123,"46044"
175,"spotify:track:6I3mqTwhRpn34SLVafSH7G","Justin Bieber","Ghost","RBMG/Def Jam",21,172,95,"45912"
176,"spotify:track:5oMumOpP2Bavh3JyjbOqP5","Brendan Peyper","Toer Om Die Vloer","Select",132,168,22,"45838"
177,"spotify:track:3QFInJAm9eyaho5vBzxInN","Baby Keem, Kendrick Lamar","family ties (with Kendrick Lamar)","Columbia",15,179,56,"45564"
178,"spotify:track:6pcywuOeGGWeOQzdUyti6k","21 Savage, Metro Boomin","Glock In My Lap","Slaughter Gang, LLC/Epic/Boominati Worldwide/Republic",38,165,32,"45353"
179,"spotify:track:2QjOHCTQ1Jl3zawyYOpxh6","The Neighbourhood","Sweater Weather","Columbia",57,176,131,"45291"
180,"spotify:track:0V3wPSX9ygBnCm8psDIegu","Taylor Swift","Anti-Hero","Taylor Swift",3,174,40,"45272"
181,"spotify:track:6F70m9aMK4PSJKBfp1H8DZ","Kabza De Small, DJ Maphorisa, Ami Faku","Asibe Happy","Piano Hub",1,169,69,"45134"
182,"spotify:track:4ztdjZ2t7BVo5DLIFQBdJh","Iniko","Jericho","Columbia",70,164,13,"45088"
183,"spotify:track:7j4OmvkjRz0PrjFADlHfQx","Adele","Set Fire to the Rain","XL Recordings",68,182,17,"44992"
184,"spotify:track:2qxgejJTaZIHNSHDD22Uhl","Kabza De Small, DJ Maphorisa, Ami Faku","Abalele","Piano Hub",1,150,96,"44989"
185,"spotify:track:5rgrBsAFYMun6yhtnLKRPz","Bryson Tiller","Right My Wrongs","TrapSoul/RCA Records",171,190,7,"44936"
186,"spotify:track:0IJJ5q4ZkmC4kJvkF1HNIe","Appel","Foute","Warner Music Africa",102,118,10,"44674"
187,"spotify:track:0JmnkIqdlnUzPaf8sqBRs3","Kali Uchis","Moonlight","Geffen Records",163,183,10,"44566"
188,"spotify:track:3GCdLUSnKSMJhs4Tj6CV3s","Kendrick Lamar, SZA","All The Stars (with SZA)","Black Panther (TDE/DMG) PS",4,199,52,"44421"
189,"spotify:track:1mXVgsBdtIVeCLJnSnmtdV","Sam Smith","Too Good At Goodbyes","PLG - Capitol",69,186,138,"44366"
190,"spotify:track:343cAtGBlqslMQAgYUAbI3","Peta Teanet","African Vibe PT 2","The CCP Record Company (Pty) Limited",190,-1,1,"44359"
191,"spotify:track:13Z8di7Br7OsZn5GmtesIf","Pcee, Justin99, EeQue, Mr JazziQ","ZoTata (feat. Mr JazziQ)","Sound African Recordings",7,127,33,"44309"
192,"spotify:track:5XeFesFbtLpXzIVDNQP22n","Arctic Monkeys","I Wanna Be Yours","Domino Recording Co",159,-1,10,"44280"
193,"spotify:track:6oEVnWKgPqIEPc53OYDNqG","H.E.R., Bryson Tiller","Could've Been (feat. Bryson Tiller)","MBK Entertainment/RCA Records",77,193,59,"44163"
194,"spotify:track:5F7npl4FSAFQLsIuW3o7aR","Russell Zuma, CocoSA, George Lesley","Angikaze","Theko Price",89,171,24,"44105"
195,"spotify:track:7K3BhSpAxZBznislvUMVtn","Morgan Wallen","Last Night","Big Loud Records / Mercury Records / Republic Records",181,181,3,"44095"
196,"spotify:track:4fxwbUSI6jF4XdnvCUVG97","Elaine","You're the One","Columbia",12,-1,86,"43889"
