rank,uri,artist_names,track_name,source,peak_rank,previous_rank,weeks_on_chart,streams
1,"spotify:track:7x9aauaA9cu6tyfpHnqDLo","Jung Kook, Latto","Seven (feat. Latto)","BIGHIT MUSIC",1,1,7,"6263248"
2,"spotify:track:3Ua0m0YmEjrMi9XErKcNiR","Jimin","Like Crazy","BIGHIT MUSIC",1,3,23,"1619533"
3,"spotify:track:2N0SPREDYqILVEFSsWF5N5","V","Love Me Again","BIGHIT MUSIC",2,2,3,"1419247"
4,"spotify:track:5ydjxBSUIDn26MFzU3asP4","V","Rainy Days","BIGHIT MUSIC",3,4,3,"1265638"
5,"spotify:track:1o6cYDMHvKOfizi4d9Lqxr","W/N","id 072019","Universal Music Indochina Distributed Labels",3,6,5,"602045"
6,"spotify:track:5K2VTtm9skwbbVP54E0I4E","RAP VIỆT, Captain","Rolling Down (feat. CAPTAIN)","DAT VIET VAC",6,18,2,"408928"
7,"spotify:track:6VXVYATpQXEIoZ97NnWCmn","Madihu, Vũ.","Vì Anh Đâu Có Biết","WM Vietnam",2,9,56,"406369"
8,"spotify:track:4exlWP8cokkWVCvyP3kg7c","tlinh, 2pillz","nếu lúc đó","Universal Music Indochina Distributed Labels",1,8,26,"403932"
9,"spotify:track:1Vla7vXcM0zimotYpresDT","tlinh","tình yêu có nghĩa là gì?","Universal Music Indochina Distributed Labels",7,7,3,"393207"
10,"spotify:track:7jLSThU5Kg1RWt19Leiaxm","RPT MCK, Trung Trần","Chìm Sâu","N0L4B3L",1,11,79,"382530"
11,"spotify:track:7hU3IHwjX150XLoTVmjD0q","LISA","MONEY","YG Entertainment",1,16,67,"377030"
12,"spotify:track:25h0TqC9H3BcMA7KjK5nHK","GREY D, tlinh","vaicaunoicokhiennguoithaydoi","M Music Records",2,14,63,"361760"
13,"spotify:track:4CUvVaAYuXtvYURLFz7EIL","Emcee L (Da LAB), Da LAB, Muộii (Starry Night)","Chuyện Đôi Ta (feat. Muộii)","Yin Yang Media",3,13,91,"357597"
14,"spotify:track:255vSRpVq5YYKBJiem1BVx","Andree Right Hand","Chơi Như Tụi Mỹ","$maker Music",4,12,15,"353640"
15,"spotify:track:6HpkHTTwfVmSoopeloHqOp","RAP VIỆT, Dick, DT Tập Rap, UMIE","Anh Là Ai? (feat. Dick, DT & UMIE)","DAT VIET VAC",3,15,7,"349217"
16,"spotify:track:4TMdpMJNQdcawl8JjZEwLk","Lãng","Nụ hôn Bisou","12 trái lê",11,17,6,"343287"
17,"spotify:track:3YctJXK6kznnWl68TnYobN","RPT MCK","Anh Đã Ổn Hơn","N0L4B3L",3,19,26,"337838"
18,"spotify:track:2QUU1AtY5fndKDNbr17EFk","tlinh","người điên","Universal Music Indochina Distributed Labels",10,10,2,"320408"
19,"spotify:track:3ukrFH17Zl6iEZ2QJ1Zwiy","RPT Orijinn, Ronboogz","Don't Côi","Rapital",3,21,36,"318314"
20,"spotify:track:5iZHnufFUgATzrpGgH1K0W","T.R.I","Ánh Sao Và Bầu Trời","Yin Yang Media",1,22,95,"296634"
21,"spotify:track:0x5BqH8iC2Y2lTMxAkNAna","RAP VIỆT, RHYDER","Từ Chối Hiểu (feat. Quang Anh Rhyder)","DAT VIET VAC",21,33,2,"290681"
22,"spotify:track:6Hs2xIgB8nzyGFDvVA8lFa","Madihu, Low G","Có Em","NGUYEN CHI PHONG",4,24,71,"283361"
23,"spotify:track:08ULi904W2Po6pVj8nN7KC","GREY D, Chillies","đưa em về nhàa","M Music Records",3,20,19,"281326"
24,"spotify:track:1mFpMoeZfkIqtqW2AfQ8ba","BLACKPINK","THE GIRLS (BLACKPINK THE GAME OST)","YG Entertainment",24,-1,1,"270956"
25,"spotify:track:28bxbqNcAuNxYDZYet6eZ7","RPT MCK, tlinh","Chỉ Một Đêm Nữa Thôi","N0L4B3L",9,30,26,"269618"
26,"spotify:track:1xoadYaxtOp9gHDwgmPDuz","JSOL, Hoàng Duyên","Sài Gòn Hôm Nay Mưa","Universal Music Indochina",3,27,118,"266584"
27,"spotify:track:74ewFAgDzRkhZ7EX2eLtfZ","V","Winter Bear","BIGHIT MUSIC",27,-1,1,"259012"
28,"spotify:track:1UHkDovEFqHzHCPyNe0BTy","V","Scenery","BIGHIT MUSIC",28,-1,1,"254066"
29,"spotify:track:1EmMFSLRVkOszCa4ul9z0F","W/N, Duongg, Nau, titie","3107 3","Universal Music Indochina Distributed Labels",1,37,109,"252488"
30,"spotify:track:27Z9T0mSWHYWSj9SNOGvyt","JustaTee, Phương Ly","Thằng Điên","NGUYEN THANH TUAN",2,26,56,"251168"
31,"spotify:track:6SdPpLl72QarBuaxv7FNGw","RAP VIỆT, Dick","Sống Cho Hết Đời Thanh Xuân 4 (feat. Dick)","DAT VIET VAC",31,53,2,"246843"
32,"spotify:track:34IGOyXR6cn0YI9VBu8m0y","V, Peakboy","Snow Flower (feat. Peakboy)","BIGHIT MUSIC",32,-1,1,"246592"
33,"spotify:track:7AD5F85waSb3yZxZxEXhJM","Tóc Tiên, Touliver","Có Ai Thương Em Như Anh","Yin Yang Media",20,29,65,"246396"
34,"spotify:track:7kgzRBNkBRArtTPkYjWLYT","14 Casper, Bon Nghiêm","bao tiền một mớ bình yên?","DANDERLÉON",9,31,123,"244584"
35,"spotify:track:3a2Oftcs10wtzw6AmxuTMU","Olew","Rồi Ta Sẽ Ngắm Pháo Hoa Cùng Nhau","LOOPS Music",8,32,32,"239466"
36,"spotify:track:5ECHJ1llWBNYLVCYrllD3x","Da LAB, Phương Ly","Chạy Khỏi Thế Giới Này","LOOPS Music",11,38,61,"234519"
37,"spotify:track:5BTzf3doGTigDIYUFtbkI9","Emcee L (Da LAB), Da LAB, Badbies","Sinh Ra Đã Là Thứ Đối Lập Nhau (feat. Badbies)","Yin Yang Media",5,34,140,"231572"
38,"spotify:track:3440g8awr2l0E5Yy2X5Epk","RPT MCK","Tại Vì Sao","N0L4B3L",3,41,49,"225721"
39,"spotify:track:7kpNUrBDYDoX6QKGzrBD1R","RPT MCK, Trung Trần","Thôi Em Đừng Đi","N0L4B3L",8,42,26,"225608"
40,"spotify:track:76dD9BdSOzsRJSGGBjOcUf","HIEUTHUHAI, Negav, Kewtiie","ngủ một mình (tình rất tình)","M Music Records",2,35,37,"223996"
41,"spotify:track:08GUMwJRpisuxHGyRzoSuu","Wren Evans, itsnk","Call Me","Universal Music Indochina",23,23,3,"221799"
42,"spotify:track:0Qs29ApstkrU5T8S5Hxazw","BigDaddy, Emily","Ngõ Chạm","LOOPS Music",42,47,4,"220033"
43,"spotify:track:0vkExWiBJSrfWnlMC7x48b","UMIE","Không Yêu Xin Đừng Nói - Piano Version","LOOPS Music",38,50,26,"219701"
44,"spotify:track:17iGUekw5nFt5mIRJcUm3R","Sơn Tùng M-TP","Chúng Ta Của Hiện Tại","Universal Music Indochina Distributed Labels",1,46,141,"218464"
45,"spotify:track:6MgCMS8q3NA89TnVuPLvIN","RAP VIỆT, Captain, UMIE","Baby Gọi Cho Anh (feat. CAPTAIN & UMIE)","DAT VIET VAC",8,44,7,"216495"
46,"spotify:track:7bFFUPBiF15n8m8RziqS4o","GREY D","dự báo thời tiết hôm nay mưa","M Music Records",7,51,41,"216195"
47,"spotify:track:2Npr9vbXuQYcpnsouBIrHU","The Masked Singer, Voi Bản Đôn","Ngày Mai Người Ta Lấy Chồng (feat. Voi Bản Đôn)","THE MASKED SINGER",39,39,2,"206345"
48,"spotify:track:41JPN7pZMTp1sumBOHOzHd","Agust D, IU","People Pt.2 (feat. IU)","BIGHIT MUSIC",1,69,17,"203883"
49,"spotify:track:5T6j0rfpCDBzAxC8Fpd0N7","Low G, Thắng","An Thần","Rap Nhà Làm",2,72,97,"202670"
50,"spotify:track:2dHoVW9AxJVSRebPRyV2aA","ROSÉ","Gone","YG Entertainment",2,57,106,"199484"
51,"spotify:track:5cml547MByVlaVrKU2lJTg","Andree Right Hand, Wxrdie, Bình Gold, 2pillz","Em iu","$maker Music",18,59,14,"196158"
52,"spotify:track:5HuDnBhNLj5m865LowtgZQ","tlinh, GREY D","kho báu đánh rơi (feat. GREY D)","Universal Music Indochina Distributed Labels",28,28,2,"196007"
53,"spotify:track:7GARzfC1mwhDuk4t9WOACq","j-hope","MORE","BIGHIT MUSIC",1,5,23,"195930"
54,"spotify:track:4YSryHqsD82Krc81l1EJD5","tlinh, 2pillz, WOKEUP","ghệ iu dấu của em ơi","Universal Music Indochina Distributed Labels",8,138,27,"193770"
55,"spotify:track:4W2poMwGzKQHtpNCthoGhC","HIEUTHUHAI","Không Thể Say","M Music Records",7,43,19,"193364"
56,"spotify:track:3QD2NfLEIvMRbzv2uTu4B7","Myra Trần","Anh Chưa Thương Em Đến Vậy Đâu","Sony Music Entertainment",6,52,34,"191831"
57,"spotify:track:1RGA13K66cABN7nYek6WNk","Madihu","Không Còn Em","WM Vietnam",17,49,6,"190900"
58,"spotify:track:4AgFXIVT7hVhBZ5DEOaLu3","Thịnh Suy","tiny love","Yin Yang Media",3,65,91,"190012"
59,"spotify:track:1K3CXUYKhLYN7koLW5WQjX","Thắng","Xin Lỗi","Thắng",5,70,18,"189229"
60,"spotify:track:2pn8dNVSpYnAtlKFC8Q0DJ","ROSÉ","On The Ground","YG Entertainment",1,80,75,"188035"
61,"spotify:track:54UNNgtE3zzERwTuWSQLqd","MONSTAR, GREY D, VƯƠNG BÌNH","có hẹn với thanh xuân","Yin Yang Media",5,54,111,"187421"
62,"spotify:track:5sdQOyqq2IDhvmx2lHOpwd","NewJeans","Super Shy","ADOR",12,45,8,"185798"
63,"spotify:track:5Odq8ohlgIbQKMZivbWkEo","Charlie Puth, Jung Kook, BTS","Left and Right (Feat. Jung Kook of BTS)","Atlantic Records",1,36,62,"185393"
64,"spotify:track:7td8DTWoGC9u9db37mGHX6","Đen, PiaLinh","Nấu ăn cho em","Đen",8,61,16,"185192"
65,"spotify:track:4pLNKd4adQqEUvDfm4Q6wC","RAP VIỆT, Double2T","Người Miền Núi Chất (feat. Double2T)","DAT VIET VAC",65,67,3,"184977"
66,"spotify:track:5uyNAX6MazVAjBjVeOsTvp","W/N, Duongg, Nâu","3 1 0 7 (feat. Duongg & Nâu)","HONG AN ENTERTAIMENT,.JSC",11,71,160,"183055"
67,"spotify:track:3kxFvcB92qQg9wl52CQ7aV","Double2T, Masew","À Lôi","Gia Đình Lớn",19,60,7,"181104"
68,"spotify:track:2OBZtEg8DXhICWYd6yvicf","RAP VIỆT, 24k.Right","Từ A Đến Z (feat. 24k.Right)","DAT VIET VAC",68,-1,1,"178536"
69,"spotify:track:2WOpp4vm16unl0N3i3BNNv","Ngơ, NÂN","Tình Đắng Như Ly Cà Phê","12 trái lê",15,96,191,"178400"
70,"spotify:track:1Huy9G87D6pbIveFulsH0P","Sơn Tùng M-TP","Âm Thầm Bên Em","Universal Music Indochina Distributed Labels",35,74,149,"176387"
71,"spotify:track:5fFLotKS1286huYIMQHqz7","Sơn Tùng M-TP","Muộn Rồi Mà Sao Còn","Universal Music Indochina Distributed Labels",1,77,123,"176338"
72,"spotify:track:1yo967mk7CpjvruNxBecOY","Thắng","Trước Khi Em Tồn Tại","Thắng",22,66,15,"175840"
73,"spotify:track:62SFLTN7txImu8pQwBMP6A","Tăng Duy Tân, Hoà Minzy","Bật Tình Yêu Lên","Big Arts Entertainment",4,56,28,"171911"
74,"spotify:track:7CyPwkp0oE8Ro9Dd5CUDjW","The Weeknd, JENNIE, Lily-Rose Depp","One Of The Girls (with JENNIE, Lily Rose Depp)","XO / Republic Records",11,79,10,"170625"
75,"spotify:track:769IjpjHNrN36SPvj2ZBKu","HIEUTHUHAI","Nghe Như Tình Yêu","M Music Records",46,84,102,"168455"
76,"spotify:track:0dAAZHmjRcE3yEjeBZQvCg","RAP VIỆT, HURRYKNG, HIEUTHUHAI","Một Công Đôi Việc (feat. HURRYKNG & HIEUTHUHAI)","DAT VIET VAC",32,68,4,"166862"
77,"spotify:track:0QzuaeCEEOV40Pn7IvKEny","Dhruv","double take","Little Worry/RCA Records",8,76,121,"166430"
78,"spotify:track:1BxfuPKGuaTgP7aM0Bbdwr","Taylor Swift","Cruel Summer","Taylor Swift",5,63,18,"166056"
79,"spotify:track:3hqOrxH5qPlvrApcb7Ac8c","Ronboogz","Lan Man","MaiDao Music",33,85,20,"165670"
80,"spotify:track:0u8rZGtXJrLtiSe34FPjGG","Jimin","Like Crazy (English Version)","BIGHIT MUSIC",2,73,23,"164041"
81,"spotify:track:4bjN59DRXFRxBE1g5ne6B1","Agust D","Haegeum","BIGHIT MUSIC",1,89,19,"163941"
82,"spotify:track:6jcLKVmEKAQIXIVHJZ8vzS","MONSTAR, GREY D, NICKY, VƯƠNG BÌNH","tình yêu chậm trễ","Yin Yang Media",46,75,38,"163228"
83,"spotify:track:76KYaCx7UjHwlnrqzcovLZ","PC","10 Ngàn Năm","12 trái lê",77,104,64,"163158"
84,"spotify:track:5RuZw8NsvI4BSlmI2yqgeS","RAP VIỆT, Limitlxss, OgeNus","Anh Không Cố Ý (feat. Limitlxss & Ogenus)","DAT VIET VAC",21,78,5,"162784"
85,"spotify:track:5Bti0azlFhMattVY76qFr9","Vũ.","Lạ Lùng","WM Vietnam",17,109,282,"162608"
86,"spotify:track:1MiJk3dXC5jzhvLFP0dUM7","Da LAB","Thức Giấc","Yin Yang Media",1,87,112,"157680"
87,"spotify:track:45PPoUgqs3JrhkZGEzSUHT","W/N, ERIK, Nau","3107 4 (feat. Erik, Nâu)","Universal Music Indochina Distributed Labels",24,94,20,"154677"
88,"spotify:track:4qJSUFwZFouto5VZUlln75","tlinh, Trung Trần","Thích Quá Rùi Nà","Universal Music Indochina Distributed Labels",34,93,154,"153908"
89,"spotify:track:7len778YJVqS6VHtUZ9SrG","RAP VIỆT, Liu Grace","Take It Easy (feat. Liu Grace)","DAT VIET VAC",60,92,4,"153650"
90,"spotify:track:69CrOS7vEHIrhC2ILyEi0s","JISOO","FLOWER","YG Entertainment",2,82,22,"152398"
91,"spotify:track:1dUmmBh2nw8XzEI3au0uFs","Thịnh Suy","Chết Trong Em","InQ International",4,91,44,"151938"
92,"spotify:track:2PYDUM2IC01FOTDLQdFxJP","W/N, Duongg, Nau","3 1 0 7 - 2 (feat. DuongG & Nau)","GUM GROUP",27,95,131,"150977"
93,"spotify:track:4UOxcZqszxN9FD42DqHrVi","RAP VIỆT, Lãng, Đặng Thái Bình","VỀ QUÊ (feat. Mikelodic & Đặng Thái Bình)","DAT VIET VAC",25,83,12,"149956"
94,"spotify:track:6iXGivPFpsqKmrINhIbPvx","Lynk Lee","Buồn Thì Cứ Khóc Đi","Lynk Lee",10,128,192,"149347"
95,"spotify:track:7eDrdQ7PK9Xm1CZCKWsgmH","Vũ., TRANG","Anh Nhớ Ra (feat. TRANG)","WM Vietnam",19,88,51,"148646"
96,"spotify:track:6A1IbMKwjvXibcrU1sdqKH","MONO, Onionn.","Em Là","M Music Records",8,111,51,"148346"
97,"spotify:track:4S0uLMXRoAjFfIJOW7A8aW","Rhymastic","Nến Và Hoa","WM Vietnam",2,101,168,"147705"
98,"spotify:track:5qbjUmVV1yOOjcMOInNPYD","Kai Đinh, MIN, GREY D","để tôi ôm em bằng giai điệu này","Yin Yang Media",18,81,36,"147302"
99,"spotify:track:45Mswno1F7FoZkcmQkp7fi","Wren Evans","Thích Em Hơi Nhiều","Universal Music Indochina",1,99,115,"146329"
100,"spotify:track:6Wi18yv3aoO0ZF4uulguof","Ngọt, Mạc Mai Sương","Đá tan","Ngọt",55,147,11,"142186"
101,"spotify:track:59hBR0BCtJsfIbV9VzCVAp","Jimin","Set Me Free Pt.2","BIGHIT MUSIC",1,98,23,"139717"
102,"spotify:track:1izPmgSW7FV6XFdEOiTvOY","Changg, Minh Huy","Em Không Hiểu","Universal Music Indochina Distributed Labels",27,103,113,"138281"
103,"spotify:track:1Qrg8KqiBpW07V7PNxwwwL","SZA","Kill Bill","Top Dawg Entertainment/RCA Records",6,102,38,"137916"
104,"spotify:track:1TJtZKZFq2rdh9Wfpm15Nw","tlinh","những đốm sáng","Universal Music Indochina Distributed Labels",48,48,2,"137475"
105,"spotify:track:57FeZINjlat9NLEhYUejmd","VSOUL, MFREE, TUYEN VO","NGTANOISE","VSOUL",105,106,7,"137166"
106,"spotify:track:23SUnSd024ACX7u1AUXsGc","Văn Mai Hương, GREY D, Trung Quân","Mưa Tháng Sáu","Yin Yang Media",6,86,15,"137052"
107,"spotify:track:25edeHHueINMguqu9emCyV","Đen, Phương Anh Đào","Lối Nhỏ","Đen",1,119,201,"135746"
108,"spotify:track:186NCtNk1tUYS7c2DxgJ7O","V","Christmas Tree","MOST CONTENTS",1,58,68,"134765"
109,"spotify:track:3AejRjgBsFV4HWHjJmmEP7","GREY D, Orange, Kai Đinh","lời tạm biệt chưa nói","Universal Music Indochina Distributed Labels",22,97,58,"133121"
110,"spotify:track:7h2zqUH4bYyknNUxsYnS5V","PhucXp, Freak D","Như Anh Đã Thấy Em","MaiDao Music",33,110,36,"132679"
111,"spotify:track:2qWP5ZarXRsdmxzz3L3BtP","SUNI, Hoàng Dũng, GREY D, Orange, tlinh","có hẹn với thanh xuân","Universal Music Indochina Distributed Labels",27,107,57,"130379"
112,"spotify:track:7FbrGaHYVDmfr7KoLIZnQ7","FIFTY FIFTY","Cupid (Twin Ver.) - Live Studio Version OT4","ATTRAKT",7,108,25,"129290"
113,"spotify:track:5FFVQGnZuJt9iAYpasTeq4","tlinh","nữ siêu anh hùng","Universal Music Indochina Distributed Labels",40,40,2,"129125"
114,"spotify:track:3MJhPqL2IgGs7gHEB2M35q","BLACKPINK","Hard to Love","YG Entertainment",5,124,29,"128961"
115,"spotify:track:41WQUSINanQHfhfKpFDsms","Miley Cyrus","Used To Be Young","Columbia",115,-1,1,"127318"
116,"spotify:track:0phm7GkRTCRI9OQqTJvG6q","tlinh","làm lành chữa tình","Universal Music Indochina Distributed Labels",55,55,2,"127252"
117,"spotify:track:7gRFDGEzF9UkBV233yv2dc","BLACKPINK","Shut Down","YG Entertainment",2,125,50,"126968"
118,"spotify:track:3b34161QoxLwsqhWSPy9i5","Da LAB","Thanh Xuân","Sony Music Entertainment",1,127,262,"126853"
119,"spotify:track:3DLtPObflLQBodZN8qGODT","JustaTee, BigDaddy","2AM","WM Vietnam",18,130,70,"126665"
120,"spotify:track:2cJyuhqcXvd6ccvAn8NXsL","tlinh","thế giới thần tiên","Universal Music Indochina Distributed Labels",62,62,2,"125501"
121,"spotify:track:2g68ePl7VMltuOiuSTAz7I","RAP VIỆT, RHYDER","Để Anh Một Mình (feat. Quang Anh Rhyder)","DAT VIET VAC",50,120,13,"125334"
122,"spotify:track:4h3K653rm69JYWpO4du2BJ","Andiez","Chờ Đợi Có Đáng Sợ","Yin Yang Media",76,123,63,"125031"
123,"spotify:track:68EMU2RD1ECNeOeJ5qAXCV","Charlie Puth, Selena Gomez","We Don't Talk Anymore (feat. Selena Gomez)","Artist Partner",71,131,190,"124781"
124,"spotify:track:4N99EuIjwSSFFFMDfTeOLU","buitruonglinh, Vũ Phụng Tiên","Em Không Khóc (feat. Vũ Phụng Tiên)","Yin Yang Media",122,136,45,"124073"
125,"spotify:track:0DtarPcErIh4skfFtxzomo","Tama","Ngày Em Đẹp Nhất","Tama",104,122,12,"123495"
126,"spotify:track:7LVrrX8pkzI9fMF88nGabt","Đen, JustaTee","Đi Về Nhà","Đen",3,113,141,"122813"
127,"spotify:track:0bYVPJvXr8ACmw313cVvhB","BLACKPINK","Tally","YG Entertainment",8,114,17,"122763"
128,"spotify:track:4Iz5EWPCAT8jYNk4IpLoll","buitruonglinh","Dù Cho Mai Về Sau","Yin Yang Media",10,133,128,"121936"
129,"spotify:track:1vvcEHQdaUTvWt0EIUYcFK","Kodak Black, NLE Choppa, Jimin, JVKE, Muni Long, Fast & Furious: The Fast Saga","Angel Pt. 1 (feat. Jimin of BTS, JVKE & Muni Long)","APG Inc – FF10",1,117,16,"121526"
130,"spotify:track:6PmjpeFEpxxAmuVmGkdWPJ","RAP VIỆT, SMO, Hoàng Tôn","Nhà Văn Vở (feat. SMO & Hoàng Tôn)","DAT VIET VAC",130,-1,1,"120914"
131,"spotify:track:2ZJTmYNOA8k21yUtLXJG57","AMEE","ưng quá chừng","Yin Yang Media",2,115,26,"120287"
132,"spotify:track:4SFknyjLcyTLJFPKD2m96o","BLACKPINK","How You Like That","YG Entertainment",1,-1,104,"119376"
133,"spotify:track:1odExI7RdWc4BT515LTAwj","David Kushner","Daylight","Miserable Music Group, LLC",111,126,16,"119287"
134,"spotify:track:0wwfocY1CfXcKfMcWSoGXc","buitruonglinh","Yêu Người Có Ước Mơ","LOOPS Music",83,139,20,"119258"
135,"spotify:track:5hkAuvgkOrd4KpDOlCNsvW","MONO, Onionn.","Waiting For You","M Music Records",1,121,54,"118980"
136,"spotify:track:3EvZ9Ztgy03uUhxlv8PLf3","tlinh","người đẹp ngủ","Universal Music Indochina Distributed Labels",64,64,2,"118963"
137,"spotify:track:6HGOxrNik4iPurqStawTFQ","Sơn Tùng M-TP","MAKING MY WAY","M-TP Entertainment Ltd",2,116,18,"118610"
138,"spotify:track:7oBUoEbCDF748UkHnLusUB","Thịnh Suy","Chuyện Rằng","Yin Yang Media",5,135,160,"118591"
139,"spotify:track:2X5LuMWLKierQu3O9H1Bxc","Tuyên, MC Goku","Sài Gòn Tôi Mưa (feat. MC Goku)","Yin Yang Media",139,-1,1,"118403"
140,"spotify:track:5zwwW9Oq7ubSxoCGyW1nbY","BLACKPINK","Pink Venom","YG Entertainment",3,142,54,"117299"
141,"spotify:track:1q83e1qvjHBPCgOvdGSKZ0","RAP VIỆT, Pháp Kiều, Dương Hoàng Yến","Say Bye! (feat. Pháp Kiều & Dương Hoàng Yến)","DAT VIET VAC",141,-1,1,"117051"
142,"spotify:track:0pQ67Kp2kED4ISy1ieGPEq","PC, Dick, tofutns","Ghé Qua","12 trái lê",64,172,154,"117003"
143,"spotify:track:37C9dPZpyhW1BIg1SoMw9P","RAP VIỆT, gung0cay","Khum Hề Giả Trân (feat. gung0cay)","DAT VIET VAC",143,160,2,"115251"
144,"spotify:track:7j3XQm7RR8T2EzaYtYK4rc","W/N, Tezzy, Tien","Crush 2","RioX Records",61,173,62,"113877"
145,"spotify:track:05X3a0YGmS1rbH50aL8lGF","Văn Mai Hương, Hứa Kim Tuyền","Một Ngàn Nỗi Đau","Yin Yang Media",7,129,62,"113570"
146,"spotify:track:41aMYNen9G7uUbqLfV65cF","Rapital, RPT MCK, Phongkhin","Tay To","M Music Records",58,141,112,"111949"
147,"spotify:track:5cF0dROlMOK5uNZtivgu50","Charlie Puth","Attention","Artist Partner",21,140,165,"111719"
148,"spotify:track:1wvLeW8THXNent0N2sGSgF","Sáo","Ngồi Nhìn Em Khóc","Yin Yang Media",95,148,16,"111409"
149,"spotify:track:5J90ah0ppUSev1uahqQiN6","Andiez, AMEE","Anh Đánh Rơi Người Yêu Này","MaiDao Music",19,146,43,"111290"
150,"spotify:track:1Y3LN4zO1Edc2EluIoSPJN","Stephen Sanchez, Em Beihold","Until I Found You (with Em Beihold) - Em Beihold Version","Republic Records",43,166,42,"111104"
151,"spotify:track:38rjRVqEHSlDRrDWDvjkqW","Vũ.","Bước Qua Nhau","WM Vietnam",1,156,94,"110876"
152,"spotify:track:0h7QMc9ZRzA9QJrbEHytn2","Jin","The Astronaut","BIGHIT MUSIC",1,-1,19,"110852"
153,"spotify:track:2o4dDfLK6NVI7TjBm5VoMv","Lou Hoàng, Miu Lê","Yêu Một Người Có Lẽ","Onlyc Entertainment",33,144,108,"110255"
154,"spotify:track:5U30iZBlmxkpHqzb1OSnBS","Rhymastic","Yêu 5","WM Vietnam",77,158,157,"109955"
155,"spotify:track:4zWupGvCuWHKCOkJfvZ6AX","RAP VIỆT, Lãng","Khúc Ca Vàng (feat. Mikelodic)","DAT VIET VAC",109,118,3,"109098"
156,"spotify:track:2bdVgAQgosGUJoViVDNeOV","keshi","LIMBO","Island Records",21,153,28,"107687"
157,"spotify:track:4rPrBNnDgdZpS5gosHv0yr","Ngọt","để quên","Ngọt",33,-1,12,"107680"
158,"spotify:track:5YiqPAVbiFUj1G1qvbXo0X","Chillies","Giấc Mơ Khác","WM Vietnam",14,152,29,"107019"
159,"spotify:track:4W4fNrZYkobj539TOWsLO2","The Weeknd, Ariana Grande","Die For You (with Ariana Grande) - Remix","XO / Republic Records",3,143,27,"106825"
160,"spotify:track:5IAESfJjmOYu7cHyX557kz","BTS","Take Two","BIGHIT MUSIC",2,112,12,"106657"
161,"spotify:track:4LWcvlsVnpYDflrviNR3SM","Hiền Hồ","Khóc Ở Trong Club","LOOPS Music",161,162,2,"106520"
162,"spotify:track:0eFMbKCRw8KByXyWBw8WO7","Jung Kook","Still With You","BIGHIT MUSIC",3,132,9,"106316"
163,"spotify:track:2nR51wakN5K3AJENqGaNg9","Đen, MIN","Bài Này Chill Phết","Đen",1,154,222,"105653"
164,"spotify:track:78lw4wahFNotXb0mOEtPkM","WEAN","BADBYE","WEAN",50,134,12,"105605"
165,"spotify:track:4MRXbWH2BzuUZcoabj6HRh","Táo","Blue Tequila","Yin Yang Media",26,181,151,"104897"
166,"spotify:track:6uxuJ8Fr1AAfSPJUF9N1yr","Vũ.","Bước Qua Mùa Cô Đơn","WM Vietnam",1,180,142,"104622"
167,"spotify:track:5odlY52u43F5BjByhxg7wg","JVKE","golden hour","JVKE",6,171,47,"104322"
168,"spotify:track:3rx7g2qRxKscgtQUiKwQvN","Phương Ly","ThichThich","PHUONG LY",9,137,58,"104289"
169,"spotify:track:1u8c2t2Cy7UBoG4ArRcF5g","Taylor Swift","Blank Space","Big Machine Records, LLC",51,164,167,"103081"
170,"spotify:track:4Wxtt0dAbPrXZDu4wfR8dN","RAP VIỆT, OgeNus, Anh Tú, Đặng Thái Bình","NÀNG (feat. Ogenus, Anh Tú & Đặng Thái Bình)","DAT VIET VAC",147,187,8,"102034"
171,"spotify:track:6DyotcCWPqKQT8YWireU6L","Low G","Tán Gái 505","Rap Nhà Làm",149,-1,15,"101501"
172,"spotify:track:6Ov6L8Iy0SMEl9w1TOUvaG","Wxrdie, WOKEUP, 2pillz","Vinflow","LOOPS Music",161,161,3,"101428"
173,"spotify:track:0L8LOav65XwLjCLS11gNPD","BLACKPINK","Typa Girl","YG Entertainment",3,159,49,"101331"
174,"spotify:track:7uQZVznj0uQOGC9KhV2Mg6","LISA","LALISA","YG Entertainment",1,157,39,"101228"
175,"spotify:track:0Hzh4SoX1st9W22vZieLrm","Lãng, Chiennhatlang","Đủ trải sẽ thấm","LOOPS Music",127,150,6,"100936"
176,"spotify:track:014DA3BdnmD3kI5pBogH7c","Chillies, SUNI, Rhymastic","Cứ Chill Thôi","WM Vietnam",5,169,164,"100875"
177,"spotify:track:2zRzmGerfTxc2epZHgaTdh","Ngọt, Đen","Cho Tôi Lang Thang","Ngọt",35,194,171,"100151"
178,"spotify:track:1HWa2i5mZzs2VImVqwwfuI","RAP VIỆT, JustaTee, Karik, BigDaddy, Andree Right Hand, Suboi, B Ray, Thai VG","We Go Hard (feat. JustaTee, Karik, BigDaddy, Andree Right Hand, Suboi, B Ray & Thai VG)","DAT VIET VAC",64,155,13,"99889"
179,"spotify:track:4BLpd6QINAs4UXd1lVtdhj","Charlie Puth","Dangerously","Artist Partner",87,185,18,"99882"
180,"spotify:track:2z9iLlNBt1aLZUCFgXby97","Sơn Tùng M-TP","Có Chắc Yêu Là Đây","Universal Music Indochina Distributed Labels",1,-1,151,"99805"
181,"spotify:track:3rigEvSPZYJI3rAt9gVdXy","Gill, tlinh, Kewtiie","Mắt Xanh","M Music Records",60,178,34,"99708"
182,"spotify:track:5KFUnnRbtef0hgKXfeCoOv","RAP VIỆT, OgeNus","Mẹ Biết Mẹ Buồn (feat. Ogenus)","DAT VIET VAC",151,151,2,"99686"
183,"spotify:track:5Msoarj5hk9LguTtiIyqug","Đức Phúc","Ngày Đầu Tiên","Duc Phuc",2,170,81,"99295"
184,"spotify:track:7fNHfgOxPLcg4mQLhCnOHB","Rapital, Groovie Lã Thắng, tlinh, RPT MCK","XTC (Xích Thêm Chút) (Remix)","M Music Records",87,182,113,"99152"
185,"spotify:track:6rdkCkjk6D12xRpdMXy0I2","NewJeans","New Jeans","ADOR",26,149,8,"99051"
186,"spotify:track:3y6kYOBeVg8jtUiBdTR0pD","Tùng TeA, PC, TaynguyenSound","Già Cùng Nhau Là Được","12 trái lê",70,190,78,"98922"
187,"spotify:track:2LBqCSwhJGcFQeTHMVGwy3","The Weeknd","Die For You","Universal Republic Records",49,176,63,"98658"
188,"spotify:track:1mKDbug8bbfDmLe7I4CJpe","Da LAB, Miu Lê","Gác Lại Âu Lo (feat. Miu Lê)","Yin Yang Media",2,189,162,"98429"
189,"spotify:track:70hEVaGwwat644nPWkhKNW","Phuc Du","yêu anh đi mẹ anh bán bánh mì","LOOPS Music",28,174,28,"98078"
190,"spotify:track:40fjFtLBN98eDzOS4NfXs5","Da LAB, Tóc Tiên","Nước Mắt Em Lau Bằng Tình Yêu Mới","MUNIZ MUSIC COMPANY LIMITED",114,165,32,"98003"
191,"spotify:track:0gzpqwLf1jhNjnSJEyweAX","Kuun Đức Nam, Linh Thộn","Tình cờ yêu em","MaiDao Music",191,-1,1,"97554"
192,"spotify:track:3J3nv18iIrOhca1ZWNeuyW","JustaTee","Đã Lỡ Yêu Em Nhiều","NGUYEN THANH TUAN",36,186,44,"97530"
193,"spotify:track:4Rbnxa7kFSpCHNPJ3uZhtR","B Ray, Han Sara, Masew","Xin Đừng Nhấc Máy","Great Entertainment",9,-1,67,"97409"
194,"spotify:track:3Wno87vVBVbSVS2vUUFuKC","V","Sweet Night","(주)블렌딩",1,100,68,"96345"
195,"spotify:track:5HbLlcJogki9rRq2KfkGQP","Sơn Tùng M-TP","Nơi Này Có Anh","Universal Music Indochina Distributed Labels",5,-1,233,"96329"
196,"spotify:track:7hkvAaJNRlnetwv8Se2kDA","Pháo","Một Ngày Chẳng Nắng","Pháo, distributed by MIXUS",46,177,18,"95968"
197,"spotify:track:2a5hng9yXtbjtTVVm9UviC","Vũ Cát Tường","Mơ","Universal Music Indochina Distributed Labels",132,197,56,"95895"
198,"spotify:track:5nD5PVXUkIpv0WcwfNFrgS","Orange, Hoàng Dũng","Khi Em Lớn","Orange",4,175,117,"95777"
199,"spotify:track:2IGMVunIBsBLtEQyoI1Mu7","Doja Cat","Paint The Town Red","Kemosabe Records/RCA Records",199,-1,1,"94185"
200,"spotify:track:1w3eUC89GPspKpi62tPwjt","Hoàng Dũng","Nàng Thơ","Yin Yang Media",2,200,161,"94139"
