rank,uri,artist_names,track_name,source,peak_rank,previous_rank,weeks_on_chart,streams
1,"spotify:track:2HRgqmZQC0MC7GeNuDIXHN","Jung Kook, Latto","Seven (feat. Latto) (Explicit Ver.)","BIGHIT MUSIC",1,2,52,"1499297"
2,"spotify:track:1kPhV0KQui1phEpjnWIqUN","Jimin, Loco","Smeraldo Garden Marching Band (feat. Loco)","BIGHIT MUSIC",1,1,2,"1434191"
3,"spotify:track:31VNCmwspR7nVJ6kruUuJt","Sơn Tùng M-TP","Đừng Làm Trái Tim Anh Đau","Universal Music Indochina Distributed Labels",1,3,5,"1394748"
4,"spotify:track:2KslE17cAJNHTsI2MI0jb2","Jung Kook","Standing Next to You","BIGHIT MUSIC",1,5,35,"1348411"
5,"spotify:track:3Alwi53Ahc2GwHgvel42b2","Lou Hoàng","Ngày Đẹp Trời Để Nói Chia Tay","WM Vietnam",4,6,4,"852961"
6,"spotify:track:3Ua0m0YmEjrMi9XErKcNiR","Jimin","Like Crazy","BIGHIT MUSIC",1,4,68,"810780"
7,"spotify:track:2N0SPREDYqILVEFSsWF5N5","V","Love Me Again","BIGHIT MUSIC",2,7,48,"778770"
8,"spotify:track:6vvPecFTmWxDfEJ6cYT1wa","LISA","Rockstar","Lloud Co./RCA Records",8,8,2,"629736"
9,"spotify:track:7yfcQynap4xcNqnydaFw83","SOOBIN, tlinh","Ai Mà Biết Được (feat. tlinh)","WDND",9,11,3,"533599"
10,"spotify:track:2nRMW95dnOILirpjbksLTs","Jung Kook","Never Let Go","BIGHIT MUSIC",2,9,5,"501809"
11,"spotify:track:3OVMe3H6iAxbLF8iD2UYrw","Sơn Tùng M-TP","Chúng Ta Của Tương Lai","Universal Music Indochina Distributed Labels",1,13,18,"488853"
12,"spotify:track:5XfGQZA0ioQAWUjlyJRcHc","Shiki, Obito","1000 Ánh Mắt","12 trái lê",12,18,2,"486752"
13,"spotify:track:2xOhv7XudrBDtkID1jwsFE","Vũ Cát Tường","Từng Là","Universal Music Indochina Distributed Labels",2,14,19,"467430"
14,"spotify:track:4nXrVH5xwN1w6TpmP7uu8n","HIEUTHUHAI, marzuz","Exit Sign","M Music Records",14,23,39,"463127"
15,"spotify:track:4oGgxjxVOI69h9uOpHOzwn","Wren Evans","Để Ý","Universal Music Indochina Distributed Labels",10,12,4,"438738"
16,"spotify:track:4qYfRfSxsmhJ1WMaywtLyI","Wren Evans, itsnk","Từng Quen","Universal Music Indochina",1,16,37,"428600"
17,"spotify:track:4fj4Jn4nw8fGX8xdbCntJf","CoolKid, RHYDER","Sau Cơn Mưa","MaiDao Music",8,28,45,"428401"
18,"spotify:track:0PBTlQ84CBJF0tBnKGmQa6","V","FRI(END)S","BIGHIT MUSIC",1,15,17,"424427"
19,"spotify:track:4CUvVaAYuXtvYURLFz7EIL","Emcee L (Da LAB), Da LAB, Muộii (Starry Night)","Chuyện Đôi Ta (feat. Muộii)","Yin Yang Media",3,17,136,"411524"
20,"spotify:track:1J3SmWwlYAG68LGKr86MVH","Sơn Tùng M-TP","Chúng Ta Của Hiện Tại","Universal Music Indochina Distributed Labels",1,19,186,"405631"
21,"spotify:track:5PLjpBivzvuaIIqqkQgnRK","GREY D, tlinh","vaicaunoicokhiennguoithaydoi","M Music Records",2,24,108,"398579"
22,"spotify:track:1bG6Q8sR8jda7ryI365y8o","Vũ., Dear Jane","Những Lời Hứa Bỏ Quên","WM Vietnam",1,22,30,"376915"
23,"spotify:track:1K0HQ30Wc11okzlcnFA7Ub","HIEUTHUHAI","Không Thể Say","M Music Records",7,29,64,"368581"
24,"spotify:track:7tFwBnuaGXqiiONukPRaCo","Minh Huy","Miên Man","LOOPS Music",11,26,45,"366469"
25,"spotify:track:5PGh9MyKry8slG5AfvD1eD","Obito, Shiki, VSTRA","Hà Nội","12 trái lê",10,25,40,"356018"
26,"spotify:track:4vfhartd7HDWGJbdVIycEu","Sơn Tùng M-TP","Muộn Rồi Mà Sao Còn","Universal Music Indochina Distributed Labels",1,31,168,"353763"
27,"spotify:track:1khMN4Adfi3LrZvxOq4YM5","VSOUL, RPT MCK, Obito, Ronboogz, Boyzed","Buồn Hay Vui (feat. RPT MCK, Obito, Ronboogz & Boyzed)","12 trái lê",3,21,29,"349510"
28,"spotify:track:4exlWP8cokkWVCvyP3kg7c","tlinh, 2pillz","nếu lúc đó","Universal Music Indochina Distributed Labels",1,20,71,"348364"
29,"spotify:track:5ECHJ1llWBNYLVCYrllD3x","Da LAB, Phương Ly","Chạy Khỏi Thế Giới Này","LOOPS Music",11,30,106,"333535"
30,"spotify:track:3a2Oftcs10wtzw6AmxuTMU","Olew","Rồi Ta Sẽ Ngắm Pháo Hoa Cùng Nhau","LOOPS Music",8,35,77,"331655"
31,"spotify:track:2uZmeuNAxSm7XfVIwLkhCx","Ronboogz","nhắn nhủ","MaiDao Music",14,40,30,"323029"
32,"spotify:track:76KYaCx7UjHwlnrqzcovLZ","PC","10 Ngàn Năm","12 trái lê",27,49,109,"316765"
33,"spotify:track:6VXVYATpQXEIoZ97NnWCmn","Madihu, Vũ.","Vì Anh Đâu Có Biết","WM Vietnam",2,32,101,"310763"
34,"spotify:track:4jWmhzf53Q0ZvZMuGdiR9x","WEAN, tlinh","shhhhhhh..","WEAN",9,33,40,"309232"
35,"spotify:track:7jLSThU5Kg1RWt19Leiaxm","RPT MCK, Trung Trần","Chìm Sâu","N0L4B3L",1,36,124,"308850"
36,"spotify:track:0A0oqleZkyD8FN6aW48Jzn","Khiem","Yên Bình Có Quá Đắt Không","Universal Music Indochina Distributed Labels",36,-1,1,"308477"
37,"spotify:track:1o6cYDMHvKOfizi4d9Lqxr","W/N","id 072019","Universal Music Indochina Distributed Labels",3,34,50,"307646"
38,"spotify:track:3A9A7mfVDVm3rrS9SMGhg5","Kha","Hư không","MaiDao Music",22,38,26,"307630"
39,"spotify:track:5BTzf3doGTigDIYUFtbkI9","Emcee L (Da LAB), Da LAB, Badbies","Sinh Ra Đã Là Thứ Đối Lập Nhau (feat. Badbies)","Yin Yang Media",5,42,185,"298960"
40,"spotify:track:7CyPwkp0oE8Ro9Dd5CUDjW","The Weeknd, JENNIE, Lily-Rose Depp","One Of The Girls (with JENNIE, Lily Rose Depp)","XO / Republic Records",11,41,55,"290680"
41,"spotify:track:4tqXSj46umlymdIxqY8zso","SOOBIN","giá như","WDND",13,44,13,"285877"
42,"spotify:track:3k6q0O9JnO2GhvD6C8fs20","Jimin","Closer Than This","BIGHIT MUSIC",3,10,10,"281828"
43,"spotify:track:5T6j0rfpCDBzAxC8Fpd0N7","Low G, Thắng","An Thần","Rap Nhà Làm",2,37,142,"280399"
44,"spotify:track:3ZbZtdEw9U0uZW4tZItIwq","RHYDER, CoolKid, BAN","Chịu Cách Mình Nói Thua","RHYDER",6,48,33,"277096"
45,"spotify:track:5LQpQ6SDeaz6SIkR0lvsoC","GREY D, Chillies","đưa em về nhàa","M Music Records",3,45,64,"268785"
46,"spotify:track:1xoadYaxtOp9gHDwgmPDuz","JSOL, Hoàng Duyên","Sài Gòn Hôm Nay Mưa","Universal Music Indochina",3,50,163,"265935"
47,"spotify:track:5WIKVELHZYJ4vl3x3xlbZD","DMT, Dangrangto, TeuYungBoy, summerdayy, Rocky CDE","Ổ Quỷ","Smiley Panda",15,39,11,"263583"
48,"spotify:track:2qSkIjg1o9h3YT9RAgYN75","Sabrina Carpenter","Espresso","Island Records",13,46,12,"262873"
49,"spotify:track:6KgZf5gZgF1KLNxq1qZgHP","Phương Ly","Anh Là Ngoại Lệ Của Em","WM Vietnam",7,43,40,"260296"
50,"spotify:track:3DLtPObflLQBodZN8qGODT","JustaTee, BigDaddy","2AM","WM Vietnam",18,52,115,"256828"
51,"spotify:track:6D94p9ASguBcYlDC0o56vx","HIEUTHUHAI","NOLOVENOLIFE","M Music Records",24,64,39,"256484"
52,"spotify:track:5J3m0taZ0W1E9HTE0MwcSv","Low G","Simp Gái 808","Rap Nhà Làm",9,61,39,"255128"
53,"spotify:track:6QqLjFssCtiZWKET97Qv3n","Sơn Tùng M-TP","Nơi Này Có Anh","Universal Music Indochina Distributed Labels",5,47,266,"253773"
54,"spotify:track:47QP509sXnE54NwhzoMHAi","BABYMONSTER","FOREVER","YG Entertainment",54,104,2,"251154"
55,"spotify:track:65aTHDZWUdh6WIafu9MtNF","HIEUTHUHAI, Negav, Kewtiie","ngủ một mình (tình rất tình)","M Music Records",2,57,82,"250832"
56,"spotify:track:0tWqngfOXKN1xOlYK4WwVw","Sơn Tùng M-TP","Âm Thầm Bên Em","Universal Music Indochina Distributed Labels",34,53,194,"246251"
57,"spotify:track:0kHgteR4TV4LO80wrasDSR","Karik, GDucky","Bạn Đời","WM Vietnam",5,55,41,"243679"
58,"spotify:track:1J12HjUuXfJnaUdubTEzSR","HIEUTHUHAI","Nghe Như Tình Yêu","M Music Records",46,59,147,"242904"
59,"spotify:track:3ukrFH17Zl6iEZ2QJ1Zwiy","RPT Orijinn, Ronboogz","Don't Côi","Rapital",3,65,81,"239337"
60,"spotify:track:27Z9T0mSWHYWSj9SNOGvyt","JustaTee, Phương Ly","Thằng Điên","NGUYEN THANH TUAN",2,60,101,"235534"
61,"spotify:track:1UQNU5O9VttUgO16pxUnjw","Obito, Shiki, RPT MCK","Đánh Đổi","12 trái lê",7,62,40,"235372"
62,"spotify:track:4NTanSVXBkQ2NmDEbr2vLE","Kai Đinh, GREY D, Hoàng Thùy Linh","Trái đất ôm Mặt trời","Yin Yang Media",8,58,29,"234223"
63,"spotify:track:7kgzRBNkBRArtTPkYjWLYT","14 Casper, Bon Nghiêm","bao tiền một mớ bình yên?","DANDERLÉON",9,51,168,"233460"
64,"spotify:track:6xKs4CnVadRzdNZ48vhT27","Đức Phúc","Ngày Đầu Sau Chia Tay","Duc Phuc",56,66,3,"232439"
65,"spotify:track:5iZHnufFUgATzrpGgH1K0W","T.R.I","Ánh Sao Và Bầu Trời","Yin Yang Media",1,68,140,"231341"
66,"spotify:track:3YctJXK6kznnWl68TnYobN","RPT MCK","Anh Đã Ổn Hơn","N0L4B3L",3,63,71,"230203"
67,"spotify:track:5C1O3fpMsiisJpHiB1uuDf","52Hz, RIO","ĐỢI (Prod. RIO)","DAO Entertainment",13,71,27,"226309"
68,"spotify:track:6kCU6i8iRrAAmJJ8Sj4JYC","Shartnuss, Tr.D, Phankeo","Nắng có mang em về","MaiDao Music",44,74,22,"222889"
69,"spotify:track:2kauMp3YNHXULGXyJh4321","Wren Evans, itsnk","Phóng Đổ Tim Em","Universal Music Indochina",9,67,30,"219517"
70,"spotify:track:01qFKNWq73UfEslI0GvumE","Jung Kook, Jack Harlow","3D (feat. Jack Harlow)","BIGHIT MUSIC",2,54,41,"219142"
71,"spotify:track:0vkExWiBJSrfWnlMC7x48b","UMIE","Không Yêu Xin Đừng Nói - Piano Version","LOOPS Music",37,69,71,"218575"
72,"spotify:track:255vSRpVq5YYKBJiem1BVx","Andree Right Hand","Chơi Như Tụi Mỹ","$maker Music",4,56,60,"218456"
73,"spotify:track:2JuHIbFudHwDqQssgqsH3i","Vũ Phụng Tiên, DT Tập Rap, Drum7","Lệ Lưu Ly","Big Arts Entertainment",6,70,42,"213956"
74,"spotify:track:3K7RddI2L8Wiv7uIbrhfLc","The Masked Singer, Lâm Bảo Ngọc, Hứa Kim Tuyền","Rồi Em Sẽ Gặp Một Chàng Trai Khác","THE MASKED SINGER",11,75,34,"212567"
75,"spotify:track:6dOtVTDdiauQNBQEDOtlAB","Billie Eilish","BIRDS OF A FEATHER","Darkroom/Interscope Records",75,91,8,"211117"
76,"spotify:track:2qWP5ZarXRsdmxzz3L3BtP","SUNI, Hoàng Dũng, GREY D, Orange, tlinh","có hẹn với thanh xuân","Universal Music Indochina Distributed Labels",27,72,102,"208663"
77,"spotify:track:1aKvZDoLGkNMxoRYgkckZG","ILLIT","Magnetic","BELIFT LAB",5,76,16,"204093"
78,"spotify:track:0gzpqwLf1jhNjnSJEyweAX","Kuun Đức Nam, Linh Thộn","Tình cờ yêu em","MaiDao Music",12,80,46,"203068"
79,"spotify:track:0s7RyyUlQfd8mnnboHe18n","MANBO, HIEUTHUHAI, HURRYKNG","Hẹn Gặp Em Dưới Ánh Trăng","Gerdnang",79,113,17,"202850"
80,"spotify:track:4gaxEUZE4z9pJAVTSFwgQI","14 Casper, Bon Nghiêm, buitruonglinh","một đời","DANDERLÉON",62,82,15,"202805"
81,"spotify:track:0pQ67Kp2kED4ISy1ieGPEq","PC, Dick, tofutns","Ghé Qua","12 trái lê",64,85,199,"202195"
82,"spotify:track:2o4dDfLK6NVI7TjBm5VoMv","Lou Hoàng, Miu Lê","Yêu Một Người Có Lẽ","Onlyc Entertainment",33,81,133,"201900"
83,"spotify:track:3hqOrxH5qPlvrApcb7Ac8c","Ronboogz","Lan Man","MaiDao Music",33,77,65,"199294"
84,"spotify:track:1izPmgSW7FV6XFdEOiTvOY","Changg, Minh Huy","Em Không Hiểu","Universal Music Indochina Distributed Labels",27,78,158,"198636"
85,"spotify:track:6jcLKVmEKAQIXIVHJZ8vzS","MONSTAR, GREY D, NICKY, VƯƠNG BÌNH","tình yêu chậm trễ","Yin Yang Media",46,86,83,"197655"
86,"spotify:track:1EmMFSLRVkOszCa4ul9z0F","W/N, Duongg, Nau, titie","3107 3","Universal Music Indochina Distributed Labels",1,99,154,"195505"
87,"spotify:track:28bxbqNcAuNxYDZYet6eZ7","RPT MCK, tlinh","Chỉ Một Đêm Nữa Thôi","N0L4B3L",9,79,71,"194910"
88,"spotify:track:1MiJk3dXC5jzhvLFP0dUM7","Da LAB","Thức Giấc","Yin Yang Media",1,73,157,"194375"
89,"spotify:track:4N99EuIjwSSFFFMDfTeOLU","buitruonglinh, Vũ Phụng Tiên","Em Không Khóc (feat. Vũ Phụng Tiên)","Yin Yang Media",62,87,90,"192131"
90,"spotify:track:0QzuaeCEEOV40Pn7IvKEny","Dhruv","double take","Little Worry/RCA Records",8,100,166,"189736"
91,"spotify:track:1GJ3suxtUVaguVQRemw6Zp","Andiez","Suýt Nữa Thì...","MaiDao Music",82,116,105,"189025"
92,"spotify:track:3QD2NfLEIvMRbzv2uTu4B7","Myra Trần","Anh Chưa Thương Em Đến Vậy Đâu","Sony Music Entertainment",6,101,79,"185077"
93,"spotify:track:2a5hng9yXtbjtTVVm9UviC","Vũ Cát Tường","Mơ","Universal Music Indochina Distributed Labels",86,93,98,"183624"
94,"spotify:track:65cM1nyMf9pFDZVV8xmPX9","GREY D","dự báo thời tiết hôm nay mưa","M Music Records",7,95,86,"183003"
95,"spotify:track:6Hs2xIgB8nzyGFDvVA8lFa","Madihu, Low G","Có Em","NGUYEN CHI PHONG",4,92,116,"180223"
96,"spotify:track:3uT8QfoX0BE8ZJa4h98LDW","Puppy, Dangrangto","Wrong Times","MaiDao Music",73,126,36,"179314"
97,"spotify:track:193luTcDfusSUv3yqs1gGj","ANH TRAI ""SAY HI"", Quang Hùng MasterD, Negav, Công Dương, NICKY","CATCH ME IF YOU CAN (feat. Quang Hùng MasterD, Negav, Công Dương & Nicky)","Anh Trai Say Hi",97,-1,1,"178775"
98,"spotify:track:45PPoUgqs3JrhkZGEzSUHT","W/N, ERIK, Nau","3107 4 (feat. Erik, Nâu)","Universal Music Indochina Distributed Labels",24,98,65,"177183"
99,"spotify:track:3NvH1v6NOxlawEoCXjg9sK","Kai Đinh, MIN, Hoàng Dũng","điều vô tri nhất","Yin Yang Media",89,89,2,"175604"
100,"spotify:track:5uyNAX6MazVAjBjVeOsTvp","W/N, Duongg, Nâu","3 1 0 7 (feat. Duongg & Nâu)","HONG AN ENTERTAIMENT,.JSC",11,102,205,"175076"
101,"spotify:track:1dUmmBh2nw8XzEI3au0uFs","Thịnh Suy","Chết Trong Em","InQ International",4,109,89,"174297"
102,"spotify:track:3ET3xHCLMGd57u06A9RjJ0","Ronboogz","Nói Dối","MaiDao Music",79,136,36,"169372"
103,"spotify:track:2n00rcPaXcWfFB9irOKOmh","Ronboogz","Anh Chỉ Muốn","MaiDao Music",77,155,26,"168778"
104,"spotify:track:7j3XQm7RR8T2EzaYtYK4rc","W/N, Tezzy, Tien","Crush 2","RioX Records",61,105,107,"168683"
105,"spotify:track:0X28PqBpbQhWdi4usYw0w5","Wren Evans, itsnk","Tò Te Tí","Universal Music Indochina",3,88,30,"167305"
106,"spotify:track:6aaNsCMWPBaUuJE1grH6Po","Sơn Tùng M-TP","Có Chắc Yêu Là Đây","Universal Music Indochina Distributed Labels",1,97,160,"166860"
107,"spotify:track:1K3CXUYKhLYN7koLW5WQjX","Thắng","Xin Lỗi","Thắng",5,150,60,"165872"
108,"spotify:track:6IHLOkgZftkcqS3fM0jMCT","MONO, Onionn.","Em Xinh","M Music Records",10,90,28,"165071"
109,"spotify:track:0wwfocY1CfXcKfMcWSoGXc","buitruonglinh","Yêu Người Có Ước Mơ","LOOPS Music",83,112,65,"164683"
110,"spotify:track:2vYaldhZyuRk6me6yowg8e","Sơn Tùng M-TP","Buông Đôi Tay Nhau Ra","Universal Music Indochina Distributed Labels",73,117,54,"164005"
111,"spotify:track:7LVrrX8pkzI9fMF88nGabt","Đen, JustaTee","Đi Về Nhà","Đen",3,96,186,"163501"
112,"spotify:track:5XK9xF4Wu2ch0zSPSHHuqv","Kay Trần, Cường Seven, Kiên Ứng, SOOBIN","Nước Hoa","Universal Music Indochina Distributed Labels",112,-1,1,"163271"
113,"spotify:track:3AejRjgBsFV4HWHjJmmEP7","GREY D, Orange, Kai Đinh","lời tạm biệt chưa nói","Universal Music Indochina Distributed Labels",22,115,103,"163196"
114,"spotify:track:6iXGivPFpsqKmrINhIbPvx","Lynk Lee","Buồn Thì Cứ Khóc Đi","Lynk Lee",10,83,237,"161950"
115,"spotify:track:6DyotcCWPqKQT8YWireU6L","Low G","Tán Gái 505","Rap Nhà Làm",65,120,60,"161381"
116,"spotify:track:4AgFXIVT7hVhBZ5DEOaLu3","Thịnh Suy","tiny love","Yin Yang Media",3,133,136,"160103"
117,"spotify:track:5nD5PVXUkIpv0WcwfNFrgS","Orange, Hoàng Dũng","Khi Em Lớn","Orange",4,114,159,"159953"
118,"spotify:track:25edeHHueINMguqu9emCyV","Đen, Phương Anh Đào","Lối Nhỏ","Đen",1,106,246,"159512"
119,"spotify:track:4h3K653rm69JYWpO4du2BJ","Andiez","Chờ Đợi Có Đáng Sợ","Yin Yang Media",76,121,108,"159454"
120,"spotify:track:7kpNUrBDYDoX6QKGzrBD1R","RPT MCK, Trung Trần","Thôi Em Đừng Đi","N0L4B3L",8,119,71,"158504"
121,"spotify:track:68EMU2RD1ECNeOeJ5qAXCV","Charlie Puth, Selena Gomez","We Don't Talk Anymore (feat. Selena Gomez)","Artist Partner",71,130,206,"158307"
122,"spotify:track:5J90ah0ppUSev1uahqQiN6","Andiez, AMEE","Anh Đánh Rơi Người Yêu Này","MaiDao Music",19,158,88,"158277"
123,"spotify:track:4qJSUFwZFouto5VZUlln75","tlinh, Trung Trần","Thích Quá Rùi Nà","Universal Music Indochina Distributed Labels",34,107,199,"157540"
124,"spotify:track:54UNNgtE3zzERwTuWSQLqd","MONSTAR, GREY D, VƯƠNG BÌNH","có hẹn với thanh xuân","Yin Yang Media",5,122,156,"156245"
125,"spotify:track:3b34161QoxLwsqhWSPy9i5","Da LAB","Thanh Xuân","Sony Music Entertainment",1,131,307,"154037"
126,"spotify:track:7ykRltK3k4QHFGqOdgn8Ew","Đạt G","Thêm Bao Nhiêu Lâu","Zing MP3",126,144,7,"153934"
127,"spotify:track:7sZgr8RsXkDwkmiQok691a","Thịnh Suy","Mai Mình Xa","InQ International",85,139,13,"153297"
128,"spotify:track:78lw4wahFNotXb0mOEtPkM","WEAN","BADBYE","WEAN",50,123,20,"152433"
129,"spotify:track:18iADruKMXIloyA9vCJXFE","An Vũ, Sino","Chàng Trai Bất Tử","Yin Yang Media",56,143,23,"152165"
130,"spotify:track:5Bti0azlFhMattVY76qFr9","Vũ.","Lạ Lùng","WM Vietnam",17,146,327,"151745"
131,"spotify:track:2Asy51yFMEG8Qjh15kvQeD","Obito, Shiki","Tell the kids i love them","12 trái lê",30,137,39,"150151"
132,"spotify:track:2PYDUM2IC01FOTDLQdFxJP","W/N, Duongg, Nau","3 1 0 7 - 2 (feat. DuongG & Nau)","GUM GROUP",27,138,176,"149719"
133,"spotify:track:2G5ujw3rrWcAXQqT8PVnrz","Obito, Shiki, Lăng LD","Đầu Đường Xó Chợ","12 trái lê",39,118,36,"148171"
134,"spotify:track:5cml547MByVlaVrKU2lJTg","Andree Right Hand, Wxrdie, Bình Gold, 2pillz","Em iu","$maker Music",18,108,59,"145534"
135,"spotify:track:7iabz12vAuVQYyekFIWJxD","Central Cee, Lil Baby","BAND4BAND (feat. Lil Baby)","Columbia",135,180,3,"145117"
136,"spotify:track:2ddbldKhKrYvOBbYa87cbj","Vũ., Hà Anh Tuấn","Dành Hết Xuân Thì Để Chờ Nhau","WM Vietnam",13,125,17,"143914"
137,"spotify:track:4jWxeq0IpdNhEaBzkNNwTf","Kevindauroi","Đừng Xa Anh Nhé (feat. Harvey)","MaiDao Music",137,-1,1,"143399"
138,"spotify:track:2o1pb13quMReXZqE7jWsgq","Ariana Grande","intro (end of the world)","Republic Records",13,140,18,"143014"
139,"spotify:track:1R1AFI3iNOYr0pGHwjFQBG","B Ray","Cao Ốc 20","Great Entertainment",128,157,13,"142657"
140,"spotify:track:1BxfuPKGuaTgP7aM0Bbdwr","Taylor Swift","Cruel Summer","Taylor Swift",5,149,63,"142419"
141,"spotify:track:45Mswno1F7FoZkcmQkp7fi","Wren Evans","Thích Em Hơi Nhiều","Universal Music Indochina",1,135,160,"141297"
142,"spotify:track:4sgMbwl9lXGyHcHmtFYGMm","aespa","Supernova","SM Entertainment",15,110,9,"139956"
143,"spotify:track:3XEspwit4d8gwKKgeopfCv","Sean, Lửa","Em Thích","MaiDao Music",65,-1,76,"139887"
144,"spotify:track:51ZQ1vr10ffzbwIjDCwqm4","Ariana Grande","we can't be friends (wait for your love)","Republic Records",17,142,18,"139082"
145,"spotify:track:0hiQvlWSSTr7n1kc1X2Lus","HIEUTHUHAI, Harmonie","Bật Nhạc Lên","GERDNANG",59,178,192,"138710"
146,"spotify:track:0dBKcPEAsdxWJsqNDNHcPz","Andree Right Hand, RHYDER, WOKEUP","Dân Chơi Sao Phải Khóc","$maker Music",16,141,27,"138580"
147,"spotify:track:5N3hjp1WNayUPZrA8kJmJP","Sabrina Carpenter","Please Please Please","Island Records",83,129,5,"138448"
148,"spotify:track:59hBR0BCtJsfIbV9VzCVAp","Jimin","Set Me Free Pt.2","BIGHIT MUSIC",1,27,38,"138122"
149,"spotify:track:3y6kYOBeVg8jtUiBdTR0pD","Tùng TeA, PC, TaynguyenSound","Già Cùng Nhau Là Được","12 trái lê",70,159,117,"137591"
150,"spotify:track:6uxuJ8Fr1AAfSPJUF9N1yr","Vũ.","Bước Qua Mùa Cô Đơn","WM Vietnam",1,161,187,"137570"
151,"spotify:track:7h2zqUH4bYyknNUxsYnS5V","PhucXp, Freak D","Như Anh Đã Thấy Em","MaiDao Music",33,172,81,"137240"
152,"spotify:track:1Qrg8KqiBpW07V7PNxwwwL","SZA","Kill Bill","Top Dawg Entertainment/RCA Records",6,145,75,"135300"
153,"spotify:track:3vkCueOmm7xQDoJ17W1Pm3","Mitski","My Love Mine All Mine","Dead Oceans",30,185,40,"134810"
154,"spotify:track:53zusvCJkyGYjEZ6bnLIjh","Hà Anh Tuấn","Tháng Tư Là Lời Nói Dối Của Em","Yin Yang Media",49,151,32,"134760"
155,"spotify:track:7paCdW3grnoEi95tjO1OkG","Thịnh Suy","Thắc Mắc?","InQ International",110,152,31,"132836"
156,"spotify:track:0Qs29ApstkrU5T8S5Hxazw","BigDaddy, Emily","Ngõ Chạm","LOOPS Music",41,134,49,"132834"
157,"spotify:track:5qbjUmVV1yOOjcMOInNPYD","Kai Đinh, MIN, GREY D","để tôi ôm em bằng giai điệu này","Yin Yang Media",18,173,81,"132698"
158,"spotify:track:4S0uLMXRoAjFfIJOW7A8aW","Rhymastic","Nến Và Hoa","WM Vietnam",2,166,213,"131954"
159,"spotify:track:02H58MSfVESkKyx4diDgu7","RM","LOST!","BIGHIT MUSIC",1,84,7,"131803"
160,"spotify:track:11hcyWq7qSwBE3bvv5Ialn","buitruonglinh","Dù Cho Mai Về Sau - Acoustic Version","Yin Yang Media",59,164,138,"131413"
161,"spotify:track:2zRzmGerfTxc2epZHgaTdh","Ngọt, Đen","Cho Tôi Lang Thang","Ngọt",35,147,215,"130993"
162,"spotify:track:4XkEva4YsNmPQBLe8V126L","HIEUTHUHAI, Phương Ly","Xoay Một Vòng","M Music Records",160,160,2,"130769"
163,"spotify:track:0tGmDUHDoT8pxYhgAT3yNG","Wren Evans, itsnk","bé ơi từ từ","Universal Music Indochina",8,103,30,"130636"
164,"spotify:track:2SmnoPHetB88xJwC6HJHGv","ANH TRAI ""SAY HI"", HIEUTHUHAI, JSOL, Ali Hoàng Dương, Vũ Thịnh","LOVE SAND (feat. HIEUTHUHAI, JSOL, Ali Hoàng Dương & Vũ Thịnh)","Anh Trai Say Hi",164,-1,1,"130556"
165,"spotify:track:7AD5F85waSb3yZxZxEXhJM","Tóc Tiên, Touliver","Có Ai Thương Em Như Anh","Yin Yang Media",20,162,110,"130062"
166,"spotify:track:2DzFmWhrnRHROJuxW5e1t2","KayC, tlinh","Bao Nhiêu Loài Hoa Remix (feat. tlinh, Machiot)","MaiDao Music",166,-1,1,"129459"
167,"spotify:track:2nR51wakN5K3AJENqGaNg9","Đen, MIN","Bài Này Chill Phết","Đen",1,153,267,"129426"
168,"spotify:track:6f7M5UzYYeLFCMIBQhxk2J","Rhymastic","Lặng","Universal Music Indochina Distributed Labels",168,-1,1,"128836"
169,"spotify:track:5tdz7T4hTxA1ipJMBe24uX","AMEE","ex's hate me, Pt.2","Yin Yang Media",13,-1,90,"128460"
170,"spotify:track:5AJ9hqTS2wcFQCELCFRO7A","Tommy Richman","MILLION DOLLAR BABY","PULSE Records",84,174,9,"128418"
171,"spotify:track:3440g8awr2l0E5Yy2X5Epk","RPT MCK","Tại Vì Sao","N0L4B3L",3,169,94,"128138"
172,"spotify:track:2OzhQlSqBEmt7hmkYxfT6m","Taylor Swift, Post Malone","Fortnight (feat. Post Malone)","Taylor Swift",2,186,12,"127446"
173,"spotify:track:71Q8QWLpvwvfQ6zM5BdCnm","2T, Văn","Liệu Giờ","LOOPS Music",22,163,201,"127378"
174,"spotify:track:1sEOTXdVl8X7SzuJi0P1cq","Dept, Ashley Alisha","Van Gogh (feat. Ashley Alisha)","WM Korea",41,-1,26,"127301"
175,"spotify:track:0eM8iGaE97UCf9yYbDiMA4","ANH TRAI ""SAY HI"", Lou Hoàng, Pháp Kiều, WEAN, Quân A.P, Hải Đăng Doo, Ali Hoàng Dương, NICKY","HÚT (feat. Lou Hoàng, Pháp Kiều, WEAN, Quân A.P, Hải Đăng Doo, Ali Hoàng Dương & Nicky)","Anh Trai Say Hi",175,-1,1,"126586"
176,"spotify:track:3J3nv18iIrOhca1ZWNeuyW","JustaTee","Đã Lỡ Yêu Em Nhiều","NGUYEN THANH TUAN",36,188,83,"125880"
177,"spotify:track:5BJqg07SKgmFnVLOBmLFvq","Bùi Anh Tuấn","Hẹn Một Mai - From"" 4 Năm 2 Chàng 1 Tình Yêu""","Vietnam Music Award",109,-1,12,"125122"
178,"spotify:track:3BwFxsC7QpRejdE9GXFQI4","D Blue, Killic","Chỉ Còn Ta Và Ta Giữa Trời","12 trái lê",173,187,10,"124863"
179,"spotify:track:22DH8NChecsgPxDjA4pqer","Quavo, Lana Del Rey","Tough","Quality Control Music/Motown Records",179,-1,1,"124412"
180,"spotify:track:39KWnPNEvbXt423CzjvBfA","SOOBIN","Anh Đã Quen Với Cô Đơn","WM Vietnam",180,-1,6,"124233"
181,"spotify:track:1m4BSQjgXAfoR4dBAapAr7","Masew, B Ray, REDT, Ý Tiên","Lửng Lơ","SKY Music JSC",113,179,83,"123976"
182,"spotify:track:5ocSQW5sIUIOFojwXEz9Ki","NewJeans","Supernatural","ADOR",73,154,3,"123939"
183,"spotify:track:1fgzQI6AtswiR0JMXulldH","Nguyễn Minh Xuân Ái","Là Từ Lúc (Since)","MaiDao Music",97,165,15,"123785"
184,"spotify:track:7MXVkk9YMctZqd1Srtv4MB","The Weeknd, Daft Punk","Starboy","Universal Republic Records",153,-1,11,"123124"
185,"spotify:track:6sIWcLjuMvOcxAfMOx1kbB","Coldzy, Minsicko, tlinh","FEVER","The First Management",76,128,5,"122933"
186,"spotify:track:2WOpp4vm16unl0N3i3BNNv","Ngơ, NÂN","Tình Đắng Như Ly Cà Phê","12 trái lê",15,-1,233,"122791"
187,"spotify:track:5cn5oHiXJTLiuthgbgfkMh","Vũ Cát Tường","Vết Mưa","Universal Music Indochina Distributed Labels",57,175,35,"122763"
188,"spotify:track:7oBUoEbCDF748UkHnLusUB","Thịnh Suy","Chuyện Rằng","Yin Yang Media",5,176,205,"122402"
189,"spotify:track:3nAwC1qVqRQYiRCrp6q1dU","Winno","Say Đắm Trong Lần Đầu","MaiDao Music",142,-1,45,"122080"
190,"spotify:track:1njlnn8ZKHI77Pe9szIONR","BABYMONSTER","SHEESH","YG Entertainment",45,171,15,"121943"
191,"spotify:track:4Iz5EWPCAT8jYNk4IpLoll","buitruonglinh","Dù Cho Mai Về Sau","Yin Yang Media",10,170,173,"121797"
192,"spotify:track:014DA3BdnmD3kI5pBogH7c","Chillies, SUNI, Rhymastic","Cứ Chill Thôi","WM Vietnam",5,124,183,"121553"
193,"spotify:track:7GDgpad2BQVuDUzaxHFakc","BABYMONSTER","LIKE THAT","YG Entertainment",110,181,11,"121065"
194,"spotify:track:1Vla7vXcM0zimotYpresDT","tlinh","tình yêu có nghĩa là gì?","Universal Music Indochina Distributed Labels",7,-1,42,"120853"
195,"spotify:track:1ZSwYD21wiQCx3VYrnQHMm","Đen, Friends","FRIENDSHIP","Đen",111,111,2,"120181"
196,"spotify:track:6Z9kpBWGd5PX1OCwTHvnTl","Rayo, Huỳnh Văn","Cẩm Tú Cầu","RayO",187,198,4,"120033"
197,"spotify:track:0TcbY7JJzalPExhhqpgAQM","ANH TRAI ""SAY HI"", Isaac, Quang Hùng MasterD, Negav, Gin Tuấn Kiệt, Vũ Thịnh, NANON","DON'T CARE (feat. Isaac, Quang Hùng MasterD, Negav, Gin Tuấn Kiệt, Vũ Thịnh & Nanon)","Anh Trai Say Hi",197,-1,1,"119959"
198,"spotify:track:7fNHfgOxPLcg4mQLhCnOHB","Rapital, Groovie Lã Thắng, tlinh, RPT MCK","XTC (Xích Thêm Chút) (Remix)","M Music Records",87,196,158,"119062"
199,"spotify:track:72ictTz6o0dusD2QpCn4bn","Wxrdie, Andree Right Hand, Machiot","TETVOVEN","M Music Records",39,168,32,"118951"
200,"spotify:track:36OyVzUmUFb1MTTzy3YXbh","Phan Mạnh Quỳnh","Sau Lời Từ Khước (Theme Song From ""MAI"")","Yin Yang Media",3,177,21,"118303"
