rank,uri,artist_names,track_name,source,peak_rank,previous_rank,weeks_on_chart,streams
1,"spotify:track:2HRgqmZQC0MC7GeNuDIXHN","Jung Kook, Latto","Seven (feat. Latto) (Explicit Ver.)","BIGHIT MUSIC",1,1,53,"1373619"
2,"spotify:track:2KslE17cAJNHTsI2MI0jb2","Jung Kook","Standing Next to You","BIGHIT MUSIC",1,4,36,"1271712"
3,"spotify:track:31VNCmwspR7nVJ6kruUuJt","Sơn Tùng M-TP","Đừng Làm Trái Tim Anh Đau","Universal Music Indochina Distributed Labels",1,3,6,"1202665"
4,"spotify:track:1kPhV0KQui1phEpjnWIqUN","Jimin, Loco","Smeraldo Garden Marching Band (feat. Loco)","BIGHIT MUSIC",1,2,3,"1052740"
5,"spotify:track:2N0SPREDYqILVEFSsWF5N5","V","Love Me Again","BIGHIT MUSIC",2,7,49,"725259"
6,"spotify:track:3Ua0m0YmEjrMi9XErKcNiR","Jimin","Like Crazy","BIGHIT MUSIC",1,6,69,"671081"
7,"spotify:track:3Alwi53Ahc2GwHgvel42b2","Lou Hoàng","Ngày Đẹp Trời Để Nói Chia Tay","WM Vietnam",4,5,5,"633093"
8,"spotify:track:5XfGQZA0ioQAWUjlyJRcHc","Shiki, Obito","1000 Ánh Mắt","12 trái lê",8,12,3,"553753"
9,"spotify:track:7yfcQynap4xcNqnydaFw83","SOOBIN, tlinh","Ai Mà Biết Được (feat. tlinh)","WDND",9,9,4,"535264"
10,"spotify:track:4nXrVH5xwN1w6TpmP7uu8n","HIEUTHUHAI, marzuz","Exit Sign","M Music Records",10,14,40,"499393"
11,"spotify:track:193luTcDfusSUv3yqs1gGj","ANH TRAI ""SAY HI"", Quang Hùng MasterD, Negav, Công Dương, NICKY","CATCH ME IF YOU CAN (feat. Quang Hùng MasterD, Negav, Công Dương & Nicky)","Anh Trai Say Hi",11,97,2,"497361"
12,"spotify:track:0A0oqleZkyD8FN6aW48Jzn","Khiem","Yên Bình Có Quá Đắt Không","Universal Music Indochina Distributed Labels",12,36,2,"471119"
13,"spotify:track:4fj4Jn4nw8fGX8xdbCntJf","CoolKid, RHYDER","Sau Cơn Mưa","MaiDao Music",8,17,46,"469025"
14,"spotify:track:2xOhv7XudrBDtkID1jwsFE","Vũ Cát Tường","Từng Là","Universal Music Indochina Distributed Labels",2,13,20,"466202"
15,"spotify:track:6vvPecFTmWxDfEJ6cYT1wa","LISA","Rockstar","Lloud Co./RCA Records",8,8,3,"450932"
16,"spotify:track:3OVMe3H6iAxbLF8iD2UYrw","Sơn Tùng M-TP","Chúng Ta Của Tương Lai","Universal Music Indochina Distributed Labels",1,11,19,"437668"
17,"spotify:track:4CUvVaAYuXtvYURLFz7EIL","Emcee L (Da LAB), Da LAB, Muộii (Starry Night)","Chuyện Đôi Ta (feat. Muộii)","Yin Yang Media",3,19,137,"415271"
18,"spotify:track:1K0HQ30Wc11okzlcnFA7Ub","HIEUTHUHAI","Không Thể Say","M Music Records",7,23,65,"409633"
19,"spotify:track:4qYfRfSxsmhJ1WMaywtLyI","Wren Evans, itsnk","Từng Quen","Universal Music Indochina",1,16,38,"407409"
20,"spotify:track:5PLjpBivzvuaIIqqkQgnRK","GREY D, tlinh","vaicaunoicokhiennguoithaydoi","M Music Records",2,21,109,"392807"
21,"spotify:track:1J3SmWwlYAG68LGKr86MVH","Sơn Tùng M-TP","Chúng Ta Của Hiện Tại","Universal Music Indochina Distributed Labels",1,20,187,"391368"
22,"spotify:track:0PBTlQ84CBJF0tBnKGmQa6","V","FRI(END)S","BIGHIT MUSIC",1,18,18,"390634"
23,"spotify:track:1bG6Q8sR8jda7ryI365y8o","Vũ., Dear Jane","Những Lời Hứa Bỏ Quên","WM Vietnam",1,22,31,"377100"
24,"spotify:track:6f7M5UzYYeLFCMIBQhxk2J","Rhymastic","Lặng","Universal Music Indochina Distributed Labels",24,168,2,"371395"
25,"spotify:track:7tFwBnuaGXqiiONukPRaCo","Minh Huy","Miên Man","LOOPS Music",11,24,46,"360429"
26,"spotify:track:4exlWP8cokkWVCvyP3kg7c","tlinh, 2pillz","nếu lúc đó","Universal Music Indochina Distributed Labels",1,28,72,"346924"
27,"spotify:track:1khMN4Adfi3LrZvxOq4YM5","VSOUL, RPT MCK, Obito, Ronboogz, Boyzed","Buồn Hay Vui (feat. RPT MCK, Obito, Ronboogz & Boyzed)","12 trái lê",3,27,30,"341467"
28,"spotify:track:5PGh9MyKry8slG5AfvD1eD","Obito, Shiki, VSTRA","Hà Nội","12 trái lê",10,25,41,"340631"
29,"spotify:track:4oGgxjxVOI69h9uOpHOzwn","Wren Evans","Để Ý","Universal Music Indochina Distributed Labels",10,15,5,"337377"
30,"spotify:track:3EQjXzlXY0dyOovq0Awe91","ANH TRAI ""SAY HI"", RHYDER, Dương Domic, Pháp Kiều","HÀO QUANG (feat. RHYDER, Dương Domic & Pháp Kiều)","Anh Trai Say Hi",30,-1,1,"335712"
31,"spotify:track:76KYaCx7UjHwlnrqzcovLZ","PC","10 Ngàn Năm","12 trái lê",27,32,110,"333397"
32,"spotify:track:3a2Oftcs10wtzw6AmxuTMU","Olew","Rồi Ta Sẽ Ngắm Pháo Hoa Cùng Nhau","LOOPS Music",8,30,78,"332413"
33,"spotify:track:5ECHJ1llWBNYLVCYrllD3x","Da LAB, Phương Ly","Chạy Khỏi Thế Giới Này","LOOPS Music",11,29,107,"331677"
34,"spotify:track:2SmnoPHetB88xJwC6HJHGv","ANH TRAI ""SAY HI"", HIEUTHUHAI, JSOL, Ali Hoàng Dương, Vũ Thịnh","LOVE SAND (feat. HIEUTHUHAI, JSOL, Ali Hoàng Dương & Vũ Thịnh)","Anh Trai Say Hi",34,164,2,"331136"
35,"spotify:track:2nRMW95dnOILirpjbksLTs","Jung Kook","Never Let Go","BIGHIT MUSIC",2,10,6,"330267"
36,"spotify:track:1o6cYDMHvKOfizi4d9Lqxr","W/N","id 072019","Universal Music Indochina Distributed Labels",3,37,51,"329789"
37,"spotify:track:4vfhartd7HDWGJbdVIycEu","Sơn Tùng M-TP","Muộn Rồi Mà Sao Còn","Universal Music Indochina Distributed Labels",1,26,169,"316122"
38,"spotify:track:2uZmeuNAxSm7XfVIwLkhCx","Ronboogz","nhắn nhủ","MaiDao Music",14,31,31,"315693"
39,"spotify:track:6VXVYATpQXEIoZ97NnWCmn","Madihu, Vũ.","Vì Anh Đâu Có Biết","WM Vietnam",2,33,102,"314107"
40,"spotify:track:4jWmhzf53Q0ZvZMuGdiR9x","WEAN, tlinh","shhhhhhh..","WEAN",9,34,41,"305071"
41,"spotify:track:5BTzf3doGTigDIYUFtbkI9","Emcee L (Da LAB), Da LAB, Badbies","Sinh Ra Đã Là Thứ Đối Lập Nhau (feat. Badbies)","Yin Yang Media",5,39,186,"303755"
42,"spotify:track:7jLSThU5Kg1RWt19Leiaxm","RPT MCK, Trung Trần","Chìm Sâu","N0L4B3L",1,35,125,"300338"
43,"spotify:track:5T6j0rfpCDBzAxC8Fpd0N7","Low G, Thắng","An Thần","Rap Nhà Làm",2,43,143,"297006"
44,"spotify:track:3A9A7mfVDVm3rrS9SMGhg5","Kha","Hư không","MaiDao Music",22,38,27,"296946"
45,"spotify:track:3DLtPObflLQBodZN8qGODT","JustaTee, BigDaddy","2AM","WM Vietnam",18,50,116,"291031"
46,"spotify:track:65aTHDZWUdh6WIafu9MtNF","HIEUTHUHAI, Negav, Kewtiie","ngủ một mình (tình rất tình)","M Music Records",2,55,83,"279380"
47,"spotify:track:6D94p9ASguBcYlDC0o56vx","HIEUTHUHAI","NOLOVENOLIFE","M Music Records",24,51,40,"277204"
48,"spotify:track:3ZbZtdEw9U0uZW4tZItIwq","RHYDER, CoolKid, BAN","Chịu Cách Mình Nói Thua","RHYDER",6,44,34,"270304"
49,"spotify:track:7CyPwkp0oE8Ro9Dd5CUDjW","The Weeknd, JENNIE, Lily-Rose Depp","One Of The Girls (with JENNIE, Lily Rose Depp)","XO / Republic Records",11,40,56,"270204"
50,"spotify:track:5WIKVELHZYJ4vl3x3xlbZD","DMT, Dangrangto, TeuYungBoy, summerdayy, Rocky CDE","Ổ Quỷ","Smiley Panda",15,47,12,"269098"
51,"spotify:track:1xoadYaxtOp9gHDwgmPDuz","JSOL, Hoàng Duyên","Sài Gòn Hôm Nay Mưa","Universal Music Indochina",3,46,164,"264852"
52,"spotify:track:5J3m0taZ0W1E9HTE0MwcSv","Low G","Simp Gái 808","Rap Nhà Làm",9,52,40,"263514"
53,"spotify:track:1J12HjUuXfJnaUdubTEzSR","HIEUTHUHAI","Nghe Như Tình Yêu","M Music Records",46,58,148,"259112"
54,"spotify:track:6xKs4CnVadRzdNZ48vhT27","Đức Phúc","Ngày Đầu Sau Chia Tay","Duc Phuc",54,64,4,"258987"
55,"spotify:track:0fGJiHH6xSUJU1MAVjxq5m","Karik, GDucky","Bạn Đời","WM Vietnam",5,57,42,"258493"
56,"spotify:track:0s7RyyUlQfd8mnnboHe18n","MANBO, HIEUTHUHAI, HURRYKNG","Hẹn Gặp Em Dưới Ánh Trăng","Gerdnang",56,79,18,"257625"
57,"spotify:track:7kgzRBNkBRArtTPkYjWLYT","14 Casper, Bon Nghiêm","bao tiền một mớ bình yên?","DANDERLÉON",9,63,169,"254106"
58,"spotify:track:4tqXSj46umlymdIxqY8zso","SOOBIN","giá như","WDND",13,41,14,"251150"
59,"spotify:track:6KgZf5gZgF1KLNxq1qZgHP","Phương Ly","Anh Là Ngoại Lệ Của Em","WM Vietnam",7,49,41,"250521"
60,"spotify:track:5iZHnufFUgATzrpGgH1K0W","T.R.I","Ánh Sao Và Bầu Trời","Yin Yang Media",1,65,141,"249023"
61,"spotify:track:0tWqngfOXKN1xOlYK4WwVw","Sơn Tùng M-TP","Âm Thầm Bên Em","Universal Music Indochina Distributed Labels",34,56,195,"248494"
62,"spotify:track:5LQpQ6SDeaz6SIkR0lvsoC","GREY D, Chillies","đưa em về nhàa","M Music Records",3,45,65,"242782"
63,"spotify:track:6QqLjFssCtiZWKET97Qv3n","Sơn Tùng M-TP","Nơi Này Có Anh","Universal Music Indochina Distributed Labels",5,53,267,"241894"
64,"spotify:track:0vkExWiBJSrfWnlMC7x48b","UMIE","Không Yêu Xin Đừng Nói - Piano Version","LOOPS Music",37,71,72,"237248"
65,"spotify:track:27Z9T0mSWHYWSj9SNOGvyt","JustaTee, Phương Ly","Thằng Điên","NGUYEN THANH TUAN",2,60,102,"235596"
66,"spotify:track:255vSRpVq5YYKBJiem1BVx","Andree Right Hand","Chơi Như Tụi Mỹ","$maker Music",4,72,61,"232901"
67,"spotify:track:3K7RddI2L8Wiv7uIbrhfLc","The Masked Singer, Lâm Bảo Ngọc, Hứa Kim Tuyền","Rồi Em Sẽ Gặp Một Chàng Trai Khác","THE MASKED SINGER",11,74,35,"231051"
68,"spotify:track:4gaxEUZE4z9pJAVTSFwgQI","14 Casper, Bon Nghiêm, buitruonglinh","một đời","DANDERLÉON",62,80,16,"228481"
69,"spotify:track:5C1O3fpMsiisJpHiB1uuDf","52Hz, RIO","ĐỢI (Prod. RIO)","DAO Entertainment",13,67,28,"228294"
70,"spotify:track:3ukrFH17Zl6iEZ2QJ1Zwiy","RPT Orijinn, Ronboogz","Don't Côi","Rapital",3,59,82,"227838"
71,"spotify:track:2qSkIjg1o9h3YT9RAgYN75","Sabrina Carpenter","Espresso","Island Records",13,48,13,"226976"
72,"spotify:track:1UQNU5O9VttUgO16pxUnjw","Obito, Shiki, RPT MCK","Đánh Đổi","12 trái lê",7,61,41,"226210"
73,"spotify:track:0gzpqwLf1jhNjnSJEyweAX","Kuun Đức Nam, Linh Thộn","Tình cờ yêu em","MaiDao Music",12,78,47,"225837"
74,"spotify:track:3YctJXK6kznnWl68TnYobN","RPT MCK","Anh Đã Ổn Hơn","N0L4B3L",3,66,72,"224508"
75,"spotify:track:4NTanSVXBkQ2NmDEbr2vLE","Kai Đinh, GREY D, Hoàng Thùy Linh","Trái đất ôm Mặt trời","Yin Yang Media",8,62,30,"223951"
76,"spotify:track:0pQ67Kp2kED4ISy1ieGPEq","PC, Dick, tofutns","Ghé Qua","12 trái lê",64,81,200,"223430"
77,"spotify:track:3k6q0O9JnO2GhvD6C8fs20","Jimin","Closer Than This","BIGHIT MUSIC",3,42,11,"222851"
78,"spotify:track:6kCU6i8iRrAAmJJ8Sj4JYC","Shartnuss, Tr.D, Phankeo","Nắng có mang em về","MaiDao Music",44,68,23,"220807"
79,"spotify:track:1oVbTGLd8EgyeWBoqAYBD0","Trung Tu","Vừa Hận Vừa Yêu","Universal Music Indochina Distributed Labels",79,-1,1,"214938"
80,"spotify:track:2qWP5ZarXRsdmxzz3L3BtP","SUNI, Hoàng Dũng, GREY D, Orange, tlinh","có hẹn với thanh xuân","Universal Music Indochina Distributed Labels",27,76,103,"212908"
81,"spotify:track:3NvH1v6NOxlawEoCXjg9sK","Kai Đinh, MIN, Hoàng Dũng","điều vô tri nhất","Yin Yang Media",81,99,3,"209675"
82,"spotify:track:6dOtVTDdiauQNBQEDOtlAB","Billie Eilish","BIRDS OF A FEATHER","Darkroom/Interscope Records",75,75,9,"206885"
83,"spotify:track:6jcLKVmEKAQIXIVHJZ8vzS","MONSTAR, GREY D, NICKY, VƯƠNG BÌNH","tình yêu chậm trễ","Yin Yang Media",46,85,84,"204658"
84,"spotify:track:3hqOrxH5qPlvrApcb7Ac8c","Ronboogz","Lan Man","MaiDao Music",33,83,66,"203902"
85,"spotify:track:2a5hng9yXtbjtTVVm9UviC","Vũ Cát Tường","Mơ","Universal Music Indochina Distributed Labels",85,93,99,"203172"
86,"spotify:track:4N99EuIjwSSFFFMDfTeOLU","buitruonglinh, Vũ Phụng Tiên","Em Không Khóc (feat. Vũ Phụng Tiên)","Yin Yang Media",62,89,91,"202886"
87,"spotify:track:1MiJk3dXC5jzhvLFP0dUM7","Da LAB","Thức Giấc","Yin Yang Media",1,88,158,"200725"
88,"spotify:track:0QzuaeCEEOV40Pn7IvKEny","Dhruv","double take","Little Worry/RCA Records",8,90,167,"200515"
89,"spotify:track:1EmMFSLRVkOszCa4ul9z0F","W/N, Duongg, Nau, titie","3107 3","Universal Music Indochina Distributed Labels",1,86,155,"199876"
90,"spotify:track:2JuHIbFudHwDqQssgqsH3i","Vũ Phụng Tiên, DT Tập Rap, Drum7","Lệ Lưu Ly","Big Arts Entertainment",6,73,43,"197408"
91,"spotify:track:47QP509sXnE54NwhzoMHAi","BABYMONSTER","FOREVER","YG Entertainment",54,54,3,"195747"
92,"spotify:track:2kauMp3YNHXULGXyJh4321","Wren Evans, itsnk","Phóng Đổ Tim Em","Universal Music Indochina",9,69,31,"192513"
93,"spotify:track:1aKvZDoLGkNMxoRYgkckZG","ILLIT","Magnetic","BELIFT LAB",5,77,17,"192215"
94,"spotify:track:1izPmgSW7FV6XFdEOiTvOY","Changg, Minh Huy","Em Không Hiểu","Universal Music Indochina Distributed Labels",27,84,159,"191598"
95,"spotify:track:7j3XQm7RR8T2EzaYtYK4rc","W/N, Tezzy, Tien","Crush 2","RioX Records",61,104,108,"191297"
96,"spotify:track:5uyNAX6MazVAjBjVeOsTvp","W/N, Duongg, Nâu","3 1 0 7 (feat. Duongg & Nâu)","HONG AN ENTERTAIMENT,.JSC",11,100,206,"190747"
97,"spotify:track:2o4dDfLK6NVI7TjBm5VoMv","Lou Hoàng, Miu Lê","Yêu Một Người Có Lẽ","Onlyc Entertainment",33,82,134,"189346"
98,"spotify:track:3QD2NfLEIvMRbzv2uTu4B7","Myra Trần","Anh Chưa Thương Em Đến Vậy Đâu","Sony Music Entertainment",6,92,80,"188305"
99,"spotify:track:5nD5PVXUkIpv0WcwfNFrgS","Orange, Hoàng Dũng","Khi Em Lớn","Orange",4,117,160,"187498"
100,"spotify:track:6Hs2xIgB8nzyGFDvVA8lFa","Madihu, Low G","Có Em","NGUYEN CHI PHONG",4,95,117,"187329"
101,"spotify:track:28bxbqNcAuNxYDZYet6eZ7","RPT MCK, tlinh","Chỉ Một Đêm Nữa Thôi","N0L4B3L",9,87,72,"186522"
102,"spotify:track:65cM1nyMf9pFDZVV8xmPX9","GREY D","dự báo thời tiết hôm nay mưa","M Music Records",7,94,87,"185354"
103,"spotify:track:3RkSwrsIadAvqVtMp5yhaB","ENHYPEN","XO (Only If You Say Yes)","BELIFT LAB",103,-1,1,"185293"
104,"spotify:track:01qFKNWq73UfEslI0GvumE","Jung Kook, Jack Harlow","3D (feat. Jack Harlow)","BIGHIT MUSIC",2,70,42,"179639"
105,"spotify:track:1GJ3suxtUVaguVQRemw6Zp","Andiez","Suýt Nữa Thì...","MaiDao Music",82,91,106,"178875"
106,"spotify:track:43zzuEWDotRcKlSFzrlJqs","Đạt G","Thêm Bao Nhiêu Lâu","12 trái lê",106,126,8,"176243"
107,"spotify:track:25edeHHueINMguqu9emCyV","Đen, Phương Anh Đào","Lối Nhỏ","Đen",1,118,247,"176024"
108,"spotify:track:7LVrrX8pkzI9fMF88nGabt","Đen, JustaTee","Đi Về Nhà","Đen",3,111,187,"175444"
109,"spotify:track:3AejRjgBsFV4HWHjJmmEP7","GREY D, Orange, Kai Đinh","lời tạm biệt chưa nói","Universal Music Indochina Distributed Labels",22,113,104,"175128"
110,"spotify:track:3ET3xHCLMGd57u06A9RjJ0","Ronboogz","Nói Dối","MaiDao Music",79,102,37,"174385"
111,"spotify:track:3uT8QfoX0BE8ZJa4h98LDW","Puppy, Dangrangto","Wrong Times","MaiDao Music",73,96,37,"173940"
112,"spotify:track:2n00rcPaXcWfFB9irOKOmh","Ronboogz","Anh Chỉ Muốn","MaiDao Music",77,103,27,"171831"
113,"spotify:track:45PPoUgqs3JrhkZGEzSUHT","W/N, ERIK, Nau","3107 4 (feat. Erik, Nâu)","Universal Music Indochina Distributed Labels",24,98,66,"169698"
114,"spotify:track:4h3K653rm69JYWpO4du2BJ","Andiez","Chờ Đợi Có Đáng Sợ","Yin Yang Media",76,119,109,"168841"
115,"spotify:track:3b34161QoxLwsqhWSPy9i5","Da LAB","Thanh Xuân","Sony Music Entertainment",1,125,308,"168789"
116,"spotify:track:1dUmmBh2nw8XzEI3au0uFs","Thịnh Suy","Chết Trong Em","InQ International",4,101,90,"166315"
117,"spotify:track:0eM8iGaE97UCf9yYbDiMA4","ANH TRAI ""SAY HI"", Lou Hoàng, Pháp Kiều, WEAN, Quân A.P, Hải Đăng Doo, Ali Hoàng Dương, NICKY","HÚT (feat. Lou Hoàng, Pháp Kiều, WEAN, Quân A.P, Hải Đăng Doo, Ali Hoàng Dương & Nicky)","Anh Trai Say Hi",117,175,2,"163578"
118,"spotify:track:0hiQvlWSSTr7n1kc1X2Lus","HIEUTHUHAI, Harmonie","Bật Nhạc Lên","GERDNANG",59,145,193,"162944"
119,"spotify:track:78lw4wahFNotXb0mOEtPkM","WEAN","BADBYE","WEAN",50,128,21,"161374"
120,"spotify:track:68EMU2RD1ECNeOeJ5qAXCV","Charlie Puth, Selena Gomez","We Don't Talk Anymore (feat. Selena Gomez)","Artist Partner",71,121,207,"161253"
121,"spotify:track:6DyotcCWPqKQT8YWireU6L","Low G","Tán Gái 505","Rap Nhà Làm",65,115,61,"160733"
122,"spotify:track:2PYDUM2IC01FOTDLQdFxJP","W/N, Duongg, Nau","3 1 0 7 - 2 (feat. DuongG & Nau)","GUM GROUP",27,132,177,"160544"
123,"spotify:track:3AalulHQZvk8d2nDgd61bh","Kay Trần, Cường Seven, Kiên Ứng, SOOBIN","Nước Hoa","Universal Music Indochina Distributed Labels",112,112,2,"160505"
124,"spotify:track:54UNNgtE3zzERwTuWSQLqd","MONSTAR, GREY D, VƯƠNG BÌNH","có hẹn với thanh xuân","Yin Yang Media",5,124,157,"160345"
125,"spotify:track:2DzFmWhrnRHROJuxW5e1t2","KayC, tlinh","Bao Nhiêu Loài Hoa Remix (feat. tlinh, Machiot)","MaiDao Music",125,166,2,"160196"
126,"spotify:track:6iXGivPFpsqKmrINhIbPvx","Lynk Lee","Buồn Thì Cứ Khóc Đi","Lynk Lee",10,114,238,"159555"
127,"spotify:track:4AgFXIVT7hVhBZ5DEOaLu3","Thịnh Suy","tiny love","Yin Yang Media",3,116,137,"159436"
128,"spotify:track:0X28PqBpbQhWdi4usYw0w5","Wren Evans, itsnk","Tò Te Tí","Universal Music Indochina",3,105,31,"159333"
129,"spotify:track:0wwfocY1CfXcKfMcWSoGXc","buitruonglinh","Yêu Người Có Ước Mơ","LOOPS Music",83,109,66,"158748"
130,"spotify:track:0TcbY7JJzalPExhhqpgAQM","ANH TRAI ""SAY HI"", Isaac, Quang Hùng MasterD, Negav, Gin Tuấn Kiệt, Vũ Thịnh, NANON","DON'T CARE (feat. Isaac, Quang Hùng MasterD, Negav, Gin Tuấn Kiệt, Vũ Thịnh & Nanon)","Anh Trai Say Hi",130,197,2,"158581"
131,"spotify:track:6IHLOkgZftkcqS3fM0jMCT","MONO, Onionn.","Em Xinh","M Music Records",10,108,29,"156006"
132,"spotify:track:5Bti0azlFhMattVY76qFr9","Vũ.","Lạ Lùng","WM Vietnam",17,130,328,"154796"
133,"spotify:track:2vYaldhZyuRk6me6yowg8e","Sơn Tùng M-TP","Buông Đôi Tay Nhau Ra","Universal Music Indochina Distributed Labels",73,110,55,"154735"
134,"spotify:track:4qJSUFwZFouto5VZUlln75","tlinh, Trung Trần","Thích Quá Rùi Nà","Universal Music Indochina Distributed Labels",34,123,200,"154547"
135,"spotify:track:5J90ah0ppUSev1uahqQiN6","Andiez, AMEE","Anh Đánh Rơi Người Yêu Này","MaiDao Music",19,122,89,"152170"
136,"spotify:track:18iADruKMXIloyA9vCJXFE","An Vũ, Sino","Chàng Trai Bất Tử","Yin Yang Media",56,129,24,"151020"
137,"spotify:track:29VSQCxul5FNmpi4gVR7Qn","ANH TRAI ""SAY HI"", Đức Phúc, ERIK, Phạm Anh Duy, Tage","THI SĨ (feat. Đức Phúc, ERIK, Phạm Anh Duy & Tage)","Anh Trai Say Hi",137,-1,1,"149494"
138,"spotify:track:5cml547MByVlaVrKU2lJTg","Andree Right Hand, Wxrdie, Bình Gold, 2pillz","Em iu","$maker Music",18,134,60,"148126"
139,"spotify:track:4jWxeq0IpdNhEaBzkNNwTf","Kevindauroi","Đừng Xa Anh Nhé (feat. Harvey)","MaiDao Music",137,137,2,"147218"
140,"spotify:track:7MXVkk9YMctZqd1Srtv4MB","The Weeknd, Daft Punk","Starboy","Universal Republic Records",140,184,12,"147063"
141,"spotify:track:6aaNsCMWPBaUuJE1grH6Po","Sơn Tùng M-TP","Có Chắc Yêu Là Đây","Universal Music Indochina Distributed Labels",1,106,161,"146137"
142,"spotify:track:0f4VzzQxojITMkyHY6LCci","ANH TRAI ""SAY HI"", Anh Tú, JSOL, ERIK, Dương Domic, Phạm Anh Duy","SÓNG VỖ VỠ BỜ (feat. Anh Tú, JSOL, ERIK, Dương Domic & Phạm Anh Duy)","Anh Trai Say Hi",132,-1,2,"144741"
143,"spotify:track:7sZgr8RsXkDwkmiQok691a","Thịnh Suy","Mai Mình Xa","InQ International",85,127,14,"143978"
144,"spotify:track:0dBKcPEAsdxWJsqNDNHcPz","Andree Right Hand, RHYDER, WOKEUP","Dân Chơi Sao Phải Khóc","$maker Music",16,146,28,"143528"
145,"spotify:track:6uxuJ8Fr1AAfSPJUF9N1yr","Vũ.","Bước Qua Mùa Cô Đơn","WM Vietnam",1,150,188,"143328"
146,"spotify:track:1BxfuPKGuaTgP7aM0Bbdwr","Taylor Swift","Cruel Summer","Taylor Swift",5,140,64,"142862"
147,"spotify:track:4S0uLMXRoAjFfIJOW7A8aW","Rhymastic","Nến Và Hoa","WM Vietnam",2,158,214,"142751"
148,"spotify:track:2zRzmGerfTxc2epZHgaTdh","Ngọt, Đen","Cho Tôi Lang Thang","Ngọt",35,161,216,"142153"
149,"spotify:track:3y6kYOBeVg8jtUiBdTR0pD","Tùng TeA, PC, TaynguyenSound","Già Cùng Nhau Là Được","12 trái lê",70,149,118,"142108"
150,"spotify:track:7kpNUrBDYDoX6QKGzrBD1R","RPT MCK, Trung Trần","Thôi Em Đừng Đi","N0L4B3L",8,120,72,"141918"
151,"spotify:track:1R1AFI3iNOYr0pGHwjFQBG","B Ray","Cao Ốc 20","Great Entertainment",128,139,14,"140876"
152,"spotify:track:4XkEva4YsNmPQBLe8V126L","HIEUTHUHAI, Phương Ly","Xoay Một Vòng","M Music Records",152,162,3,"140578"
153,"spotify:track:7iabz12vAuVQYyekFIWJxD","Central Cee, Lil Baby","BAND4BAND (feat. Lil Baby)","Columbia",135,135,4,"140541"
154,"spotify:track:7paCdW3grnoEi95tjO1OkG","Thịnh Suy","Thắc Mắc?","InQ International",110,155,32,"140119"
155,"spotify:track:1K3CXUYKhLYN7koLW5WQjX","Thắng","Xin Lỗi","Thắng",5,107,61,"140026"
156,"spotify:track:2ddbldKhKrYvOBbYa87cbj","Vũ., Hà Anh Tuấn","Dành Hết Xuân Thì Để Chờ Nhau","WM Vietnam",13,136,18,"139789"
157,"spotify:track:5tdz7T4hTxA1ipJMBe24uX","AMEE","ex's hate me, Pt.2","Yin Yang Media",13,169,91,"138797"
158,"spotify:track:1m4BSQjgXAfoR4dBAapAr7","Masew, B Ray, REDT, Ý Tiên","Lửng Lơ","SKY Music JSC",113,181,84,"138705"
159,"spotify:track:3vkCueOmm7xQDoJ17W1Pm3","Mitski","My Love Mine All Mine","Dead Oceans",30,153,41,"137353"
160,"spotify:track:53zusvCJkyGYjEZ6bnLIjh","Hà Anh Tuấn","Tháng Tư Là Lời Nói Dối Của Em","Yin Yang Media",49,154,33,"137047"
161,"spotify:track:5qbjUmVV1yOOjcMOInNPYD","Kai Đinh, MIN, GREY D","để tôi ôm em bằng giai điệu này","Yin Yang Media",18,157,82,"135219"
162,"spotify:track:7td8DTWoGC9u9db37mGHX6","Đen, PiaLinh","Nấu ăn cho em","Đen",8,-1,52,"134345"
163,"spotify:track:51ZQ1vr10ffzbwIjDCwqm4","Ariana Grande","we can't be friends (wait for your love)","Republic Records",17,144,19,"134139"
164,"spotify:track:71Q8QWLpvwvfQ6zM5BdCnm","2T, Văn","Liệu Giờ","LOOPS Music",22,173,202,"134071"
165,"spotify:track:1Qrg8KqiBpW07V7PNxwwwL","SZA","Kill Bill","Top Dawg Entertainment/RCA Records",6,152,76,"133429"
166,"spotify:track:2o1pb13quMReXZqE7jWsgq","Ariana Grande","intro (end of the world)","Republic Records",13,138,19,"133370"
167,"spotify:track:5cn5oHiXJTLiuthgbgfkMh","Vũ Cát Tường","Vết Mưa","Universal Music Indochina Distributed Labels",57,187,36,"133325"
168,"spotify:track:7h2zqUH4bYyknNUxsYnS5V","PhucXp, Freak D","Như Anh Đã Thấy Em","MaiDao Music",33,151,82,"132966"
169,"spotify:track:2Asy51yFMEG8Qjh15kvQeD","Obito, Shiki","Tell the kids i love them","12 trái lê",30,131,40,"132405"
170,"spotify:track:4Iz5EWPCAT8jYNk4IpLoll","buitruonglinh","Dù Cho Mai Về Sau","Yin Yang Media",10,191,174,"132280"
171,"spotify:track:6s9xQXSKc8tYMe1ZH5aiYs","ANH TRAI ""SAY HI"", Quân A.P, HURRYKNG, Hùng Huỳnh","ĐẦU ĐỘI SỪNG (feat. Quân A.P, HURRYKNG & Hùng Huỳnh)","Anh Trai Say Hi",171,-1,1,"130915"
172,"spotify:track:3J3nv18iIrOhca1ZWNeuyW","JustaTee","Đã Lỡ Yêu Em Nhiều","NGUYEN THANH TUAN",36,176,84,"130447"
173,"spotify:track:5BJqg07SKgmFnVLOBmLFvq","Bùi Anh Tuấn","Hẹn Một Mai - From"" 4 Năm 2 Chàng 1 Tình Yêu""","Vietnam Music Award",109,177,13,"130381"
174,"spotify:track:1kmKeANKIVzsfKtMZ4Ei6Z","MYLINA, fueled by boba","Giấc Mơ Của Em - Suy Version","LOOPS Music",174,-1,1,"130375"
175,"spotify:track:2nR51wakN5K3AJENqGaNg9","Đen, MIN","Bài Này Chill Phết","Đen",1,167,268,"130249"
176,"spotify:track:45Mswno1F7FoZkcmQkp7fi","Wren Evans","Thích Em Hơi Nhiều","Universal Music Indochina",1,141,161,"129152"
177,"spotify:track:5AmFbL7MClvRYfzae0EUHn","ANH TRAI ""SAY HI"", HIEUTHUHAI, Đức Phúc, Công Dương","NỖI ĐAU NGÂY DẠI (feat. HIEUTHUHAI, Đức Phúc & Công Dương)","Anh Trai Say Hi",177,-1,1,"129120"
178,"spotify:track:0Qs29ApstkrU5T8S5Hxazw","BigDaddy, Emily","Ngõ Chạm","LOOPS Music",41,156,50,"128503"
179,"spotify:track:5N3hjp1WNayUPZrA8kJmJP","Sabrina Carpenter","Please Please Please","Island Records",83,147,6,"127990"
180,"spotify:track:2WOpp4vm16unl0N3i3BNNv","Ngơ, NÂN","Tình Đắng Như Ly Cà Phê","12 trái lê",15,186,234,"127661"
181,"spotify:track:3440g8awr2l0E5Yy2X5Epk","RPT MCK","Tại Vì Sao","N0L4B3L",3,171,95,"127098"
182,"spotify:track:7AD5F85waSb3yZxZxEXhJM","Tóc Tiên, Touliver","Có Ai Thương Em Như Anh","Yin Yang Media",20,165,111,"126756"
183,"spotify:track:3z7at2LZwJsg8UvqGw3JAv","MIN, Mr A","Có Em Chờ","MIN",183,-1,7,"126637"
184,"spotify:track:3XEspwit4d8gwKKgeopfCv","Sean, Lửa","Em Thích","MaiDao Music",65,143,77,"125345"
185,"spotify:track:6sIWcLjuMvOcxAfMOx1kbB","Coldzy, Minsicko, tlinh","FEVER","The First Management",76,185,6,"125244"
186,"spotify:track:11hcyWq7qSwBE3bvv5Ialn","buitruonglinh","Dù Cho Mai Về Sau - Acoustic Version","Yin Yang Media",59,160,139,"124547"
187,"spotify:track:5AJ9hqTS2wcFQCELCFRO7A","Tommy Richman","MILLION DOLLAR BABY","PULSE Records",84,170,10,"124512"
188,"spotify:track:4sgMbwl9lXGyHcHmtFYGMm","aespa","Supernova","SM Entertainment",15,142,10,"123698"
189,"spotify:track:1sEOTXdVl8X7SzuJi0P1cq","Dept, Ashley Alisha","Van Gogh (feat. Ashley Alisha)","WM Korea",41,174,27,"122104"
190,"spotify:track:3nAwC1qVqRQYiRCrp6q1dU","Winno","Say Đắm Trong Lần Đầu","MaiDao Music",142,189,46,"121823"
191,"spotify:track:56n21o9wtl9IjFVsGe7BG1","Bùi Anh Tuấn","Thuận Theo Ý Trời","Sky Music Jsc",62,-1,89,"121753"
192,"spotify:track:1fgzQI6AtswiR0JMXulldH","Nguyễn Minh Xuân Ái","Là Từ Lúc (Since)","MaiDao Music",97,183,16,"121737"
193,"spotify:track:4LAdZsiks8vsw3e1iZQgVY","HIEUTHUHAI, B Ray, Tage","Không Phải Gu","M Music Records",51,-1,22,"121465"
194,"spotify:track:7fNHfgOxPLcg4mQLhCnOHB","Rapital, Groovie Lã Thắng, tlinh, RPT MCK","XTC (Xích Thêm Chút) (Remix)","M Music Records",87,198,159,"121336"
195,"spotify:track:2OzhQlSqBEmt7hmkYxfT6m","Taylor Swift, Post Malone","Fortnight (feat. Post Malone)","Taylor Swift",2,172,13,"120469"
196,"spotify:track:014DA3BdnmD3kI5pBogH7c","Chillies, SUNI, Rhymastic","Cứ Chill Thôi","WM Vietnam",5,192,184,"120403"
197,"spotify:track:7oBUoEbCDF748UkHnLusUB","Thịnh Suy","Chuyện Rằng","Yin Yang Media",5,188,206,"120250"
198,"spotify:track:39KWnPNEvbXt423CzjvBfA","SOOBIN","Anh Đã Quen Với Cô Đơn","WM Vietnam",180,180,7,"119750"
199,"spotify:track:72ictTz6o0dusD2QpCn4bn","Wxrdie, Andree Right Hand, Machiot","TETVOVEN","M Music Records",39,199,33,"119640"
200,"spotify:track:3BwFxsC7QpRejdE9GXFQI4","D Blue, Killic","Chỉ Còn Ta Và Ta Giữa Trời","12 trái lê",173,178,11,"119563"
