rank,uri,artist_names,track_name,source,peak_rank,previous_rank,weeks_on_chart,streams
196,"spotify:track:43zdsphuZLzwA9k4DJhU0I","Billie Eilish","when the party's over","Darkroom/Interscope Records",11,181,144,"48855"
197,"spotify:track:1L0OmJV0LnPDWuHCIGmBV6","Drake, Central Cee","On The Radar Freestyle","OVO Sound",66,169,6,"48820"
198,"spotify:track:26rx4ek7zk05Q9wEUbN1NF","Myztro, Xduppy, ShaunMusiq & Ftears","Myztro Ah Ah (feat. Xduppy & ShaunMusiq & Ftears)","New Money Gang Records",13,171,17,"48513"
199,"spotify:track:1PDP7mLiAMwhfmgIwzhOm2","Drake, Yebba","Yebba’s Heartbreak","OVO",13,190,60,"48308"
200,"spotify:track:1zHdh2Muk7jyPYXc8h1zPs","Big Zulu, Mduduzi Ncube, Siya Ntuli, Lwah Ndlunkulu, Xowla","Voicemail","Nkabi Records",11,-1,49,"48187"
