rank,uri,artist_names,track_name,source,peak_rank,previous_rank,weeks_on_chart,streams
1,"spotify:track:5C9h6ZyskUiyAVDmhSfSdP","Mellow & Sleazy, SjavasDaDeejay, TitoM, Tman Xpress","Imnandi lento (feat. Tman Xpress)","Sound African Recordings",1,5,3,"539079"
2,"spotify:track:4J1H4EuucGhhYfcPpYCBRr","DJ Stokie, Zee_nhle, Omit ST, Sobzeen","Awukhuzeki","Universal Music (Pty) Ltd.",1,1,12,"479054"
3,"spotify:track:5tpft20jhQvRlG3O7XfwWy","Tyler ICU, Tumelo_za, DJ Maphorisa, Nandipha808, Ceeka RSA, Tyrone Dee","Mnike (feat. DJ Maphorisa, Nandipha808, Ceeka RSA & Tyron Dee)","New Money Gang Records",1,2,19,"404159"
4,"spotify:track:1NQCinyxiglxekxXVPEhnC","Uncle Waffles, Ice Beats Slide, Sbuda Maleather","Peacock Revisit (feat. Ice Beats Slide & Sbuda Maleather)","Encore Recordings",3,3,4,"349179"
5,"spotify:track:0XSYoJ0MJpMB2tddyRcBEC","De Mthuda, Da Muziqal Chef, Eemoh","Sgudi Snyc","Universal Music (Pty) Ltd.",2,4,16,"344740"
6,"spotify:track:1CrwpdodnkXcjPSrg8kw9g","Mas Musiq, Daliwonga, DJ Maphorisa, Kabza De Small","Gangnam Style (feat. DJ Maphorisa & Kabza De Small)","New Money Gang Records",2,6,22,"263873"
7,"spotify:track:5Yx3xbh3ob1TzcSkTZRYjT","Tebza De DJ, DJ Nomza The King","Ka Valungu","Music Band Production / EMPIRE",5,7,7,"241683"
8,"spotify:track:5O677N09WkpiDFluKb1fXh","Jimmy Maradona, QuayR Musiq, Mellow & Sleazy, Ch'cco, LeeMcKrazy","Wena Wa Pallwa (feat. Ch'cco & LeeMcKrazy)","Sound African Recordings",8,14,8,"231071"
9,"spotify:track:5SjrCoaMIUauMrOZG2CUnq","Sam Deep, Eemoh, Da Muziqal Chef","iMpumelelo","Universal Music (Pty) Ltd.",8,10,26,"226570"
10,"spotify:track:7ko9EAsZ2N1ZpEBlMUkR3J","Kabza De Small, DJ Maphorisa, Njelic, Young Stunna, Nkosazana Daughter, Xolani Guitar","Nana Thula (feat. Njelic, Young Stunna, Nkosazana Daughter & Xolani Guitar)","Piano Hub",6,11,16,"218043"
11,"spotify:track:0JtoyusgiISK10cXzX79uH","Sizwe Nineteen, R-Bee, De’vine 07, Drumonade, Tumi Sdomane","Habibi (Quantum Sound)","Sizwe Nineteen",11,15,4,"215066"
12,"spotify:track:2FDTHlrBguDzQkp7PVj16Q","Dave, Central Cee","Sprinter","Neighbourhood / Live Yours",4,8,14,"207935"
13,"spotify:track:2IGMVunIBsBLtEQyoI1Mu7","Doja Cat","Paint The Town Red","Kemosabe Records/RCA Records",12,12,5,"207144"
14,"spotify:track:4rXLjWdF2ZZpXCVTfWcshS","Gunna","fukumean","300 Entertainment",5,9,12,"203766"
15,"spotify:track:34tsYM5Z3g9dvrwLjQKDtr","Sam Deep, Njelic, Aymos","Isgubhu","Universal Music (Pty) Ltd.",15,-1,1,"195397"
16,"spotify:track:4k5FlWz3dfhyQzmRpVPZsW","Lady Amar, JL SA, Cici, Murumba Pitch","Hamba Juba","Lea Records",1,13,29,"184961"
17,"spotify:track:3RmhsiQszFnnixoOrLznAN","Fezeka Dlamini, Nomfundo Moh, Naledi","Uyangijabulisa","Sginci Media",12,16,3,"166521"
18,"spotify:track:3HCs7v1ac2ReqcUlTs7YVm","Mellow & Sleazy, Tman Xpress, Keynote","Kwelinye (feat. Keynote)","Sound African Recordings",12,19,27,"164570"
19,"spotify:track:7JbLSEDlRdoJaXk5ddZae2","Mthandeni SK, Lwah Ndlunkulu","Paris","Mthandeni Music Production",18,18,4,"155438"
20,"spotify:track:1y5eHXBYiLgNv00KoHXm4o","Soa Mattrix, Mashudu, Happy Jazzman, Emotionz DJ","Mina Nawe","Soa Music Group",1,21,47,"153535"
21,"spotify:track:57T2jbt9nqR6VCeOH72wuG","ShaunMusiq & Ftears, Daliwonga, Myztro, Xduppy","Howa You (feat. Myztro & Xduppy)","Kgaday",15,17,4,"153417"
22,"spotify:track:1AVIL2s4vkE92Qupej37JR","Dj Jaivane, LeeMcKrazy, Skandisoul","uLala Kanjani (feat. LeeMcKrazy & Skandisoul)","Ziiki Media",22,59,7,"153393"
23,"spotify:track:0AtUfScqL8UjpRGI2Mt4BI","Deejaykgosi, Baby Momo, Lington, Phemelo Saxer, Zee_nhle, iam.psalm","Ngizwile (feat. Lington, Zee_nhle, iam.psalm, Phemelo Saxer)","Wanitwa Mos Entertainment",23,25,7,"147906"
24,"spotify:track:4iZ4pt7kvcaH6Yo8UoZ4s2","SZA","Snooze","Top Dawg Entertainment/RCA Records",12,23,39,"141590"
25,"spotify:track:3js04Z5R4L1ZvtLPopSG8l","Myztro, Daliwonga, Xduppy, ShaunMusiq & Ftears","Kunkra (feat. Xduppy & ShaunMusiq & Ftears)","New Money Gang Records",4,24,12,"139029"
26,"spotify:track:5Jf3hmkf8WKKqxM4vM8rux","Lwah Ndlunkulu","Eyami","Nkabi Records",20,22,5,"137186"
27,"spotify:track:6T7FXSuXykeGktMLGp8WgE","Lil Durk, J. Cole","All My Life (feat. J. Cole)","Alamo",2,20,17,"132701"
28,"spotify:track:0z2QglVOqge7D0Mo7Pqvow","Musical Jazz, Soul Revolver, Kgocee, Tumelo_za","Gojasi","Musical Jazz Entertainment",27,27,6,"131956"
29,"spotify:track:4hDjmMljGvNZuYUXw1HWw3","Murumba Pitch, Omit ST, Dinky Kunene, Soa Mattrix, Buhle Sax","Wena Dali","Murumba Pitch",19,30,25,"129829"
30,"spotify:track:741UUVE2kuITl0c6zuqqbO","Nicki Minaj, Ice Spice, Aqua","Barbie World (with Aqua) [From Barbie The Album]","Atlantic Records",9,35,11,"129591"
31,"spotify:track:710zL5SAbc6dbHEsLiBwME","Spirit Of Praise, Ayanda Ntanzi","Moy’ Oyingcwele (Live)","Spirit Music",29,29,2,"128358"
32,"spotify:track:67nepsnrcZkowTxMWigSbb","Travis Scott, Drake","MELTDOWN (feat. Drake)","Cactus Jack/Epic",4,26,6,"122074"
33,"spotify:track:1nWA9Vtg9EW4i4Lr2YVsJJ","Busta 929, Pcee","Uyavala","Umsebenzi Wethu Records",15,36,11,"121097"
34,"spotify:track:4FEi7i9oDxDzcYbx53IHwq","Kelvin Momo, Babalwa M, Sfarzo Rtee","Sukakude (feat. Sfarzo Rtee)","Kelvin Momo Productions",7,34,39,"120108"
35,"spotify:track:6s1k8Ry40znPtEb9ijOlnw","Kaylow","24 Hours","Kaylow Publishing",2,32,14,"119883"
36,"spotify:track:1SB1UdyYs3DMyzHVxZg0QE","ShaunMusiq & Ftears, Xduppy, Myztro, Mellow & Sleazy, QuayR Musiq, Matute Boy","Bhebha (feat. Myztro, Mellow & Sleazy, QuayR Musiq & Matuteboy)","Sound African Recordings",3,40,26,"119441"
37,"spotify:track:6wf7Yu7cxBSPrRlWeSeK0Q","Billie Eilish","What Was I Made For? [From The Motion Picture ""Barbie""]","Darkroom/Interscope Records",17,28,8,"118830"
38,"spotify:track:1bmZLmDu9jkzwHInzPsYLD","Inkabi Zezwe, Sjava, Big Zulu","Umbayimbayi","Warner Music Africa",1,33,24,"115603"
39,"spotify:track:58u8z6ia8GTm9yZlkmtCtV","Aymos, Ami Faku","Fatela","Lyf Styl Entertainment",3,38,42,"113662"
40,"spotify:track:3PdO57q0KLWkfWXsXQJlV6","Mas Musiq, Aymos, Young Stunna","Sengizwile (feat. Aymos & Young Stunna)","New Money Gang Records",3,49,70,"112757"
41,"spotify:track:0JXXNGljqupsJaZsgSbMZV","Miguel","Sure Thing","Jive",13,39,140,"111869"
42,"spotify:track:4VrYIDyFUN4IYU3wtjbF8p","DJ Maphorisa, Visca, Da Muziqal Chef, MaWhoo, Kabza De Small","Shona Kwelanga (feat. Mawhoo, Da Muziqal Chef & Kabza De Small)","New Money Gang Records",19,43,43,"111735"
43,"spotify:track:183zjMwtPbSQjsE71Yrfoo","Focalistic, Eeque, Thama Tee","Khekheleza (Dlala Dlala) [feat. Thama Tee & Eeque]","18 Area Holdings",17,46,12,"105903"
44,"spotify:track:37ISMEYWqhRHcPEitHn8Er","uLazi, Infinity MusiQ","yey","Mguzuguzu Records",15,55,23,"104307"
45,"spotify:track:3pImmSzeKex5ffzsDoaL3z","Bassie, Aymos, T-Man SA","Izenzo","Djs Production Pty Ltd",45,104,2,"103278"
46,"spotify:track:79DPYZ6x8FfzgSgPoPhpC3","Nicki Minaj","Last Time I Saw You","Republic Records",46,-1,1,"102982"
47,"spotify:track:35P4NcObu5fVLjKa0OBX5r","Harrycane, Master KG, DJ Latimmy","Dubula","Wanitwa Mos Entertainment",41,41,5,"102937"
48,"spotify:track:33PDDaCzc8AM8J5EKjO7v2","Young Stunna, Kabza De Small, Deeper Phil, Mfundo Da DJ","uNonkosi (feat. Deeper Phil & Mfundo Da DJ)","Piano Hub",13,31,3,"101150"
49,"spotify:track:66PVdnWWemyJbvScVS6vJ0","Ciara, Chris Brown","How We Roll","Beauty Marks Entertainment",37,50,5,"100346"
50,"spotify:track:1s7oOCT8vauUh01PbJD6ps","Rema, Selena Gomez","Calm Down (with Selena Gomez)","Mavin Records / Jonzing World",7,45,54,"100135"
51,"spotify:track:26b3oVLrRUaaybJulow9kz","Libianca","People","5K Records Limited",5,42,38,"99962"
52,"spotify:track:6wsqVwoiVH2kde4k4KKAFU","Travis Scott","I KNOW ?","Cactus Jack/Epic",11,62,6,"99517"
53,"spotify:track:59nOXPmaKlBfGMDeOVGrIK","Future, Drake, Tems","WAIT FOR U (feat. Drake & Tems)","Epic/Freebandz",1,56,71,"99464"
54,"spotify:track:3Pv1NcASIE987vF8t1VWVu","Lwah Ndlunkulu","Ngiyeza","Nkabi Records",8,51,33,"99245"
55,"spotify:track:1xs8bOvm3IzEYmcLJVOc34","Ayra Starr","Rush","Mavin Records",7,44,49,"98534"
56,"spotify:track:74csF4EizLF5y0yT2qoSHH","Wanitwa Mos, Master KG, Seemah, Lowsheen","Thando (feat. Lowsheen)","Wanitwa Mos Entertainment",34,37,13,"98186"
57,"spotify:track:4HrTGHLIffBYPFan9QaAjg","Pabi Cooper, Yumbs, MaWhoo, Nkosazana Daughter","Dali Wam (feat. Nkosazana Daughter)","Cooper Entertainment",18,47,16,"96790"
58,"spotify:track:68Dni7IE4VyPkTOH9mRWHr","J. Cole","No Role Modelz","Roc Nation Records LLC",39,60,151,"96402"
59,"spotify:track:4iuNZTcvT9diFySSzVsnVS","Fantasia","When I See U","J Records",39,48,174,"96217"
60,"spotify:track:7wcjeveluiW5djtxLCxNSx","Spirit Of Praise, Mpumi Mtsweni","Thath'Indawo (Live)","Spirit Music",23,53,28,"95420"
61,"spotify:track:05A1KzxTLvShctiD0Bsydd","Inkabi Zezwe, Sjava, Big Zulu","Sayona","Warner Music Africa",51,74,16,"94588"
62,"spotify:track:42VsgItocQwOQC3XWZ8JNA","Travis Scott, Playboi Carti","FE!N (feat. Playboi Carti)","Cactus Jack/Epic",5,54,6,"94473"
63,"spotify:track:5JYPXqMwYc0zTODQdjMEZN","Ice Spice","Deli","10K Projects/Capitol Records",42,52,7,"91939"
64,"spotify:track:3zSm2FYUjpc9egsTA0bJ16","Die Piesangskille","Inge 2","Universal Music (Pty) Ltd.",64,81,3,"91540"
65,"spotify:track:30KX5p3u1xN8TF83eGY0bQ","Sykes, Skillz, Rudeboyz","Sisekakeni Babies (feat. Skillz & RudeBoyz)","Emazulwini Productions",28,61,10,"90077"
66,"spotify:track:0AY3sNqV7qAdAZ8j6TRVBd","2Point1, Ntate Stunna, Nthabi Sings","Stimela","Penya Play Productions",1,58,37,"87358"
67,"spotify:track:4EI8VuxUuIHKfafU72emqz","Mariah Carey","We Belong Together","Def Jam Recordings",53,63,79,"86504"
68,"spotify:track:2PBkxni7Zk4wpaZ8FSHHlF","Lloyiso","You're So You","Universal Music (Pty) Ltd.",68,-1,1,"86053"
69,"spotify:track:1odExI7RdWc4BT515LTAwj","David Kushner","Daylight","Miserable Music Group, LLC",18,67,21,"85481"
70,"spotify:track:0Yx0dpXq9K6vIkRWxPvKWI","Dr Dope, Pro Tee, Qveen-rsa, Mzwilili, Kitso Nave","Hamba Wena","3174598 Records DK",40,64,10,"84577"
71,"spotify:track:6WzRpISELf3YglGAh7TXcG","The Weeknd, Playboi Carti, Madonna","Popular (with Playboi Carti & Madonna) - From The Idol Vol. 1 (Music from the HBO Original Series)","XO / Republic Records",36,68,14,"84425"
72,"spotify:track:0u2P5u6lvoDfwTYjAADbn4","Billie Eilish, Khalid","lovely (with Khalid)","Darkroom",22,78,280,"83828"
73,"spotify:track:4pxH1dqKimocSU5kaA4GYp","De Mthuda, Da Muziqal Chef, Kwiish SA, Eemoh","iThuba","Universal Music (Pty) Ltd.",66,84,10,"83709"
74,"spotify:track:5YbPxJwPfrj7uswNwoF1pJ","Burna Boy","Last Last","Spaceship/ Bad Habit/Atlantic Records",1,65,69,"83414"
75,"spotify:track:7x9aauaA9cu6tyfpHnqDLo","Jung Kook, Latto","Seven (feat. Latto)","BIGHIT MUSIC",11,73,8,"83238"
76,"spotify:track:3xKsf9qdS1CyvXSMEid6g8","Frank Ocean","Pink + White","Boys Don't Cry",68,69,42,"83196"
77,"spotify:track:3N2AjgvL6Idel1GtE2srYb","Oscar Mbo, KG Smallz, Thakzin, Dearson, Mhaw Keys, MÖRDA","Yes God (feat. Dearson, Mörda & Mhaw keys)","The Ashmed Hour Records",77,123,5,"83136"
78,"spotify:track:5mjYQaktjmjcMKcUIcqz4s","Kenya Grace","Strangers","Warner Records/Major Recordings",78,-1,1,"82999"
79,"spotify:track:5IgjP7X4th6nMNDh4akUHb","Chris Brown","Under The Influence","Chris Brown Entertainment/RCA Records",2,71,77,"82940"
80,"spotify:track:3pXF1nA74528Edde4of9CC","Bryson Tiller","Don't","TrapSoul/RCA Records",55,70,88,"81858"
81,"spotify:track:1eb2pZlRqGLndvOj8MHaTD","Khanyisa, Tyler ICU, Ceeka RSA, Nandipha808","SUKA (feat. Nandipha808, Ceeka RSA)","Superstar Studios",10,72,13,"80615"
82,"spotify:track:5aIVCx5tnk0ntmdiinnYvw","Tyla","Water","FAX Records/Epic",82,-1,1,"80385"
83,"spotify:track:4DHcnVTT87F0zZhRPYmZ3B","Miley Cyrus","Flowers","Columbia",1,76,34,"80229"
84,"spotify:track:1BxfuPKGuaTgP7aM0Bbdwr","Taylor Swift","Cruel Summer","Taylor Swift",26,80,13,"79292"
85,"spotify:track:1CViD4tJqNMF4jjgP5Ug62","Jamie Fine","If Anything's Left","Universal Music Canada",73,146,24,"78731"
86,"spotify:track:7GaFYUqP2WdR4KTPk7cXoP","Mario","Let Me Love You","J Records",64,77,248,"78484"
87,"spotify:track:3F5CgOj3wFlRv51JsHbxhe","Drake, 21 Savage","Jimmy Cooks (feat. 21 Savage)","OVO",1,82,64,"77083"
88,"spotify:track:4JhsyZE6eZYmT3m108U3JQ","Spirit Of Praise, Mmatema","Bina Moya Waka (Live)","Spirit Music",88,-1,1,"77073"
89,"spotify:track:2DTnuVhrGnLcmgutAW4vb1","Lwah Ndlunkulu, Siya Ntuli","Ithuba","Nkabi Records",33,85,55,"76396"
90,"spotify:track:2dHHgzDwk4BJdRwy9uXhTO","Metro Boomin, The Weeknd, 21 Savage","Creepin' (with The Weeknd & 21 Savage)","Republic Records",2,79,40,"76298"
91,"spotify:track:5U6zQqXCVZokE7UH4kdAB1","MÖRDA, Oscar Mbo, Murumba Pitch","Mohigan Sun","Asante Music (PTY)Ltd",36,66,30,"75739"
92,"spotify:track:43PuMrRfbyyuz4QpZ3oAwN","Bryson Tiller","Exchange","TrapSoul/RCA Records",75,75,83,"75710"
93,"spotify:track:7662sEny6elrNILSP7OzQB","Soa Mattrix, Sir Trill, B33Kay SA, Cnethemba Gonelo, Frank Mabeat, Tribal Soul","Athandwe","Soa Music Group",93,-1,1,"74080"
94,"spotify:track:1Qrg8KqiBpW07V7PNxwwwL","SZA","Kill Bill","Top Dawg Entertainment/RCA Records",5,83,39,"73824"
95,"spotify:track:5Dsuz6UsZyoWM3HOaRgQeC","Lloyiso","Seasons","Universal Music (Pty) Ltd.",62,128,98,"73386"
96,"spotify:track:2LBqCSwhJGcFQeTHMVGwy3","The Weeknd","Die For You","Universal Republic Records",35,101,69,"72523"
97,"spotify:track:7qEHsqek33rTcFNT9PFqLf","Lewis Capaldi","Someone You Loved","Vertigo Berlin",7,89,243,"71908"
98,"spotify:track:2f86Ae3R4OKAu1lEIqouih","Summer Walker, J. Cole","To Summer, From Cole - Audio Hug","LVRN/Interscope Records",12,86,16,"71190"
99,"spotify:track:5hJFhO9dvhJoDvUZZ9iWSw","Miguel","Adorn","ByStorm Entertainment/RCA Records",79,87,51,"71167"
100,"spotify:track:6n3HGiq4v35D6eFOSwqYuo","Drake","Teenage Fever","Cash Money Records/Young Money Ent./Universal Rec.",70,94,77,"70731"
101,"spotify:track:0Wa6EyiyMpByx1vmufeSc0","Elvirgo, Chicco, TallexQ","Malume (Nta Swi Byela Mani Revisit)","Gallo Record Company",32,57,12,"69512"
102,"spotify:track:3k79jB4aGmMDUQzEwa46Rz","Olivia Rodrigo","vampire","Olivia Rodrigo PS",37,93,10,"69278"
103,"spotify:track:2HbKqm4o0w5wEeEFXm2sD4","Kendrick Lamar, Jay Rock","Money Trees","Aftermath",49,97,72,"69183"
104,"spotify:track:1bDbXMyjaUIooNwFE9wn0N","Drake, 21 Savage","Rich Flex","OVO / Republic Records",1,99,44,"68634"
105,"spotify:track:4uUG5RXrOk84mYEfFvj3cK","David Guetta, Bebe Rexha","I'm Good (Blue)","Parlophone UK",8,103,54,"67843"
106,"spotify:track:1kKltSWkRUTB7LYVFJXS2w","Murumba Pitch, Omit ST, Nkosazana Daughter, Sipho Magudulela","Esangweni","Murumba Pitch",40,106,26,"67629"
107,"spotify:track:7KwYLXSSMH8h5kVS3amYEj","Kabza De Small, DJ Maphorisa, MaWhoo, Nokwazi, Mashudu, LeeArt","Ungiphethe Kahle (feat. Nokwazi, Mawhoo, Mashudu & LeeArt)","Piano Hub",54,98,4,"67476"
108,"spotify:track:2J6OF7CkpdQGSfm1wdclqn","Brent Faiyaz","Clouded","Lost Kids",86,95,34,"67421"
109,"spotify:track:7aRCf5cLOFN1U7kvtChY1G","Drake","Search & Rescue","OVO/Republic Records",5,91,22,"67401"
110,"spotify:track:1i9lZvlaDdWDPyXEE95aiq","Travis Scott, SZA, Future","TELEKINESIS (feat. SZA & Future)","Cactus Jack/Epic",28,96,6,"66605"
111,"spotify:track:4SHBNhM1S8QZgsx8pCdthw","Aymos, Jessica LM","Amandla","Lyf Styl Entertainment",111,120,6,"66303"
112,"spotify:track:05lM7Ep8UESoe3LV5yrew5","Lloyiso","Dream About You","Ambitiouz Entertainment",54,119,79,"65514"
113,"spotify:track:5fEB6ZmVkg63GZg9qO86jh","PARTYNEXTDOOR","Break from Toronto","OVO Sound",88,88,37,"64726"
114,"spotify:track:14SaZBTjxlorHJQxXh01Hu","Summer Walker, Drake","Girls Need Love (with Drake) - Remix","LVRN/Interscope Records",43,114,178,"64672"
115,"spotify:track:6PGoSes0D9eUDeeAafB2As","Kendrick Lamar, Zacari","LOVE. FEAT. ZACARI.","Aftermath",74,100,51,"64184"
116,"spotify:track:6w96SS19VqUpo8O9B8Hzzc","Makhadzi Entertainment, DJ Gun Do SA, Fortunator, Ntate Stunna","Movie (feat. Ntate Stunna, Fortunator, DJ Gun Do SA)","Makhadzi Entertainment",107,110,4,"63946"
117,"spotify:track:2IlT65thKQQw248mhk2PjQ","Brent Faiyaz","JACKIE BROWN","Lost Kids LLC., Marketed by Venice / Stem",52,111,28,"63573"
118,"spotify:track:1zi7xx7UVEFkmKfv06H8x0","Drake, Wizkid, Kyla","One Dance","Cash Money Records/Young Money Ent./Universal Rec.",78,108,121,"63145"
119,"spotify:track:3x3aen8g82ZErdMyGBuHNN","Loatinover Pounds, 25K, Thapelo Ghutra","Sosh Plata - Remix","Punyete Premier League",12,107,28,"63001"
120,"spotify:track:2Hh3ETdQKrmSI3QS0hme7g","Metro Boomin, Future, Don Toliver","Too Many Nights (feat. Don Toliver & with Future)","Republic Records",18,116,40,"62975"
121,"spotify:track:1vYXt7VSjH9JIM5oRRo7vA","Dua Lipa","Dance The Night - From Barbie The Album","Atlantic Records",86,105,7,"62964"
122,"spotify:track:65NAMIdsZkxYIM5ui8SJSw","K.O, Young Stunna, Blxckie","SETE (feat. Young Stunna & Blxckie)","Sound African Recordings",1,90,55,"62543"
123,"spotify:track:4tqcoej1zPvwePZCzuAjJd","J. Cole","Wet Dreamz","Roc Nation Records LLC",91,109,75,"62407"
124,"spotify:track:5wG3HvLhF6Y5KTGlK0IW3J","Metro Boomin, Travis Scott, Young Thug","Trance (with Travis Scott & Young Thug)","Republic Records",29,122,32,"62402"
125,"spotify:track:4Dvkj6JhhA12EX05fT7y2e","Harry Styles","As It Was","Columbia",1,113,75,"62277"
126,"spotify:track:4fYte8ZvTK14NEhAOZocBi","OneRepublic","I Ain't Worried","Mosley Music/Interscope Records",11,121,65,"61570"
127,"spotify:track:51fIDcNGiIp7pxHCCN5QaL","Tyler ICU, Khanyisa, Tumelo_za, Tyrone Dee","NGIMOJA (feat. Khanyisa, Tumelo_za & Tyrondee)","New Money Gang Records",1,92,29,"61436"
128,"spotify:track:3AN96mijpWgIeUEJpvCNaO","Barto","Impulsief","Select",92,158,39,"61085"
129,"spotify:track:2qp7rTcFVz67fz88JSnbkU","Uncle Waffles, Tony Duardo, Justin99, Pcee, EeQue, Chley","Yahyuppiyah (feat. Pcee, EeQue & Chley)","Encore Recordings",3,126,23,"60331"
130,"spotify:track:3BTszrSLAt9f11eWeHNTTc","Joyous Celebration","Ndenzel' Uncedo Hymn 377 - Live","Universal Music (Pty) Ltd.",107,140,28,"59870"
131,"spotify:track:2ktg2oZDyFAX3iY1QNkXl5","Summer Walker","Session 32","LVRN Records",87,134,48,"59613"
132,"spotify:track:5oMumOpP2Bavh3JyjbOqP5","Brendan Peyper","Toer Om Die Vloer","Select",132,164,28,"59019"
133,"spotify:track:7MXVkk9YMctZqd1Srtv4MB","The Weeknd, Daft Punk","Starboy","Universal Republic Records",80,133,73,"58754"
134,"spotify:track:4wVOKKEHUJxHCFFNUWDn0B","Drake, Giveon","Chicago Freestyle (feat. Giveon)","OVO",5,124,149,"58440"
135,"spotify:track:561jH07mF1jHuk7KlaeF0s","Eminem","Mockingbird","Aftermath",52,125,47,"58386"
136,"spotify:track:2JvzF1RMd7lE3KmFlsyZD8","J. Cole","MIDDLE CHILD","Dreamville, Inc., Under exclusive license to Roc Nation Records",2,127,127,"57870"
137,"spotify:track:2e3Ea0o24lReQFR4FA7yXH","J. Cole","Love Yourz","Roc Nation Records LLC",93,132,30,"57863"
138,"spotify:track:2mzM4Y0Rnx2BDZqRnhQ5Q6","Tems","Free Mind","Leading Vibe Ltd",68,130,73,"57760"
139,"spotify:track:2THbHmoRIjbGQgP0HylMbx","AKA, Nasty C","Lemons (Lemonade)","Sound African Recordings",2,135,51,"57703"
140,"spotify:track:1nYOtsnFaAUQOZndulgzNb","AKA, KDDO","Company","Sound African Recordings",1,102,29,"57315"
141,"spotify:track:0IJJ5q4ZkmC4kJvkF1HNIe","Appel","Foute","Warner Music Africa",102,165,16,"56955"
142,"spotify:track:3fvyqhNTjtobvYV8VYr5w0","Riaan Benadé","Spontaan","WM South Africa",72,160,131,"56920"
143,"spotify:track:1RMJOxR6GRPsBHL8qeC2ux","Daniel Caesar, H.E.R.","Best Part (feat. H.E.R.)","Golden Child Recordings",83,141,206,"56480"
144,"spotify:track:4JOP8ELK6AaeySe7sKe996","Alicia Keys","Un-thinkable (I'm Ready)","J Records",126,138,5,"56384"
145,"spotify:track:5R9zmvswQj0SRJ1XM0yTzU","Killorbeezbeatz","Ngilele E Hotel","Killorbeez Records",145,-1,1,"56337"
146,"spotify:track:3JyEmaZmPsuIvFivnwN22k","Glenn Jones","All for You","Jive",123,149,26,"56079"
147,"spotify:track:65ssk0NCbNtYDYgF86Tc65","Nathi","Imimoya","Gallo Record Company",147,188,2,"56044"
148,"spotify:track:70CWmghvBEJteWKBc8ZWPd","Nasty C, Benny The Butcher","Prosper In Peace (with Benny The Butcher)","Def Jam Recordings",148,-1,1,"55981"
149,"spotify:track:4QgyThcnKndiqqB5n6zx9d","MaWhoo, Kabza De Small, Da Muziqal Chef","Nduma Ndumane","Mawhoo",49,151,9,"55449"
150,"spotify:track:7zFXmv6vqI4qOt4yGf3jYZ","Daniel Caesar, Kali Uchis","Get You (feat. Kali Uchis)","Golden Child Recordings",119,142,35,"55398"
151,"spotify:track:5dQdnw6G1URbrpwnDOyZxt","Vigro Deep","Soundcheck","Rinse",103,137,7,"55275"
152,"spotify:track:3USxtqRwSYz57Ewm6wWRMp","Glass Animals","Heat Waves","Polydor Records",5,147,140,"55041"
153,"spotify:track:6F70m9aMK4PSJKBfp1H8DZ","Kabza De Small, DJ Maphorisa, Ami Faku","Asibe Happy","Piano Hub",1,157,75,"55001"
154,"spotify:track:2kaH2Z8ezDUKf6fNw250rZ","Davido, Musa Keys","UNAVAILABLE (feat. Musa Keys)","Columbia",73,148,23,"54854"
155,"spotify:track:2xyx0o4xNOLLjBSbOOdcbA","Summer Walker, Bryson Tiller","Playing Games (with Bryson Tiller) - Extended Version","LVRN/Interscope Records",37,153,70,"54776"
156,"spotify:track:4kjI1gwQZRKNDkw1nI475M","Travis Scott","MY EYES","Cactus Jack/Epic",15,129,6,"54701"
157,"spotify:track:6NB2npCHsGXQ059pMhXJzl","Barto","H2Oë","Select",92,173,33,"54589"
158,"spotify:track:78QR3Wp35dqAhFEc2qAGjE","Lil Baby, Gunna","Drip Too Hard (Lil Baby & Gunna)","Quality Control Music/Young Stoner Life Records, a 300 Entertainment Label/Motown Records/Capitol Records",41,155,99,"54135"
159,"spotify:track:3c6afiysmB7OnxQzzSqRfD","Tamia","So Into You","Rhino/Warner Records",119,136,14,"53787"
160,"spotify:track:5F7npl4FSAFQLsIuW3o7aR","Russell Zuma, CocoSA, George Lesley","Angikaze","Theko Price",89,167,28,"53663"
161,"spotify:track:7KA4W4McWYRpgf0fWsJZWB","Tyler, The Creator, Kali Uchis","See You Again (feat. Kali Uchis)","Columbia",57,139,21,"53626"
162,"spotify:track:3eRE1KwnUma75nu1HhoNY4","Tevin Campbell","Can We Talk","Rhino/Warner Records",135,143,35,"53579"
163,"spotify:track:2qxgejJTaZIHNSHDD22Uhl","Kabza De Small, DJ Maphorisa, Ami Faku","Abalele","Piano Hub",1,170,102,"53471"
164,"spotify:track:5w40ZYhbBMAlHYNDaVJIUu","Post Malone","Chemical","Mercury Records/Republic Records",67,166,11,"53249"
165,"spotify:track:1ULFJZX54HXXjSTMx63dk0","Kabza De Small, Msaki","Khusela (feat. Msaki)","Piano Hub",5,161,67,"53121"
166,"spotify:track:1xemKSmCnH59ze3KX5wwgH","Doja Cat","Demons","Kemosabe Records/RCA Records",166,-1,1,"52901"
167,"spotify:track:2eAvDnpXP5W0cVtiI0PUxV","Ruth B.","Dandelions","Columbia",56,150,85,"52820"
168,"spotify:track:0HaRLPnr887lcQM2YQzkff","Burna Boy, Ed Sheeran","For My Hand (feat. Ed Sheeran)","Spaceship/ Bad Habit/Atlantic Records",11,152,61,"52788"
169,"spotify:track:0RiRZpuVRbi7oqRdSMwhQY","Post Malone, Swae Lee","Sunflower - Spider-Man: Into the Spider-Verse","Republic Records",1,162,210,"52746"
170,"spotify:track:181RlW4FYWSzaV9xt8xUPQ","Riaan Benadé","Vat 'n Bietjie","WM South Africa",69,192,109,"52744"
171,"spotify:track:40iJIUlhi6renaREYGeIDS","Drake, Travis Scott","Fair Trade (with Travis Scott)","OVO",1,159,85,"52579"
172,"spotify:track:5uCax9HTNlzGybIStD3vDh","James Arthur","Say You Won't Let Go","Columbia",85,163,281,"52539"
173,"spotify:track:7jtQIBanIiJOMS6RyCx6jZ","Tom Odell","Another Love","ITNO/Columbia",45,168,77,"52511"
174,"spotify:track:7ErtOGQ9DwyQa3lwP77j4u","Ruger","Asiwaju","Promised Land Recordings",48,196,33,"52170"
175,"spotify:track:28PDHCkELl8cwOtCdksjWE","Combo M, Mr Nation Thingz, Cuba Beats, Sickoo, Rockess, DJ Sicky, Ndodana","Hotspot","Independent",175,176,3,"51870"
176,"spotify:track:5126E37MXDlVwL3GNsFE81","ChubbyCheeks","Kuyabongwa","ChubbyCheeks",111,187,9,"51551"
177,"spotify:track:7Ee6XgP8EHKDhTMYLIndu9","Elevation Worship, Brandon Lake, Chris Brown, Chandler Moore","Praise (feat. Brandon Lake, Chris Brown & Chandler Moore)","Elevation Worship Records",177,-1,1,"51503"
178,"spotify:track:6AQbmUe0Qwf5PZnt4HmTXv","PinkPantheress, Ice Spice","Boy's a liar Pt. 2","Warner Records",10,156,31,"51094"
179,"spotify:track:4yzk4gNqwHkBrVWgGcIiJF","Kharishma, Ba Bethe Gaoshazen","Matome","4397321 Records DK",138,182,12,"50665"
180,"spotify:track:46IZ0fSY2mpAiktS3KOqds","Adele","Easy On Me","Columbia",1,177,99,"50619"
181,"spotify:track:3uUuGVFu1V7jTQL60S1r8z","Lost Frequencies, Calum Scott","Where Are You Now","Epic Amsterdam",13,184,107,"50295"
182,"spotify:track:7cNUMPXO8gGjKnKkXVn5T0","Nasty C","No More","Universal Music (Pty) Ltd.",23,145,10,"50177"
183,"spotify:track:4fxwbUSI6jF4XdnvCUVG97","Elaine","You're the One","Columbia",12,172,91,"49991"
184,"spotify:track:3xWGA8pa0IKFI7IMPri4P0","Ed Sheeran","Shivers","Atlantic Records UK",11,189,104,"49885"
185,"spotify:track:4at3d5QWnlibMVN75ECDrp","6LACK, J. Cole","Pretty Little Fears (feat. J. Cole)","LVRN Records",11,179,124,"49800"
186,"spotify:track:3FAJ6O0NOHQV8Mc5Ri6ENp","Giveon","Heartbreak Anniversary","Epic/Not So Fast",3,178,129,"49605"
187,"spotify:track:4Sq2nuXtqS8K88WNVTGERf","Juanita du Plessis","Liewe Jinne!","JRECORDS",187,-1,1,"49449"
188,"spotify:track:0ZxhtATQ0a6EvQNZ0z6NKV","Ice Spice, Nicki Minaj","Princess Diana (with Nicki Minaj)","10K Projects/Capitol Records",19,174,21,"49431"
189,"spotify:track:1mXVgsBdtIVeCLJnSnmtdV","Sam Smith","Too Good At Goodbyes","PLG - Capitol",69,180,144,"49372"
190,"spotify:track:0VjIjW4GlUZAMYd2vXMi3b","The Weeknd","Blinding Lights","Republic Records",1,183,197,"49324"
191,"spotify:track:0DuWDLjriRPjDRoPgaCslY","Adele","Love In The Dark","XL Recordings",77,-1,20,"49285"
192,"spotify:track:4EWCNWgDS8707fNSZ1oaA5","Kanye West","Heartless","Roc-A-Fella",115,-1,9,"49260"
193,"spotify:track:0V3wPSX9ygBnCm8psDIegu","Taylor Swift","Anti-Hero","Taylor Swift",3,194,45,"49247"
194,"spotify:track:2up5Dd9llCPQT87KNaJ975","Naledi Aphiwe, Fezeka Dlamini","ZOJIKI IZINTO","Durban Base Entertainment",194,-1,1,"48964"
195,"spotify:track:4BIGl9cDzyw1znsjRytGLd","Kelvin Momo, Babalwa M, Chley, MaWhoo","Izono (feat. Mawhoo & Babalwa M & Chley)","Kelvin Momo Productions",12,199,39,"48931"
